query	98	bp own know child high blood pressure heart arteries subjected pressure 24 hours day 365 days year. inevitably wear tear age. however bp high normal wear tear speeds up. heart blood vessels become likely undergo damage. certain organs also become particularly vulnerable injury high blood pressure notably brain kidneys. another term high bp hypertension. bp low hand body organs receive blood circulation need function properly. minimal exercise minimal fast food common cause high blood pressure children. main factors cause high blood pressure children tendency retain salt sodium water increases volume fluid body including within blood vessels. greater volume greater pressure. many people high bp restrict salt diet take medications eliminate salt via kidneys diuretics . activation several hormones kidney nerve signals results constriction narrowing arteries carrying blood. greater narrowing greater pressure. time people develop stiffer arteries leading greater demands heart greater need higher pressures propel blood body. obese children greater risk. however children high blood pressure obese discount symptoms child weight average average. otherwise healthy children common medications cause high blood pressure happen. concerns often arise child taking methylphenidate ritalin stimulants adhd found elevated bp. although drug may increase bp usually mild increase. nevertheless would sensible test child blood pressure methylphenidate sure causing problem. less commonly used medications cause high bp including immunosuppressive drugs prednisone related steroids tacrolimus cyclosporine. many medications counter drugs herbal nutritional supplements may able raise bp commonly occurs someone already hypertension reasons. sure give provider complete list particularly bp elevated. infants toddlers hypertension. identifying hypertension depends increased parental awareness higher risk situations appearance symptoms described section 3 below. conditions frequently cause high blood pressure infants require particular attention include infants born prematurely complicated medical courses. infants prematurity related lung disease. newborns mothers using addictive drugs pregnancy infant drug withdrawal infants children heart murmurs. infants known kidney urinary tract abnormalities. infants abnormal skin pigmentation. child family history polycystic kidneys children unexplained seizure disorders. child high blood pressure learn measure home. learning monitor child blood pressure home help get accurate reading child bp get nervous doctor office. make medical monitoring much easier trips office less frequent. however main obstacle unless child adult size may difficult find affordable monitors use home. keep mind measurement must accurate. although bp varies minute minute averages trends important. people high bp even 4 5 mmhg makes difference comes health risks hypertension. bp cuffs big small give incorrect results. kids easy way select proper size measure distance tip shoulder elbow crease. calculate distance. use bp cuff width close number possible. cases number falls sizes choose larger two. cuffs come widths 9 centimeter 3.5 . 3.5 in. 12 centimeter 4.7 . 4.7 in. 15 centimeter 5.9 . 6 in. 18 centimeter 7.1 . 7 in. 18 centimeter 7.1 cuff large adult usually necessary older obese children. alternatively purchase long 15 cm adult size cuff accommodate greater arm circumference. attach bp cuff wrapping around upper arm elbow joint. cover crease inside elbow joint. notice arrow cuff cuff applied arrow pointing elbow crease. take manual bp placing stethoscope child arm cuff usually elbow crease. one major arteries supplying blood forearm hand located. feel artery pulsating gently pressing elbow crease much better. head stethoscope placed pulse pressing lightly. sure twist valve base rubber bulb cuff completely closed. inflate cuff squeezing rubber bulb repeatedly dial indicate increasing pressure. pump reach pressure likely child bp around 140 mmhg measurement unit young kids 150 160 primary school age 160 170 teens. cuff pressure momentarily blocks blood flow artery. cuff slowly deflated listen artery. pressure cuff drops pressure artery blood begins flow past cuff. initial spurt easily heard stethoscope recorded systolic bp. cuff continues deflate sound eventually disappears. recorded diastolic bp. range considered normal bp increases throughout childhood. normal bp 15 year old might high blood pressure 5 year old. 90th 95th percentiles useful thresholds elevated bp given child. example 90th percentile bp 90 100 normal children would expected bp 90th percentile. 95th percentile 95 100 normal children would expected bp level. bp 90th percentile 95th percentile called pre hypertension . range increased risk eventually developing hypertension. likewise bp 95th percentile considered hypertension. look percentiles child using information available medical provider tedious must also know child height percentile. although children hypertension symptoms moderate severe headaches may indicate hypertensive crisis. throbbing often noted early morning upon awakening. children brain related symptoms usually blood pressure treated hospital frequently intensive care unit. blood pressure must reduced promptly essential reduce controlled rate risk brain receiving inadequate blood flow high bp drops fast. general rule thumb bp quickly reduced 15 25 controlled following days. although children hypertensive strokes common symptoms caused brain exposure high pressures confusion unexplained vomiting double vision abrupt loss vision seizures. chest discomfort pain rapid heart beat difficulty catching breath shortness breath may occur often heart struggling pump blood high pressures. blood urine may occur due kidney injury caused hypertension particularly underlying chronic kidney disorders. also important aware sudden severe hypertension may occur result development kidney disease glomerulonephritis variety kidney inflammation . case blood urine kidney disease hypertension. current pediatric care guidelines recommend regular measurement bp routine check ups beginning age 3 years. since children high bp initially symptoms cases discovered routine measurement doctor visits. unfortunately also difficult obtain accurate measurement office particularly younger children. child level activity shortly measurement feelings anxiety anticipating shot emotional state body temperature affect bp. initial office bp compared several others later visit first measurement frequently higher rest. many potentially confusing factors may easy explain away ignore elevated measurements. result real high blood pressures may missed. office bp initially elevated sure repeated least twice visit. repeat measurements normal hypertension unlikely. bp remains high confirmed repeating bp measurements several times following weeks. least two measurements visit child seated comfortably quietly least 5 minutes pressure taken. repeated measurements home done cuff appropriate size child available excessively large small cuffs give inaccurate results see .
query	99	carolina panthers play become mortgage broker north carolina north carolina law states north carolina lenders originators mortgage brokers must licensed. cases banks credit unions exempt licensing since overseen federal reserve national credit union administration. licensed mortgage broker already licensed north carolina lender mortgages. mortgage broker defined north carolina law person receive compensation working north carolina mortgages. create individual account nmls website. new applicants must complete mu4 paperwork. pay appropriate nmls application fees mortgage license fee. notify nccob within 30 days change documents submitted application. check results criminal background check nmls website individual account. mortgage loan originators must least 24 hours mortgage loan education approved nmls. education hours must include 3 hours ethics. 3 hours federal regulations law. 4 hours north carolina regulations laws. 2 hours lending standards. 12 hours origination mortgage loans. 8 hours continuing education required year laws regulations ethics lending standards. see website commissioner banks north carolina http www.nccob.gov public find date list approved schools licensing education. nmls provide testing handbook outline test content test preparation. receive pass fall information upon leaving testing center. official test results emailed within 72 hours. test retakes require waiting period 30 days. credit report must approved north carolina state regulator. nan office contain necessary records files. nmls change status approved inactive new employer submits sponsorship request.
query	100	chicago white sox win chicago white sox fan want intimidate team fans looking like members darth vader army good guys always wear black. cell also looks better everyone dressed black plus color makes look slimmer easy find find stores. team wear fine too. need understand baseball know situation. sure enjoy sun beer dogs. baseball fun. time pay attention game ready voice approval anger. charter member american league sox long often history. unique even controversial. going defend clubs reputation need fans love hate south siders need actual fact. shy away colorful history white sox gritty real team working folks. sox fan grilling bags game. across street ward hq oldest restaurant bar city chicago. basic old school filled like minded locals. usually focus around ballpark used way women look stands way cubs cursed farm animals. understand white sox superior cubs anything related actual play game. get bond fans. includes home runs balls hit opposing team. respect field keep clean. nan
query	101	espn watch watch espn online use link type www.espn.com browser search bar. right side menu bar near top browser window. variety programs displayed page. programs key icon next watched immediately online information credentials. programs key icon next require identify cable satellite provider sign credentials watch. way similar iphones ipads android devices iphone ipad open espn app store tap get tap install. android open espn google play store tap install. follow screen prompts set preferences. red video monitor white triangle lower right corner screen. scroll necessary. nan follow screen prompts provider. middle screen starts streaming. use link type www.slingtv.com web browser search bar. slingtv online provider streaming tv channels. paid service lowest cost subscription 20 month may 2017 includes espn espn 2 espn 3 couple dozen channels. need cable satellite tv subscription use slingtv. blue button right side screen. offerings include espn properties. follow screen prompts so. watch online computer use slingtv app iphone ipad appletv android androidtv chromecast roku amazon device. watching espn online without cable satellite tv subscription.
query	102	fedex call contact fedex fedex different numbers depending need though one main customer support number. find full list numbers fedex website including one appropriate problem need.the main customer support number u.s. international calls fedex office 1 800 go fedex 1 800 463 3339. also use number problems commercial printing accounts well find local print shop center. main number general customer support us customers international customers number 1 800 247 4747. need tdd service telephone device deaf call 1 800 238 4461if want contact fedex corporate offices dial 800 number 1 469 980 3000. need country toll free number look country page http www.fedex.com us customersupport call . need click region find country number. dial main number given number automated options. choose options need touchtone phone. luckily phones today touchtone probably need worry. however touchtone phone fedex voice operated option meaning simply say need automated system direct you. phone number go list options. instance pressing 1 take schedule pickup option 2 take track package. option 3 let find local store option 4 lets order supplies 5 takes current rates shipping.if need claims press 61 62 billing 63 technical support. want see options call view http www.fedex.com us customersupport call phonemenu.html. want go options simply skip talking representative point right direction. get representative press 0 soon line picks up. navigate fedex email contact form online. fedex one email customer relations. rather must fill contact form send email. web address form https www.fedex.com us customersupport email office fxo.html. instance choose labels account inquiry assistance print order status fedex office store feedback online print technical support. none options suit inquiry choose other. also need pick type inquiry. instance question complaint compliment fedex need put basic information name address. also request email address. though information required give fedex information need help you.if question specific shipment fedex want information shipment sender name tracking number date shipped recipient name. finally need fill comment box. basically need tell contacting short message. make sure include kind response want comment. file claim online online claim form http www.fedex.com us fcl pckgenvlp online claims . also fill form send company fax mail. fill online log fedex automatically fill information shipment. need fill information like company name person name address email sender recipient. also need tracking number shipment filling claim for. next need fill sending claim. send claim lost package instance. also turn claim package damaged transit turn damaged merchandise.if choose damaged need keep package along packaging materials fedex inspect choose so. also need describe damage package. filling online simply submit form turn in. filling form send send fax mailing fedex physical address. also use email send in..to email use address file.claim fedex.com. fax use number 1 877 229 4766. mail use address fedex cargo claims dept. p.o. box 256 pittsburgh pa 15230.
query	103	fifa watch good fifa 1 new playing football soccer learning basics top priority. browse articles internet make sure familiar soccer guidelines try hand game. though fifa 13 video game game rules regulations based real ones. watch matches ask someone know fan sport explanation rules may understand immediately. fifa 13 fighting game playing like one much help. every push button affects players play field. since fifa 13 played various platforms like ps3 xbox wii learning buttons great help you. one way go controls playing tutorial mode accessible main menu. hours play time get want terms mastering game. keep playing matches regardless whether win lose make familiar entire game rules. time face players online attack defend using instincts familiarity controls. take advantage team offensive strength. great strikers like william jos team use plays emphasize make openings striker score goal. hand team specializes defense create plays stop team scoring goal. goalkeepers like nicola leali team definitely strengthen defensive plays. also defending fifa 13 one game failing points simply really hard game. take opposing team players one one. instead control players work team defend group rather individually. keep tackling players ball. majority teams fifa 13 technical players average ones easily lose control ball pressured giving possession. use plays make players trail whoever carrying ball. mindful fouls since likely commit one pressure team. practice ball rotation. football field wide easy find opening. player carrying ball gets cornered hesitate pass ball another member team. quickly passing ball around field also effective way disrupt opposing team defense formation. patience one tools surely need playing fifa 13. hurry get across field score goal. plan attack defense carefully study opposing team moving playing field. good timing easily steal ball score goal flawlessly.
query	104	ford motor company sell identify ford motor valve cover bolts big bolts top engine holding plate usually marked ford top valves. number bolts corresponds engine type help locate useful id tag. 2 bolts 239 256 272 292 312 5 bolts 332 352 360 361 390 391 406 410 427 428 6 bolts 221 260 289 302 351w 7 bolts 429 460 8 bolts 351c 351m 400 tag series numbers letters etched used decipher year make model engine. found underneath bolts left right side engine near front car. find tag six cylinder engines made 1964 v8 engines.the tag roughly three inches long half inch wide made aluminum. unsure kind engine think back valve cover bolts work following steps. help narrow options. check dipstick small plastic handled piece lets check oil. last places tag might be. may removed fallen visible engine car. depending find tag learn something engine indicator bulb 360 330 391 engines. dipstick tube 352 engines. carburetor stud 401 477 534 engines. found identification tag need know read get right information. luckily tags simple breakdown. upper left bottom right cubic inch displacement cid first three numbers found upper left corner tell size engine. manufacturing plant single letter right cid engine built. c cleveland e ensite canada w windsor canada. year next two numbers year engine built. 70 example would mean made 1970. month built hyphenated number letter correspond month. months alphabetical order january december. people confuse number 1. 0 would mean january 1970 5 c march 1975 etc. assuming year code 70 . engine code number final 3 digit number id particular engine. look code online see specs current engine. casting tag etched motor created used help find right parts need replacement. code also packs large amount information help get know engine better. may need clean engine rag degreaser dirty see letters. code usually side engine might able see engine car older models. use light scan sides engine find it.ex.c5ae 9425 b letter. letter b means engine built 1950s. decade succeeding letter c designates 1960s designates 1970s on. digit letter actual year. c9 would 1969 e4 would 1984 etc. letter signifies basic design vehicle shown below. course code match car ie. mercury could coded e5m may dealing standalone engines redesigned cars. generic full size engine falcon e truck f foreign trans racing g 1961 1967 comet 1968 1976 montenegro h 1966 1982 heavy truck j industrial ford l lincoln mercury 1967 1976 ford torino ford fairlane thunderbird truck w cougar meteor z mustang 6 pantera e stands engine always fourth digit see identifying ford motors. four numbers always 6000 6898 describes part numbering generic engine assembly. different parts motor correspond different four digit numbers. engine modeled original design letter a. third manufactured version engine c on. digit three digits long. example ab would 28th version 26 z two b.
query	105	ibm join install ibm java ubuntu linux check vendor version java system running following commands type copy paste java version type copy paste javac version make note vendor version java nan references oracle java jdk jre files comment using symbol. type copy paste sudo nano etc profile type copy paste sudo gedit etc profile create directory hold ibm java sdk jre move downloaded ibm java sdk jre opt ibm java directory. unpack java sdk jre. use text editor nano gedit edit file. type copy paste sudo nano etc profile type copy paste sudo gedit etc profile also inform system ibm java javac compiler must default compiler. type copy paste sudo update alternatives set java opt ibm java ibm java x86 64 70 bin java type copy paste sudo update alternatives set javaws opt ibm java ibm java x86 64 70 bin javaws type copy paste sudo update alternatives set javac opt ibm java ibm java x86 64 70 bin javac etc profile note system wide path etc profile file reload reboot ubuntu linux system reboot ubuntu linux system system reload etc profile system wide path file. set run develop ibm java programs ubuntu linux system.
query	106	isuzu motors build change egr valve 1998 isuzu trooper nan make reprogramming easy write programmed radio station button settings disconnecting battery.
