query	1	benchmarking have use fraps based needs may choose either free paid version fraps. free version several limitations paid version not. free version fraps record clips 30 seconds shorter paid version length limit. displays fraps watermark top recorded footage. loop recording disabled. note unlike many programs fraps default installation location c fraps c program files fraps. unsure open program look c directory. hotkey keyboard key press game begin recording video. set hotkey click box labeled video capture hotkey press button keyboard. default recording hotkey f9. choose hotkey use game. fraps works minimized. see numerical value corner game window. frame rate overlay represents game current frame rate. overlay turn red. signifies recording video. stop recording press hotkey again. remember free version fraps allows recording 30 second increments. select fps tab top fraps window look yellow 99 . see options fraps benchmarking frame rate overlay functions. frame rate measure fast game running. frame rates usually measured frames per second fps. motion computer games actually illusion created rapidly changing series still images called frames. images shown per second smoother clearer motion game appear. frame rate overlay feature displays game current frame rate one corner screen. graphically intense portions game result low frame rate overlay display fluctuations game frame rate. benchmarking process game average frame rate calculated certain length time. click boxes labeled benchmarking hotkey overlay hotkey press key keyboard want use turn benchmarking overlay functions playing game. default benchmarking overlay hotkeys f11 f12 respectively. choose hotkeys buttons use game. depending preferences may choose enable disable certain options page. select length time benchmarking select additional metrics benchmarking measure select corner screen overlay appear in. frame rate overlay choose corner screen obscure vision hide vital information gameplay. would like create benchmark frame rate overlay press hotkey decided on. benchmark overlay appear within game. select screenshots tab top window. find options adjusting screen capture settings. screenshot screen capture still image gameplay. free versions fraps save screenshots .bmp files. paid versions save .bmp .jpg .png .tga formats. click box marked screen capture hotkey press button keyboard want use take screenshots game. default screenshot hotkey f10. choose hotkey use playing game. screenshot tab several options customizing fraps screenshot feature. change image output format paid version fraps. choose whether include framerate overlay screenshots. set repeat timer taking multiple screenshots. fraps continue run background. frame rate overlay turn white brief moment possibly lag . signifies captured image gameplay.
query	2	bodybuilding take begin bodybuilding anyone start bodybuilding different reasons. example markus ruhl german giant bodybuilding freak fans called him. try create reasonable goals. whatever reason decide bodybuilding beginner start lose fat gain weight build muscle become fitness model become professional bodybuilder get shape determine goal start journey bodybuilding beginner whether female bodybuilder beginner male beginner much easier achieve maybe inspires higher goal. ask better you. beginner female bodybuilder male beginner train gym full big muscle bodybuilders train gym personal trainer help achieve goal. 10 survive achieve goals. imagine beginner female bodybuilder succeed trained without help course everyone pay personal trainer quite quickly. training partner important. especially bodybuilding beginner. take friend goal train find lot training partners gym. choose happens. point training partner give support motivation need achieve goal. many gyms offer services personal trainer access tell body type kind food eat advise training plan match goals . also ask doctor diet tell bodybuilding training program start benefits sides especially beginner female bodybuilder needs special care . gather much information lot topics important related goals nutrition effect progress body types kind nutrition suitable bodybuilding supplements take some. find bodybuilding training program according goal body type beginner female bodybuilder beginners male bodybuilder. knowledge help achieve goal teach develop it. 90 bodybuilding beginners go trick called high hopes.everyone wants go gym today wake next morning yoked like arnold months training feels disappointed stops starts take supplements gain muscle fast dangerous especially bodybuilding beginners male also beginner female bodybuilder failed get want fast lose fat example gets disappointed stops training. patient train hard get want. nan important bodybuilding. bodybuilding beginner like anyone us eats 3 meals day start bodybuilding number must increase 6 7 meals day according weight training program body type ....etc. succeed challenge first ask doctor best diet depend mentioned elements . second divided meal 3 big meals 6 7 small meals go next level bodybuilding beginner face difficulty body handle challenge. best succeed. injuries common problem type athlete highly prevalent bodybuilding community due physical psychological stress placed body. injuries cause lose gains made cause miss workouts lead poor sleeping habits even end promising career advice every bodybuilding beginner patient train hard take care body win challenge. bodybuilding beginner motivate time reach target lose motive lose road end line target one powerful tools bodybuilding beginner use keep record progress make notes help achieve target soon possible controlling mistakes less motivation may happen keep track achieve goals food guide food scale fat clipper gym bag
query	3	brainstorming brainstorm brainstorm small business ideas need know hope gain brainstorming. whether hope clarify business model come business idea product find solution customer need absolutely clear purpose discussions. want end completed business plan product design write objective place prominently brainstorming space keep team track. regardless whether actual business idea yet need starting point brainstorming ideas flow. small business ideas typically start something founder notices like kind unmet need community idea improve process. sudden insights result noticing small things years work certain industry profession. whatever idea caused bring people together think small business define move forward there.it also important clearly succinctly define starting point impetus brainstorming session everyone focused input outcome. successful companies started combination recognized need market new technology. example google combined people need find things easily online proprietary search technology. good starting place could either one two parts. starting point necessarily solid business product idea. instead goal like making money creating unique product gaining market share. difficult start guidance deciding exactly future business make. however also opens limitless possibilities. even solid idea determining want business help long term planning. invite people think way you. successful brainstorming comes different opinions perspectives. allow people share viewpoints problems experiences. example could brainstorm small business experts set meeting mentor business leader respect admire. pitch ideas expert welcome feedback. willing hear positive comments negative criticism.express gratitude everyone helped. people brainstorm sure say thanks team brainstormed you. time valuable resource people appreciate acknowledgement help insight. brainstorming location almost important team select. make sure choose relatively quiet location free outside distractions noise. remove electronic devices room except computers used research. provides team members individual notepads write ideas. whiteboard chalkboard large pad central location keep track everyone ideas. consider playing music enhance creative thought. try using classical music without words. provide drinks like water coffee keep team hydrated focused.it may help team get area usually meet like going retreat simply going outside park. changing surroundings help see new perspectives change thought patterns. read articles search internet watch videos subjects relevant business ideas brainstorming. information better decisions make. also look past attempts anyone else made solve problem addressing fix product focused on. right attempt go wrong bringing type context discussions help shape ideas.learn industry hoping get into. look organization major players relevant government regulations. also reach business connections involved industry get thoughts certain aspects market. group members brainstorm idea individually collect notes google doc dropbox folder. everyone review everyone else ideas individually come new thoughts. finally come together group share new ideas. way start broader base ideas. many successful startups disruptive offer something completely new market eventually changes market functions. think uber airbnb perfected new solutions common problems. solutions one sure would work practice stood current status quo respective markets. start try breaking consumer need imperfect product essence. service provided ignore current solutions think news ways problem solved. address current assumptions product service directly writing down. think ways around assumptions ways replace them.some successful new companies simply make change prevailing business model industries necessarily changing product offerings need addressed. focus much offering forget potential benefits better business model. brainstorming cannot work limitations put creative process. treat every idea member brainstorming idea way developing asking questions either deemed impractical graduates good idea list. agree consider ideas regardless impossible seem. fact coming terrible ideas beneficial creative process. try coming worst ideas think illegal impractical expensive ideas . try change ideas make better ideas. process help think problem new ways. brainstorming requires ask specific general questions every aspect idea. try ask questions force team consider alternatives rethink assumptions continue current train thought. leave questions open ended allow team members ample time think respond. assign group member secretary scribe meeting. record everything discussed ideas choose move forward progress stopping point. allow pick left next session. likely come million dollar idea first try. persistent meet regularly brainstorming group different groups come new ways thinking. idea may come later session completely unexpected time. make sure save notes previous sessions lose progress.be sure evaluate process. finish brainstorming take time note worked well work coming small business ideas. help future brainstorming strategy sessions. best ideas useless see way develop fully functioning business. come several brainstorming assess ideas using following criteria right person build idea experience technical know required solve problem better competitors customers want product service product useful theory enough make customers actually pay it. idea solve problem customer effectively efficiently market ready consider potential competitors barriers entry may present. also think whether enough prospective customers keep business afloat. consider operations. make business structure build provide product service importantly gather capital required develop build prepared challenges opportunities come small business ideas brainstorming. example think following money need start. brainstorm much capital required start small business. talk best ways raise money whether loans investors. logistical factors involved. list operational aspects small business need attention including staff inventory physical space business marketing costs. timeline. figure much time take start small business turn success. long term plan. figure needs done first next steps that. best idea chosen according important criteria. first assess cost. come money needed pursue idea consider business ability create product service. expertise capability capacity needed finally look competitive advantage ideas. create idea faster better cheaply competitors idea passes criteria move forward it. completed brainstorming vision small business write down. abbreviated business plan simply framework business much information currently rather full business plan. start one sentence description idea. effect product service write short description product service using information thus far. write know business organization management structure distribution model pricing plan. determine might cost develop produce product prepare provide service. include potential start costs. include know market competitors market share trends potential customer base. way know business plan work try it. start asking around colleagues connections form team make idea happen. begin networking people industry trying enter. come ways finance business. importantly continually refine idea product good enough take market.
query	4	chain smoking start smoke e cigarette new e cigarettes may want start e cigarette kit purchased online. many light medium smokers go rechargeable starter kit instead disposable one e cigarette used many times cost effective.an e cigarette starter kit contain rechargeable battery charger nicotine liquid cartridge. nicotine liquid come variety flavors different levels nicotine. smoker trying quit may go low level nicotine flavor enjoy tasting mouth limit nicotine intake. get starter kit several different flavor cartridges try different flavors find ones enjoy. e cigarette starter kits cost 40 100. consider investing kit higher price point plan smoke every day least several times week. going cheap kit may mean lower quality poor flavor choices. e cigarette runs lithium batteries important fully charge battery using it. many e cigarettes come battery partly fully charged. make sure battery ready go placing charger waiting charged signal light come on.most batteries e cigarettes rechargeable last 250 300 uses. batteries often last longer recharged used regularly. avoid placing batteries direct sunlight heat. get wet drop often hard surface significantly reduce lifespan. try charge battery completely drained always store batteries fully charged. storing batteries less 50 charge left drain use long term. battery fully charge e cigarette take charger. take liquid cartridge screw slot e cigarette. e cigarette may come pre filled liquid cartridges may buy e liquid drop liquid cartridge.pay attention liquid cartridge note liquid cartridge close running requires changing. planning regular e cigarette user may want keep several extra liquid cartridges hand easy replacement. usually smoke traditional cigarettes may used taking quick short drags smoking several cigarettes time chain smoking. smoking e cigarette important learn take long slow draws vapor fills mouth. also avoid chain smoking e cigarette. take three seven draws time take break. allow minutes e cigarette cool give throat rest.smoking much e cigarette time smoking e cigarette long lead throat irritation soreness well taste bud burnout also known vaper tongue . give throat mouth rest e cigarette sessions develop irritation numbness smoking. warm e cigarette start primer puff. quick inhale mouth e cigarette heat coil. pull vapor e cigarette get e cigarette primed first draw. inhale take slow steady draw vapor fills mouth. draw vapor lungs swallow vapor vapor first filled mouth. held vapor mouth three five seconds inhale lungs. exhale slowly nose mouth.unlike traditional cigarettes absorb nicotine e cigarette body mucus membranes mouth well lungs nose. smoking traditional cigarettes usually wait eight seconds hit nicotine. e cigarettes nicotine absorption occurs slowly mucus membranes take 30 seconds hit you. though may need get used waiting bit longer nicotine fix easy get used using e cigarette times.some smokers crave distinct hit nicotine back throat may feel e cigarettes provide strong enough throat hit. often longer drag e cigarette vapor produced mouth stronger throat hit be. flavoring e liquid also affect amount vapor produced. may want switch tobacco based flavor seeking stronger throat hit e cigarette. well may want try e liquid higher nicotine level distinct throat hit. keep mind higher nicotine level lead prolonged smoking health issues like cancer respiratory disease.
query	5	funding get funding apply legal funding two primary types legal funding. differ slightly understand type funding seeking direct plaintiff funding. already lawyer filed lawsuit. lender give cash advance pay living expenses. cash advances typically range 2 000 15 000 amount. win case repay amount borrowed plus interest. litigation cost funding. might need money pay costs lawsuit expert witnesses court reporters investigators. sometimes might even need money pay lawyer fees. lender sends check attorney periodically. plaintiff lawsuit agree pay back amount advanced plus either interest percentage amount win. lawyer cooperation key obtaining legal funding. need talk legal funding company answer questions case. lawyer also complete paperwork obtain funding. legal funding grown past couple decades shortage companies contact. know start perform general internet search. type legal funding type lawsuit e.g. personal injury. legal funding companies specialize certain kinds injuries. example may fund civil rights lawsuits personal injury lawsuits. companies also fund lawsuits certain states.check whether operate state. also check whether company funds pre settlement post settlement. companies advance money already settlement place. post settlement companies. list companies perform depth research. want sign shady company scammer. instead research company reputation. search online. type company name complaints. look around see anyone complains ripped off. contact state attorney general office ask company sued. check better business bureau. look city company headquarters. pay attention complains company. everyone lawsuit qualifies legal funding. instead company analyze strength case. advance funds think win. legal funding loan. lose owe funder money.for reason closely analyze case see merit. many companies experienced lawyers staff assess strength case.you also talk lawyer whether case strong enough approach legal funding companies. lawyer representing contingency take cut settlement court judgment. read fee agreement engagement letter see much. realize settlement funding company take another percentage. example might win 200 000 settlement. lawyer could take 40 leaving 120 000. legal funding company might fund 5 10 claim.this means could pay another 20 000 plus interest reduce take home amount 100 000 less. consider whether options. example friends family might let move give interest free loan pay back receive settlement. applying legal funding company talk someone ask questions. want understand agreement entering. example may want ask following charged start fee hidden fees percentage lawsuit fund large cash advance get much interest charged generally consumers charged annual interest rate 51 156 .this add quickly. pay legal funding company immediately receiving settlement make monthly interest payments company provide additional services. litigation cost funding company may provide case assessment. contact legal funding company ask apply. companies let apply online.generally asked following information personal information name contact info etc. state case filed type case persona injury civil rights etc. name lawyer lawyer contact information make sure thoroughly read contract signing. sign unless agree everything it. show contract attorney well. states maine law list requirements must contract legal funding.check company paying you. might receive lump sum payment monthly installments.for direct plaintiff funding lawyer may also sign acknowledgement form document.to make things easy meet sign together. receive money soon signing contract. depending legal funding company might receive money one following ways transfer western union wire directly bank account check
