query	53	flood pevent buy flood insurance may live high risk flood area moderate low risk flood area. live high risk area required flood insurance. live lower risk area buy flood insurance recommended. visit national flood insurance program nfim website type address see risk profile.your risk profile tell level risk average flood insurance claim state average insurance premium whether required purchase flood insurance. flood maps available online local federal emergency management agency fema offices. want estimate value property personal belongings. value property includes home electrical plumbing systems appliances permanently installed carpeting central air conditioning heaters window blinds. personal belongings include clothing furniture electronics portable air conditioners portable microwave ovens washers dryers items original artwork furs.flood insurance cover cars motorized vehicles belongings property home exterior cash living expenses decks patios fences bonds precious metals may lost flood. basement coverage limited. sure ask agent specific details policy purchase it. nfip managed federal emergency management association fema . community member nfip purchase flood insurance program. community part nfip may purchase flood insurance private market. visit fema website determine community part nfip.over 22 000 communities joined nfip. high risk community probably already member. fema sends notice communities sanctions community join within one year. community part contact respective state coordinating agency nfip fema regional office get community join.visit fema website find list offices agencies. cannot purchase flood insurance own. must work agent. visit nfip website find agent area. enter zip code receive list agents area. agent help purchase policy meets needs.all agents listed agreed participate federal floodsmart referral program. may want check agency handling homeowner insurance may get discount one policy company. may also call 1 888 379 9531 find agent. agent team. take active role process asking right questions. questions need ask buy download list federal government back policy pay policy flood risk community participate nfip covered policy flood insurance mandatory property much coverage get required pay fees eligible discounts premium renew policy community participate community rating system crs policy offer replacement cost value actual cost value difference two values agent may ask elevation certificate. certificate confirms elevation lowest floor house relation ground. certificate particularly important live high risk area. ask agent home built community initial flood insurance rate map firm . home built firm need purchase elevation certificate.if community participates crs elevation certificate already file local officials. need purchase one case. elevation certificate could lower cost premium. talk agent see need purchase certificate. need purchase agent help process. cost purchasing elevation certificate depends location home difficulty measurement. range 500 2 000.be sure need certificate spend money. flood insurance different types insurance. payment due sign application agent. pay credit card cash check money order. escrow account mortgage lender lender may allow pay account. lender already escrows taxes insurances flood insurance mandatory premium automatically escrowed well. talk agent pay complete application. community part nfip get insurance private company. many private companies offer flood insurance may pay higher premium. check current homeowner insurance agent see offer non federal flood insurance. flood insurance agency company provides flood insurance 20 states. check mortgage lender make sure accept non federal flood insurance policies. usually takes 30 days date purchase policy effective. something happens within 30 day period may coverage. exceptions 30 day rule.if home recently added special flood hazard area sfha purchased insurance within 13 months change one day waiting period. property flooded due wildfire containment burned federal land purchase policy within 60 days containment date waiting period. must renew policy every year. insurance company fema send reminder time renew. always go deductible amount coverage paying renew. may need make adjustments.you must work agent renew policy. cannot find agent contact information call national flood insurance program help center 1 800 427 4661. deductible pocket cost. amount must pay insurance kicks in. separate deductible building contents building.the higher deductible lower premium. insurance cover expenses. limits building limits contents. standard policies following limits contents one four family home 100 000 building one four family home 250 000 building residential structures 500 000 contents residential structures 100 000 contents rented property 100 000
query	54	anti-gravity create an anti gravity propulsion system calculate tension physics tension given strand string rope result forces pulling rope either end. reminder force mass acceleration. assuming rope stretched tightly change acceleration mass objects rope supporting cause change tension rope. forget constant acceleration due gravity even system rest components subject force. think tension given rope g g acceleration due gravity objects rope supporting acceleration objects rope supporting. purposes physics problems assume ideal strings words rope cable etc. thin massless stretched broken. example let consider system weight hangs wooden beam via single rope see picture . neither weight rope moving entire system rest. know weight held equilibrium tension force must equal force gravity weight. words tension ft force gravity fg g. assuming 10 kg weight tension force 10 kg 9.8 s2 98 newtons. gravity force affect tension rope force related acceleration object rope attached to. instance suspended object accelerated force rope cable acceleration force mass acceleration added tension caused weight object. let say example 10 kg weight suspended rope instead fixed wooden beam rope actually used pull weight upwards acceleration 1 s2. case must account acceleration weight well force gravity solving follows ft fg ft 98 10 kg 1 s2 ft 108 newtons. object rotated around central point via rope like pendulum exerts strain rope caused centripetal force. centripetal force added tension force rope exerts pulling inward keep object moving arc straight line. faster object moving greater centripetal force. centripetal force fc equal v2 r mass v velocity r radius circle contains arc object motion. since direction magnitude centripetal force changes object rope moves changes speeds total tension rope always pulls parallel rope towards central point. remember also force gravity constantly acting object downward direction. object spun swung vertically total tension greatest bottom arc pendulum called equilibrium point object moving fastest least top arc moving slowest. let say example problem object longer accelerating upwards instead swinging like pendulum. say rope 1.5 meters 4.9 ft long weight moving 2 passes bottom swing. want calculate tension bottom arc highest would first recognize tension due gravity point weight held motionless 98 newtons.to find additional centripetal force would solve follows fc v2 r fc 10 22 1.5 fc 10 2.67 26.7 newtons. total tension would 98 26.7 124.7 newtons. noted direction magnitude centripetal force change object swings. however though force gravity remains constant tension resulting gravity also changes. swinging object bottom arc equilibrium point gravity pulling directly downward tension pulling angle. tension counteract part force due gravity rather entirety. breaking gravitational force two vectors help visualize concept. given point arc vertically swinging object rope forms angle line equilibrium point central point rotation. pendulum swings gravitational force g broken two vectors mgsin acting tangent arc direction equilibrium point mgcos acting parallel tension force opposite direction. tension counter mgcos force pulling entire gravitational force except equilibrium point equal . let say pendulum forms angle 15 degrees vertical moving 1.5 s. would find tension solving follows tension due gravity tg 98cos 15 98 0.96 94.08 newtons centripetal force fc 10 1.52 1.5 10 1.5 15 newtons total tension tg fc 94.08 15 109.08 newtons. object pulled rope experiences drag force friction another object fluid transfers force tension rope. force friction two objects calculated would situation via following equation force due friction usually written fr mu n mu friction coefficient two objects n normal force two objects force pressing other. note static friction friction results trying put stationary object motion different kinetic friction friction results trying keep moving object motion. let say 10 kg weight longer swung dragged horizontally along ground rope. let say ground kinetic friction coefficient 0.5 weight moving constant velocity want accelerate 1 s2. new problem presents two important changes first longer calculate tension due gravity rope supporting weight force. second account tension caused friction well caused accelerating weight mass. would solve follows normal force n 10 kg 9.8 acceleration gravity 98 n force kinetic friction fr 0.5 98 n 49 newtons force acceleration fa 10 kg 1 s2 10 newtons total tension fr fa 49 10 59 newtons. pulleys simple machines consisting suspended disk allows tension force rope change direction. simple pulley configuration rope cable runs suspended weight pulley another creating 2 lengths rope cable strands. however tension sections rope equal even ends rope pulled forces different magnitudes. system two masses hanging vertical pulley tension equals 2g m1 m2 m2 m1 g acceleration gravity m1 mass object 1 m2 mass object 2. note usually physics problems assume ideal pulleys massless frictionless pulleys break deform become separated ceiling rope etc. supports them. let say two weights hanging vertically pulley parallel strands. weight 1 mass 10 kg weight 2 mass 5 kg. case would find tension follows 2g m1 m2 m2 m1 2 9.8 10 5 5 10 19.6 50 15 980 15 65.33 newtons. note one weight heavier things equal system begin accelerate 10 kg moving downward 5 kg weight moving upward. pulleys often used direct tension direction down. instance weight suspended vertically one end rope end attached second weight diagonal slope non parallel pulley system takes shape triangle points first weight second weight pulley. case tension rope affected force gravity weight component pulling force parallel diagonal section rope. let say system 10 kg weight m1 hanging vertically connected pulley 5 kg weight m2 60 degree ramp assume ramp frictionless .to find tension rope easiest find equations forces accelerating weights first. proceed follows hanging weight heavier dealing friction know accelerate downward. tension rope pulling though accelerating due net force f m1 g 10 9.8 98 t. know weight ramp accelerate ramp. since ramp frictionless know tension pulling ramp weight pulling down. component force pulling ramp given sin case say accelerating ramp due net force f m2 g sin 60 5 9.8 .87 42.63. acceleration two weights thus 98 m1 42.63 m2. little trivial work solve equation finally 60.96 newton. finally let consider object hanging shaped system ropes two ropes attached ceiling meet central point weight hangs third rope. tension third rope obvious simply tension resulting gravitational force g . tensions two ropes different must add equal gravitational force upward vertical direction equal zero either horizontal direction assuming system rest. tension ropes affected mass hanging weight angle rope meets ceiling. let say shaped system bottom weight mass 10 kg two upper ropes meet ceiling 30 degrees 60 degrees respectively. want find tension upper ropes need consider tension vertical horizontal components. nonetheless example two ropes happens perpendicular making easy us calculate according definitions trigonometric functions follows ratio t1 t2 g equal sine angle supporting rope ceiling. t1 sin 30 0.5 t2 sin 60 0.87 multiply tension lower rope mg sine angle find t1 t2. t1 .5 g .5 10 9.8 49 newtons. t2 .87 g .87 10 9.8 85.26 newtons.
query	55	html embed a sound in a html page add fun games web site free embedded game looks like part web page still hosted original website using bandwidth. original website takes game disappear website well. embedding fairly safe malicious content may alter website appearance open pop windows run plugins.embed content trustworthy sites learn alter html limit access. game websites display html used embed game. makes easy copy paste. places let bored.com fog.com kongregate.com games site sponsored games game want embed sites contact creators game ask permission embed game. web page hosting game look snippet html code labeled embed share. specific instructions examples bored.com click game. click share tab underneath game copy second code snippet labeled embed. fog.com click game. copy snippet labeled embed game underneath game description. kongregate sponsored games visit games site page. copy embed code next game want host. warning html code inside iframe embed object tag. code uses different tag probably link website full game. adding game site simple pasting embed code. place body tags html document wherever would like game displayed. game websites terms service websites embedding games. follow terms service website may remove game site. typical requirements changing appearance content inside embedded game boundaries. claiming ownership game charging fee play it. hosting game site illegal obscene content. hosting game requires downloading game file uploading back onto website. downloaded files may contain viruses malware. learn avoid install antivirus software begin. scanning file opening recommended. users playing game contribute bandwidth. select sites allow visitors download games trustworthy. listed sites generally offer safe downloads although still chance virus since games made many different people. crazy monkey games sponsored games armor games select games freegamejungle select games bored.com find download link game want contact game creators directly ask permission. sites limit downloads trusted games visit special page browse download links. others let download game individual game page. links takes directly download page. click download link next game double click compressed file get actual game files. bored.com visit game page click share tab underneath game click download link underneath embed html code. browser games made flash file extension .swf. games made html rarely formats make sure recognize file extension uploading it. using free web hosting service wordpress may need install plugin first order host game. look flash player plugin host flash game. web hosts allow .swf files game files. case upload file free content hosting website link using embed tag described below. uploading game link file would page website. take visitor new page play game still inside domain. would rather place game inside ordinary html page next content use embed iframe object tag basic embedding flash game write embed src insertgameurl type application x shockwave flash embed . many ways modify tag. follow embed method find examples learn from. downloaded game files come text document includes embedding code copy paste site. make sure understand code uploading. change link file uploaded instead original website. cases allowed charge visitors money play game. claim made game copy paste game description without permission. websites may additional restrictions.
query	56	php debug make coding fun matter little effort start. say journey thousand miles begins single step. never find far fly unless spread wings. remember getting started available programming languages first need decide get started with. fairly simple days internet. help sort initiation go visit google online discussion forum blogs amazon book ratings youtube video tutorials etc. every sort resource doorstep need open door let in. get organized help keep track thing also helpful easy reference. remember get started mug things instead understand code practice practice apply ways. moment start understanding find coding fun. prepared make errors. might find mess. big deal obvious face thousands errors might really difficulty debug. remember errors prepare future. error much difficult debug comparatively easy. take help internet valuable resources discussed above. problem might seem difficult first put little effort definitely nail down. learn practice apply new thing find gradually enjoying programming. sooner later coding fun. deception key. trick naughty. human mind tends remember naughty funny vulgar stuff sooner learn coding way. example print message dude made wrong choice suck c programming printf dude made wrong choice suck loop 100 times saying genius php programming 0 100 echo genius display error like dumb javascript alert dumb etc. techniques might seem funny works effectively. learn something try execute practice another time hold apply differently way.
query	57	english grammar teach learn english non native speaker non native speaker chances grammar bad. fact studied lot english grammar elementary middle school high school. first thing need unlearn bad impression grammar got. grammar dry useless dead paper based strict boring. quite contrary grammar fun practical dynamic situation based free exciting. teacher known teach right. grammar something run away english. grammar scary dictatorial monster anyway. start seeing grammar friend gives guidelines rules. short real grammar says t. myth listening says listening zero sum game either get 100 0 . simply true. hard time making sense person maybe native speaker saying discouraged. importantly stop listening thinking home economics saying goes dollar without cent. true listening well. make sense someone saying english drop everything throw away things hear. instead concentrate gather much can. think context situation around speaker try connect separate words catch. try fill gaps hear. believe everybody even native speakers. speak speak. practice step connected 1. wrong way learning grammar unconsciously developed aversion practice real application. somehow believe english skill best used inside four corners classroom quietly yourself. undergone years years sort training tough habit break. step goes deep inner confidence. got learn surmount shyness voice inside head keeps telling make fool . overcome able learn english. remember english language form communication meant practiced together people. learning vocabulary heart means stop cramming head translation english words native language. matter many words memorize everyday 50 100 200 useless know type word learning use sentence etc. non native speakers english known mechanically memorizing lot information. terms long term goals language learning much quantity counts quality. eventually admit expressions parts english perfect grammar explanation looking for. instance idioms infinitives vs. gerunds etc. waste lot time trying force logical iron clad rule. course try best learn grammar keep mind grammar answer everything. cases grammar work start repeating sentence expression. pretty soon realize getting comfortable really need grammar explanation use it. reading one best ways learn grammar vocabulary learn english culture along way. read book. text whether newspaper online article work.
query	58	free education apply find go online class want learn software make web pages use graphics programs etc lot places look good courses. search engines ask people know. check following sites virtual universityhp online classesmit open course warefree education onlinetest prep reviewnot free low cost lots choice ed2gofree online courses schoox.commany classroom based institutions getting online offering online classes. example... http www.phoenix.edu http www.devry.edu get dollar even though low cost free get money worth time worth get put it. print lessons look them...what good career would helped continuing education something would help aspect end result same. learn apply yourself. blackboard types programs bulletin boards irc types meetings etc. try learn comfortable use apply yourself. nan working together help learn effectively. usually end helping rough spots. invariably students different weaknesses.
query	59	job satisfaction get increase job satisfaction knowing good thereby good may lead path knowing skills may lead best. select job weak. liking job utmost important get higher satisfaction. take time perform job duties fullest. replacement this. although may think know everything job always something new learn. skip meetings training classes know everything could job. may tidbit information may forgotten course may small bit valuable. patient wait job finish handing resignation letter. expect returns immediately job done. keep patience. got brain efforts.go working till get maximum satisfaction.of course every one limitations. jot notes need get done day order importance. help adjust understanding potential conflicts day. relax life mean work. feel refreshed knowing get work done later still productive. tend eat junk food body establish ritual make feel like junk . add good healthy foods achieve good working relationship. think job adventure. stay positive positive aspects job partake doing.
query	60	belief say tell parents atheist atheist simply someone believe god gods . position sometimes called weak atheism consists beliefs itself. atheists go believe gods exist. position known strong atheism includes active belief gods. parents might know meanings terms careful clearly define position is. example common usage people refer weak atheism agnosticism even though two terms different meanings. theism atheism deal belief agnosticism deals knowledge. agnostic someone holds view existence god gods unknown. weak agnosticism view existence non existence gods known time might known future. strong agnosticism view existence non existence gods something inherently unknowable. agnosticism atheism mutually exclusive. agnostic atheist might recognize know certain whether gods exist lacking belief gods even maintaining belief gods. similarly agnosticism mutually exclusive theism. agnostic theist might recognize know whether gods exist still maintain belief god gods. coexist someone believes matter religious belief come together study scriptures compare notes exchange world views without starting crusades part ii know evolved able discuss believe notice differences come away unscathed. exclusive religion all. anyone belief come together figure believe. like debate club religion. go compare may argue little come smiling shaking hands. brought religious home revealing lack faith difficult. agnostic atheist even coexist dirty word know means you. say three words make total sense agnostic christian coexist sit stare blank stare. could practice friend similar beliefs go something similar going fight believe in. lot family life might based around traditions faith. ask extent wish withdraw festivals punctuate lives. wish continue practicing traditions home sure parents know beliefs separate family activities. unsure parents react try testing waters first. discuss topic directly related religion influenced abortion sex marriage religiously charged political issues. might give idea would react outright atheism. feel admission atheism would put danger tell them. remember live able move own. extreme cases may better fake religious belief independent. many atheist groups locally online. gone similar experiences may good advice proceed. may also give moral support assistance needed. minimum offer safe venue expressing atheism. cannot find atheist group may confide trusted friend. easier go alone. feel ready tell parents time listen distractions. make clear love appreciate done way rejecting them. might find say difficult sure respect opinions beliefs taking care easily offended. make clear taking part acts worship would hypocritical wish bow them. might also help say still wish play full part family life. make clear come decision much thought longer soul searching. let parents know reasons thinking argue circumstances raise voice. feel heard respectfully end conversation. give parents time digest told them. remember purpose conversation let parents know decided debate. plenty time enter discussions later everyone time settle thoughts.
