query	1	benchmarking have
query	2	bodybuilding take How do bodybuilders use creatine? Does creatine affect you sexually? How do bodybuilders use creatine? Does creatine make you look bigger? Is creatine safe for bodybuilding? Why do bodybuilders take creatine? Is creatine safe for bodybuilding? Is creatine a steroid? Is creatine safe for bodybuilding? Does creatine have negative side effects? Is creatine good for muscle gain? Does creatine cause hair loss? Is creatine good for muscle gain? Does creatine actually work? Is creatine good for muscle gain? How quickly does creatine work? How much creatine do bodybuilders take? Is creatine bad for your kidneys? How much creatine do bodybuilders take? Should I take creatine before or after workout? How much creatine do bodybuilders take? Should creatine be cycled?  there is a sea full of information available on the backgrounds of creatine that can be easily accessed over the internet.    you can always seek advice from a professional who can tell you what is best and what will suit your needs.    don t opt for cheaper brands as you won t be getting the high quality creatine which is important to your physical health. use the internet to find a brand that other people have reviewed as high quality e.g optimum nutrition. once you choose a brand make a purchase either over the internet or in your local nutrition store. when you have chosen your brand ensure you purchase the same one again so that you aren t mixing different brands.    some products state that you should do a creatine  loading phase  for a certain amount of days so that your body will be  saturated  with creatine. this is not entirely necessary as your body does not need this phase in order to get to the  saturated  state. taking the product 5g 10g a day should be enough for you to benefit from taking it.    constantly supplementing with creatine can put stress on the liver and kidneys and can lead to problems. only take creatine in stages such as 2 months on and 2 months off to give your body a rest from supplementation. use it particularly when building up to a competition such as a race or heavy powerlifting session.  
query	3	brainstorming brainstorm What is silent brainstorming? What is reverse brainstorming? What are the 3 rules of brainstorming? What are brainstorming activities? What are the 3 rules of brainstorming? What are some brainstorming methods? What are the 3 rules of brainstorming? What is a brainstorming session? Can you brainstorm alone? Who propounded brainstorming technique? Can you brainstorm alone? Why is brainstorming in a group beneficial? How do you have a brainstorming session? How do you organize brainstorming ideas? How do you have a brainstorming session? What are the four rules of brainstorming? How do you have a brainstorming session? How long should a brainstorming session last?  for example  if your team is brainstorming about how to sell a certain product  provide each team member with a copy of the product and then ask them to  go find  other items that convey or describe the product.  break your team into pairs of two or play the game with individual players. provide either the actual product  prototype model or a photo description of the product. for example  if you re trying to sell cars  you probably won t be able to give each team member a vehicle during the exercise. allow team members a certain amount of time to find items and parameters of where to look. you may want to limit the search to the office or within office property. also  since this game could go on for hours on end  keep track of time and allot each team up to an hour  for example to search. suggest that for each descriptive item found  the teammate must write a short statement or draw a visual depiction as to why that item best describes or promotes the product. for instance  if you re brainstorming about how to make dog food seem healthier  you could gather some of the wholesome ingredients and write about or visually depict how real food  not byproducts are in this dog food. ask each teammate or team to create a display making use of his or her items. give teams creative freedom as to how they d like to display items  such as using display boards  tables and any other fun tools. another approach is a visual demonstration using mime  imagery  improvisation or skits  a little  talking  could be permitted but only if it is like a play  not like a meeting discussion  improvisation can force participants to use rhyme  singing and gestures rather than the usual talk . request that everyone walks through the room to see what other team members have found. suggest that individuals take notes surrounding each display which they can use later to come together as a unit to discuss. doing so could take the brainstorming session to a new creative level. for the visual demonstration  simply have observers make notes as and when they like while watching  for later discussion.    sometimes the best ideas can be derived from a film. consider having an inspirational movie night or week  depending on your team size and amount of time  to pull brainstorming ideas from beloved films.   ask each person to suggest one or two films that they feel best describes the topic at hand. films should be easily accessible on dvd and can be viewed at work or at a team member s home. make a few rules before viewing movies  such as film ratings and length so that no one brings in a lengthy  inappropriate film. over the course of an evening  few days afternoons or a week  host movie watching event. request that the person who suggested the film s  write a quick synopsis of why this film was chosen for the brainstorming project. provide each participant with a sheet of paper and a pen to write about why they believe the film inspired or did not inspire them as they re watching the movie. request that each participant provide two to three ideas derived by watching the film on how to sell or promote the topic. collect and maintain a file of the ideas and participant s thoughts. when the team has watched all of the films  have the group review the entire file and begin a collaborative idea writing session based on the thoughts produced by watching the films.    the idea is to write a collaborative story based on a particular topic with the goal of reaching a new creative height. each participant is given directional goals and writing parameters prior to the writing session.  the team leader begins the story by writing the initial sentence. this sentence will set the tone for the story  however as the story travels from participant to participant  it is expected to morph and develop. the initial sentence could begin something like   once upon a time there was a lonely bottle of mustard who was lost on a shelf in the grocery store   in the event selling mustard was your charge . without speaking  the team leader will slide the story to the next participant who must write a specific number of sentences that build upon the initial statement. be sure you designate how many sentences each participant should write. the last person to contribute to the story arrives at a conclusion and passes the story to the team leader. without showing anyone  the team leader makes enough copies of the story for each participant and distributes the completed story to each participant. the participants should read the story in its entirely and then arrive at a statement that describes the story. the team leader collects all of the statements and then the group reviews the statements in order to arrive at a creative slant or way to promote or sell the item.    this brainstorming session may not specifically lead to answers on how to sell a particular item  but may serve as an icebreaker for a hard core brainstorming session to follow.  gather several household random items such as a hat  spoon  mixing bowl  dust buster etc. provide several envelopes  pieces of paper and pens for each participant. set the items up on individual tables within a room. allow for enough space between items and possibly try to match the same number of items you have as participants  for example  if you have 10 people in the brainstorming session  find 10 household random items . ask each participant to stand in front of one item with a piece of paper and a pen. request that the participant study the item for a few minutes  taking in its features. ask each participant or team to write down five adjectives that describe the item. suggest that instead of thinking deeply about which adjectives would work best  to just write down words that quickly come to mind. give participants a certain amount of time to write down their words and then ask everyone to move to a new item until everyone has describe each item in the room. request that each participant or team place their piece s  of paper in the envelope and place the envelope either in a hat or on the table. mix up the envelopes. invite a participant to randomly select one envelope. the group should study the word list and then have to find the item in the room that is being described.    hand out art smocks and easels with paper and paints markers to each participant. tell them to paint several images that come to mind when particular objects  words or anything else is shown to them.   tell each participant that artistic ability is not being judged. they are free to paint  draw  squiggle  doodle  etc.  however they like  whatever comes to mind. in fact  they re not to delay  as it s their initial ideas that count most. at the end  pass the images around the group to gauge other people s thoughts and to see what new inspiration arises as a result of the images team members have drawn or painted.  
query	4	chain smoking start
query	5	funding get funding Can you get a government grant to start a business? How do I fund a business with no money? Can you get a government grant to start a business? How do I get startup money for a business? What grants are available to start a small business? How can I get money from the government for free? What grants are available to start a small business? What are 4 types of grants? What grants are available to start a small business? How do I apply for a grant for a small business? Are there grants for first time business owners? How do I qualify for a minority business grant? Are there grants for first time business owners? Are grants free? Are there grants for first time business owners? How do you get government grants?  the largest microfinance program in the us is the small business administration s microloan program. the sba works with dozens of intermediary lenders across the country to provide microloans to small businesses  startups included  but most of the lenders only lend in designated geographical areas.take a look at the list of intermediaries at https   www.sba.gov sites default files articles microlenderrpt 20160518.pdf.    a business plan is a document telling any interested party exactly what you plan on doing with the business and how you plan to do it. writing a business plan will help you seem credible and help you obtain funding. there s an art to writing a business plan  but the basic portions of the plan include the summary. you ll talk about the location of the business  the mission statement  the products you offer  and the purpose of the business plan  in this case  getting funding . a company description  including the legal form of the business  it s history  growth  and your short and long term goals. a detailed overview of your products and services  including new products not yet introduced. a market analysis  which includes information on total market size  your share of the market  and how you plan on growing. your overall market strategy. your financial plan  including projections with and without the funding you re seeking.    the various intermediaries have some leeway with respect to crafting their approval process. once you ve found some lenders servicing your area call them or go to their website and learn about their requirements for loan approval. some common requirements include    a business plan it helps if you ve already got a business plan  but if you don t  nearly all of the lenders will assist you in crafting one. the business plan not only helps the lender understand your business goals  it helps you develop realistic expectations for the future of your startup.collateral for the loan. since most of the microloan borrowers don t have a business track record  incomes  or credit history that would support a conventional loan  the lender wants assurances that the borrower is serious about the success of the business venture. collateral can be items like cars  real estate  jewelry  or equipment you plan to buy with the proceeds of the loan.an alternate source of income. almost all of the lenders will require the borrower to have an alternative source of income in case of default.    although microlenders are more lenient with respect to credit scores than conventional lenders  they still have to make sure borrowers can pay them back  and the easiest way to make it appear as though you won t be able to pay them back is to be behind in your current accounts.this includes back taxes. if you do owe back taxes  you should at least get current on a payment plan before trying to get a loan.    microlenders do their best to consider the whole person and their fitness for leading their proposed business venture. one of the ways they measure a borrower s commitment is by checking up on the details associated with business ownership. one of those details is finding out whether the borrower has requested an employer identification number  or ein  from the irs.the ein is like the social security number for a business. having an ein is a prerequisite to legally employing workers in the us. any serious business owner will need one sooner than later. request an ein at https   www.irs.gov businesses small businesses self employed apply for an employer identification number ein online.    in the same vein as the ein  you should take steps to register your business. there are pros and cons to the various types of business formats  but the worst one is the sole proprietorship  which is the default. if your business is organized as a sole proprietorship  it means you are personally obligated to satisfy the business  liabilities.   look into the corporate and limited liability company  llc  formats instead. an llc will probably be the best for a small business  but your circumstances might indicate otherwise. if you need a more detailed guide on the advantages and disadvantages of each type of business form  you can learn more at determine if you need to incorporate. you ll register with the secretary of state in your state. find you secretary of state s website on the webpage for the national association of secretaries of state  located at http   www.nass.org .    you might not be able to get the size loan you want to get  so divide your launch plan into phases. each phase should get the business to a stage where it s making more money than it s spending. that doesn t mean it s making as much money as you want it to be making  or that it can support you or your family. all it means is that you ve gotten to a level of sustainability.for example  if you can only get  5 000 of the  10 000 you were requesting  you need to have a plan formulated  call it phase 1  where  5 000 can get you off the ground and to sustainability.    a crowdfunding campaign showcases an entrepreneur s idea to the public  asking for contributions to make the entrepreneur s vision into reality. in order to do that effectively  the crowd needs to be convinced the entrepreneur s vision is something to be pursued.you have to do more than just tell your story. the crowd needs to identify with the story you re telling. your good idea gets them to listen to you and give you their time  but it s your story that gets them to give to you at the exclusion of everyone else. so  if you started selling prosthetic limbs because you lost your leg in iraq  tell the story of how you lost your leg and how it lead you to want to create better products.    a crowdfunding campaign isn t promising a return on investment. it offers the chance to help fund the development of a project for the donor to feel like they are part of the story you told so well. but they don t want to be a part of a tragedy or a farce  so they can t feel like they re wasting their money. to avoid that  you need to appear knowledgeable and competent.even if you don t realize it  you re already the world s foremost authority on your project. still  you need to organize your thinking about it. learn it cold. you ll know you re ready when you know it so well you can immediately and fluently explain to anyone what your goals and projections are at six months  one year  eighteen months and two years from startup. turn yourself into a walking infomercial business plan.    you want to create buzz around your campaign  because campaigns with buzz make the most money. one way to create buzz is by setting and meeting funding goals. set goals at intervals like 10   25   50   and so on. in order to meet your milestones  lean heavily on your personal network  especially in the beginning . hit up the usual suspects  like your immediate family and your regular circle of friends  but don t stop there. that facebook friend from high school you haven t spoken to in six years  there s never been a better time to catch up.do something special for your donors when you reach each milestone. the quicker you hit milestones  the more momentum you ll have  and the more funding you ll get. for example  if your crowdfunding goal is to open a restaurant  you could send each of your donors a sweet treat from your kitchen when you hit each milestone. even if your donors are mostly friends and family in the beginning  that s ok. treating them like customers makes you seem more professional.    most people s personal networks aren t large enough to get them all the way to their funding goal. so once you ve tapped your personal networks  kick it up a notch. begin your social media campaign in earnest after you ve hit a milestone or two. there s nothing sadder than going to the landing page of a crowdfunding appeal and seeing that no one s donated anything yet.you can try engineering a social media campaign yourself or you can pay a social media marketer to do it for you. if you re the type with 3 000 facebook friends  you ll probably get a lot of mileage from a do it yourself effort. if you re the type with 300  which is an average number  don t feel bad   you might want to bring in some help by paying someone.    the closer you are to getting funded  the more professional and poised for success you need to seem. so  while you might have been able to skimp on production values in the beginning  leave some money in reserve to add polish and increase production values as you go.for example  the longer your campaign goes on  the more important it is for you to attend to things like integrating logos into your landing page and emails and paying for professional video editing for your funding pitches.    many people who would happily send their cousin an email soliciting a donation for their crowdfunding campaign are reluctant to make the same approach in person. many others will have solicited their family members for donations before anyone else.the advantage of going to family for donations is that they can take into account factors like your determination and overall character when considering loaning you money. they also don t usually charge interest. the disadvantage is that you ll probably know them for a long time to come  and adding loaned money into the family dynamic can create tension. there is no helpful script to give a person in this situation. you know your family. you know the kind of appeal they will sympathize with. just give it some forethought  explain the work you ve put in already  and how a certain amount of money will help you get to the goal.    two types of hybrid financing to consider are peer to peer lending and equity crowdfunding. both combine features of crowdfunding with another type of lending  and they can be a good option for individuals who are struggling to get financing in other ways.   equity crowdfunding combines features of crowd funding with angel investing. like crowdfunding  the borrower makes a pitch to a wide audience on an online platform. like angel investing  the investor loans money on the basis of getting a stake in the business. some popular platforms are angellist  fundable  and equitynet.peer to peer lending combines the wide audience of a crowdfunding platform with personal lending. the peer to peer platform vets the borrowers for a minimum level of creditworthiness. if they pass  then they make a pitch and receive a personal loan if there is any interest in their project. some popular platforms are prosper  peerform  upstart  and kiva.  while the terms of personal loans are usually only a little better than a credit card  the borrower can often access more  which sometimes makes them attractive. don t be fooled though  some of the loans have harsher terms than a credit card. just make sure you read the fine print before you sign.   take kabbage as an example. kabbage is a lender that promises approvals within minutes. they offer to lend more on a personal loan than most traditional banks and with less paperwork. the trouble comes when the interest starts to accrue kabbage actually makes loans at 100  interest and more. notwithstanding the fact that interest rates that high used to be illegal  paying them off can require a superhuman effort  and the near certain default can be a quick road to financial ruin.    financing your start up through credit cards should be your last resort. the interest rates are too high and the credit limits are often too low. while that doesn t dissuade many would be entrepreneurs from doing it anyway  it s never a good idea. a great many startups fail before they hit the two year mark  and cash flow usually has something to do with it.  
query	6	hair coloring bleach hair back to brown
