query	158	kansas city locate win barbecue cook qualify winning cook must follow adhere contest rules. example rules prohibit using lighter fluid coals within grill start grill using newspaper matches instead. obtain copy rules consulting panel judges cook visiting website cook off. practice may help determine flavors cooking methods preparation meat. example participating cook city memphis judges kansas city may prefer sweeter kansas city style flavors opposed memphis style flavors rich vinegar. read short summaries biographies panel judges cook rules brochure cook website. introduce judges far advance cook possible determine background experience judge. engaging forums discussions barbecue may give new additional tips ideas unique flavorful barbecue dishes. perform internet search using keywords barbecue forums barbecue discussions locate online barbecue communities. depending competition rules may required purchase fire extinguisher sanitation supplies booth cook off. high quality meat considered fresh either natural organic cases may taste better pre packaged meat found many grocery stores. consult farmers local area region provide fresh meat order high quality meat farmers regions. visit grocers specialize natural organic products purchase meat barbecue. barbecue cook offs often judge participants ability produce new unique barbecue flavor. try combinations different sauces dry spices cooking methods develop unique flavor based rules cook off. example cook allows use either cherry wood hickory wood grill experiment using types wood determine produces better flavor. cook judges prefer barbecue dishes sauce retain watery runny consistency. create glaze sticks meat without dripping add small amounts honey dehydrated honey flavor order decrease chances mess. judges rank food according appetizing dish appears may also inspect area preparing barbecue cleanliness. use paper towels wipe sauce spills counters sauce streaks edges sides boxes containers. place toothpicks meat use neutral wood colors instead colored toothpicks. dye colored toothpicks may transfer onto meat toothpick pulled out. warm hot barbecue may taste better judges give impression food fresh whereas cold food may give impression prepared food less fresh. cook meat shortly judges taste test use chafing dish keep barbecue warm cooking.
query	159	kelowna get into a bar in kelowna good barmaid big smile always makes customers ease. always polite friendly bit cheek goes along way then. even busy customer serving needs feel like complete attention. answer questions find someone can. unsure order ask like make suggestions based that. know behind bar help might introduce new favourite drink. make come back may defend rude customers. keep making mistakes real event slowing people working you. customers bars hate wait. help get order right customer. people regulars remember names usual orders. visitors pop course want make good impression never come back. regulars ones night night ones paying wages. chat take time get know like drink. regular walk find drink waiting bar saw walking across street come feel valued appreciate took time observe like. way may get drinks future appear disciplined. appear bored distracted. let people trip rude comments. stressful job.if problem refer manager instead pick you. slow things break concentration. new bar work ask needs doing. people hate new staff members stand around waiting told do. ask. see someone something know ask show you. quicker learn expected change barrel likely offered shifts useful behind bar. clear away plates tables clean tables collect glasses get washed put away. keep bar clean wipe spillages. keep floor mopped dry slip over. keep fridges stocked up. last thing customers want see dirty bar tables filled used plates nowhere sit want get wet sleeves come bar. staff want run stockroom cellar every 5 minutes fridges empty. stay top things. customers often ask drinks food go see live bands etc. asked thing regular basis suggest boss. customers best way find market wants market customers know get something ask likely come back again. underage drinking drug use illegal. let slide bar become known for. get bad reputation potentially get bar closed down. generally get feel type activities customers like better way get new customers door hold events whether live music comedy special offers like happy hour cider festival keeps bar alive vibrant. everyone sense fashion style make sure presentable. wear clean clothes make sure smell hair tidy. brush teeth wear chipped nail polish. people bad impression smell afar probably want drink bar
query	160	kings island   4 kings card trick nan enter roof. another variation holds kings good friends let anything get them. variation may work better alternate method described below. three top cards spares audience believe kings shown previously. without showing anyone face card say going first floor. put deck somewhere near bottom. put cards close top deck real kings top. stand show audience. knocks roof. tap knock deck four times. kings. put top deck. order top bottom first king random random second king third king fourth king. reality still three kings top deck one bottom.
query	161	lake of the ozarks reach lake catch lake trout best rod use trout fishing allows use variety techniques catch trout. lighter line less friction water allowing cast line bottom lake ease. lake trout 35 pounds need heavier rod these. know fishing lake massive fish bring heavier rod well. use open faced spinning reel thin line. sure put reel rod facing correct direction. use either number 6 10 hooks. since lake trout feed number different native species best lure one closely mimics individual food preferences. sure lure best ask around local bait tackle shop. local anglers able tell use catch lake trout area.small weightless lures spinners typically make best artificial bait. add shiny metal foil beads attract trout. prefer use live bait three options usually best bet. ask local tackle shop find fish area biting lately. fish different preferences depending season region. since catching lake trout dependent finding depth located investing depth finder make break day success. lake trout prefer approximately 53 degree water. depth eating habits change weather. early spring fall lake trout swim depth 35 45 feet 10.7 13.7m . later spring summer move deeper 50 65 feet 15.4 19.8m . cold weather lake iced trout found closer surface depth 10 feet 3 . technique best areas fish concentrated might want try fishing well stocked lake. use spoon jig white buck tail jig bait minnow piece sucker meat. drop line near bottom lake slowly work way jiggling line jig resembles wounded baitfish attracts trout. technique require special rod reel. sure jig use light 1 2 ounce 3 4 ounce. technique works best boat rather shore. trolling better technique use fish concentrated schools scattered different places around lake. troll fish moving around find them. sure use depth finder might want use fish finder too. troll fish boat shore long able cast line deep enough. troll fish following use spinning reel bait caster type rod properly weighted line. attach weight cast proper depth drag hook along without rising surface. weight determined speed season. use light lure spoon use live minnow hooked lips. drive boat middle lake use depth finder fish finder find good starting spot. start trolling slow speed reached desired depth. key go slow. feel watch line know bite. small trout furiously swim away causing line vibrate quickly. jerk rod 1 2 feet 31 61cm hook trout bitten. reel trout slowly keeping rod head. remove trout hook either place cooler return back water. largest concentration lake trout found ontario canada 25 percent world lake trout population lives. lake trout commonly found lakes stretching far south kentucky. also introduced lakes europe asia south america. lake trout popular among anglers natural population overfished. lake trout commonly stocked lakes meet demand anglers.since lake trout like cold water less commonly found warmer regions like southern us. lake trout like spend time colder. likely find good supply lake trout deep cold lake shallow warmer lake. check around region find best places go trout fishing ask local anglers deepest spots local lake are. trout fishing done season. important know like spend time different types weather. summer trout found deepest coldest parts lake. lake ices found closer top since shallower waters cool enough them. find good spot trout fishing certain season return next year season likely find good trout supply again. one time year trout difficult catch probably middle summer lake warmest trout darkest depths. difficult figure trout hanging reach line. trout often found near natural dropoffs ledges since water near features tends deeper cooler. fishing shore especially helpful set near dropoff rather casting line place grade gradual. trout feed smaller fish well plankton often find school smaller fish. hang underneath wait weaker fish get close enough eat. smaller fish feed underwater vegetation. fishing boat set near area plenty vegetation see trout might hiding smaller schools fish. knowing specific feeding habits smaller baitfish region helpful. talk experienced angler bait tackle shop find eating habits local lake trout.
query	162	melbourne migrate visit melbourne look around see attractions. visit federation square tour melbourne museum look around fun personally football fanatic know lot australian rules football afl right season march september afl melbourne cricket ground mcg g must see tourists locals alike try sample much melbourne food cuisine enjoy visit victoria market beautiful fresh taste. also australian animal zoo healesville african plains open range zoo werribee. st kilda beach one melbourne popular beaches brighton beach south st kilda also great beach. chill people watch coffee really refreshing. melbourne unique many great cafes bars restaurants located hidden laneways. great ones hardware ln ac dc lane hosier lane find heaps fantastic cafes colorful graffiti art hidden restaurants bars. entry free children students including international students adults costs 10 permanent collection museum visit forest gallery see many plants aquatic animals see dinosaur fossils much also aboriginal exhibit imax basement.. obtain brochures showing maps city shops etc buy metcards train tram bus use book tours ask directions many inquires help enjoy melbourne. nan
query	163	mombasa compare to other african city apply kenyan identity card give signed letter satisfied. may ask see village elder. e.g kisauni mombasa take letter d.o office kongowea. mombasa ask assistant chief letter taken to. see officer duty give small form fill. kongowea door middle. may return another day. start assistant chief opp vescon ii chief shanzu stage may leave forms officer district officer district commissioner kisauni take road jcc take 1st corner. d.o d.c sign. kisauni ask police officer table. assist you. return forms kongowea got forms . officers take finger prints . fingers palms. take picture possibly fee ensure passport size photos. check status id www.identity.go.ke
query	164	mount everest climb buy way onto mount everest expedition spending lots money lots time expedition 60 days nepal total arrival climb return home try find experienced mountain climbing company high track record successful climbs. call several mountain climbing companies specialize everest climbs ask season went. look companies high success rate climbers made summit 80 climbers reaching summit scaling completely.recent expeditions everest occurred postponed due natural disasters poor weather. confirm companies expeditions year would like book time frame. companies arrange expeditions april may wind less severe mountain. usually services one one guidance would like expensive expedition be. companies provide mountain professional guides expedition permits accommodation kathmandu transportation nepal yaks porters guides base camp tents showers toilet tents weather reports oxygen altitude change mountain.however companies provide one one guides throughout trip. ask company many sherpas guides provide climb. companies provide one guide one sherpa per climber companies may offer one sherpa one guide per two climbers. cost hiring mountain climbing guide everest vary depending budget. total cost climbing everest run tens thousands around 70 000 factor climbing permit gear airline tickets nepal mountain guide fee. determine much willing spend expedition start compare prices different guiding companies may able find guiding company still offers require break budget. hire climbing company everest expedition compare rates services several companies. looking one one guides may end paying service specific company. however looking less guided experience may pay less another company. keep mind everest fatal situation right training right gear good guide. avoid cheaping guiding services means may risking life worth make summit alive well. chosen mountain guiding company pay expedition book spot. determine expedition date book flights nepal. focus training properly least six months expedition date prepared ready take everest. climbing everest serious endeavor requires peak physical mental fitness. expedition need able hike steep outdoor trails pack weigh 22 30 kilograms two three hour periods. also need comfortable hiking thick winter gear heavy boots. prepare expedition commit strict training program least six months expedition date physically mentally prepared climb.begin training program starting moderate level exercise four five times week. progress period six months peak fitness. idea work way peak fitness overwork stress body. essential cardiovascular training conditioning least one year six months planned expedition build strength endurance. start training committing regular workout routine training least four five times week. get point workout ache next day.you form cardiovascular activity least 45 60 minutes four five times week. biking running swimming using steppe machine gym good options. rest one two days fun physical activity one rest days like climbing skiing skating. enlist support friends cardio activities together. aim get heart rate thirty forty beats faster per minute thirty minute workout also known conversation pace talk someone comfortably workout. months go try improve heart rate increasing duration cardio activities. free weight exercises follow interval training program home using free weights exercise mat. start free weight training three times week work way four five times week. combine free weight training cardio training get workouts. typical workout week could look like monday cardio activity thirty minutes running biking rowing strength training sit ups pull ups 15 reps three sets push ups 40 reps three sets . also incorporate weight training free weights bicep curls military presses. tuesday different cardio activity thirty minutes running biking rowing longer. strength workout. wednesday strength workout incorporating sit ups pull ups push ups free weights. exercises monday. rest cardio activity. thursday cardio activity thirty minutes running biking rowing longer. also go hour long hike run trail outdoors instead. . strength workout. friday cardio activity thirty minutes longer. repeat monday strength workout. saturday rest day fun recreational cardio activity like hike climb. sunday rest day. activity. always stretch exercise drink lots water workouts three four quarts day. hydration important dealing altitude affects everest. recommended try least one two big climbs mountains commit climbing everest. many people climb everest work way bigger peaks period one two years commit everest.having experience climbing high peaks also allow develop mental strength needed climb may faced physical exhaustion need stay strong mentally continue climb. ask climbing friends recommendations big climbs prepare high altitude environment everest talk mountain climbing company climbs may useful preparation everest. notion training everest seems daunting enroll training camp focuses preparing mentally physically expedition. training camps done mountain climbing company hire take mt. everest expedition. ask companies rates training programs covered training programs. training camps done mountain climbing company area. programs may simulate experience climbing everest indoors take climbs similar everest prepare expedition. climbing companies expect climbers climbing gear climbing packs. enough supplies two months mountain goal packing smart rather packing light. climbing companies may able provide list necessary gear supplies climb. plastic frost proof clubbing boots two sets thermal base layers parka hood pants least six pairs warm socks bandanas face mask balaclava wool hats sun visor synthetic gloves gore tex mitts glacier glasses sleeping bag day pack backpack harness ice axe headlamp rappel gear food last duration expedition
query	165	north korea see local laws and customs deal framed foreign country stopped arrested traveling foreign country first thing contact embassy. traveling foreign country ongoing diplomatic ties home country one embassies country traveling. embassy usually capital city. cases may embassies large cities around country well.in france example u.s. embassy offices paris marseilles bordeaux lyon rennes strasbourg toulouse. would smart traveling foreign country research ahead time nearest embassy be. take along address telephone number contacting embassy case emergency. embassy diplomatic office country ambassador foreign country. embassy officials work form diplomatic ties two countries assist travelers provide aid times emergency. officials embassy able provide list local attorneys willing help travelers.be sure inform embassy officials charge much understand it. ask referrals attorneys practice sort law speak native language. ask contact embassy help reaching local attorney advice local legal system. embassy staff generally trained customs laws local country. ask embassy connection help identify kind legal practitioner need. different countries use different terms like attorney lawyer barrister solicitor notary. find qualifications need lawyer situation. received referrals one attorneys want talk make selection. need ask attorney qualifications make sure provide kind representation need. try find someone experience dealing kind charges issued you.in making decision make sure attorney choose someone communicate someone understand. sure understand payment expectations. need discuss potential attorney fee services. make sure understand payment due form payment required. finally make sure attorney understanding amount work covered payment. addition negotiating handling case need attorney help understand legal system country unfamiliar you. figure charges you. already understand charge arresting officers work attorney find out. try understand exactly alleged done event allegedly occurred. ask attorney legal system country in. many countries example defendant considered innocent government police prosecutor prove guilt court. many others presumption guilt defendant must rebut.work attorney understand possible penalties. example charged something possibility monetary fine may advantageous pay fine put matter behind even commit crime. could save extended legal fees possibility held foreign country will. help attorney review evidence you. even though may claim framed local police must evidence support arrest. work attorney review evidence. tell attorney everything travels try establish alibi you.prepare trial local attorney. trial systems different one country another. need rely local attorney advice regarding trial preparation. assist much possible developing case strategy alibi defenses can. best appear professional respectful. may claim framed charges must treat system respectfully can. work attorney local officials present best case can. case may jury may tried directly judge depending legal system country.if yet already know learn speak understand phrases native language courtroom etiquette. practice phrases yes honor honor whatever judge called. attorney prepare customs courtroom stand sit respond on. depending country traveling reason may explore whether form immunity might apply you. talk officials embassy local attorney idea. argue immunity apply may released right away.immunity complicated topic range different levels coverage. short means national diplomats staff families cannot prosecuted crimes foreign country. higher level diplomats staff members higher levels immunity. believe may covered notify local law enforcement officials position talk embassy staff help make case. alternative proceeding criminal trial process attorney embassy might work together make deal leave country. could either extradition deportation. extradited generally means go back home country potentially face criminal charges there. still prove innocence least could country.alternatively might suggest deportation.the country charge may consider victory gets rid you. could attorney embassy even people back home make plea release return human rights grounds. depend charge level evidence potential punishment. severe punishment relevant human rights plea might be.a noted example case otto warmbier student university virginia tried convicted north korea crime subversion took propaganda poster. sentenced 15 years prison. immediately following sentence american diplomats organization human rights watch condemned sentence tried warmbier released.
