query	1	benchmarking have
query	89	testosterone increase  ask for a detailed analysis of your weight. if you are overweight or obese  this could be the cause of a drop in testosterone.   obese people secrete more aromatase  an enzyme that works to convert testosterone to estrogen. your metabolism will continue to decrease as your body produces more aromatase  making the problem worse. create a weight loss plan with your doctor.    increased weight and obesity can lead to low testosterone levels.changing your dietary patterns can make a big difference not only to your testosterone levels but to your risk for heart disease and diabetes. start changing your diet by cutting out processed  packaged  and prepared foods.    eating  whole  foods means cutting out excess sugars  trans and hydrogenated fats  preservatives  etc. try to incorporate    more fruits and vegetablesmore fish and quality meat. avoid processed food  including grains  lentils  beans  and dairy. more nuts and seeds    this includes sugars added to processed foods  such as high fructose corn syrup   as well as artificial sweeteners.if you need a  sweet hit   try using stevia  a herb that can provide sixty times the sweetness of sugar.    omega 3 fats are healthy fats found in a variety of foods. these include those found in eggs  algae  fish  and mussels  but also plant oils like flaxseed  hemp and walnut oil. healthy fats actually help to build a healthier body.    lots of water is essential to any healthy diet. in addition to hydrating you  water can also stop you from feeling hungry.    cut down on snacking  eating when bored  and other sneaky calories. try to eat only when you are hungry.    restricting calories significantly may send the wrong signals to your body  which will not increase testosterone. instead  cut your calories by approximately 15 percent the first week.   all weight loss goals should be reasonable. aim to lose a pound per week by improving diet and increasing activity levels.    meat  high protein yogurt  and some vegetables can help build muscle. increasing muscle will help burn fat and increase testosterone.    if you have never lifted weights  used resistance bands or used weight machines  hire a personal trainer or physical therapist to teach you the proper form and procedure.if you are very weak  start with resistance bands. this gentle form of strength training allows you to use a rubber strap to train weak muscles before lifting actual weights.do this 2 to 3 times per week for the first 3 to 4 weeks. if you have a joint or back problem  you may want to graduate to stronger bands and stick to this form of strength training. you can increase your testosterone levels by up to 20 percent by lifting weights 3 times per week for 11 weeks. strength training in the evenings can increase testosterone levels in the evening. these effects tend to be brief and smaller the better shape you are in.they can still help.    for men  you will want to choose weights that tire your muscles after only 5 repetitions. do 3 sets. you should feel muscle fatigue after a weight training workout. allow your muscles 24 to 48 hours to rest.   women or people with joint problems may choose to do endurance training. for example  they may choose a slightly lower weight and complete 3 sets of 10 to 15. work half sets in between full sets. this means you should complete half the range of motion  from the bottom up or top down  to work the fast twitch muscle fibers as well as the slow twitch fibers. lift weights slowly. breathe slowly and never drop the weight. control the weight until it is in its original position.    begin doing cardio exercise for at least 30 minutes 5 times per week.   interval training requires you to warm up  sprint or workout intensely for a short period  such as 90 seconds   and then work out at a more moderate  resting  pace for a slightly longer interval  approximately 2 to 4 minutes . repeat these sets for approximately 30 minutes  including warm up and cool down. the different intervals can vary based on the specific cardio activity. if you are new to interval training  consider having a personal trainer suggest a regimen for your experience level. cardiovascular machines  like stair machines  bikes  ellipticals  and treadmills can be programmed to do interval training if you do not want to jog or swim while providing your own interval timing.    while general activity is good  you will need to work your heart more intensely to reach weight loss and testosterone improvement goals. this is true for both strength training and cardio.   do not overtrain. if you are already fit  too much cardio exercise is likely to lower testosterone levels.your goal is to keep your metabolism high while giving the body plenty of time to rest and recover. drink plenty of water before  during  and after exercise. dehydrated people produce less testosterone after a workout. don t forget the other benefits from exercise  including better cardiovascular health  weight loss  increased strength  and endurance.  intermittent fasting combined with moderate to high intensity exercise has been shown to increase testosterone levels.during the fasting period  include moderate to high intensity exercise of your choice. the idea here is that since you are fasting  your body will turn to stored fat for its fuel.  doctors recommend 7 to 8 hours of sleep per night. less sleep can result in 10  lower testosterone levels. less sleep can also make it difficult to lose weight.  moving around more and sitting less will balance your hormones  decrease stress  and result in weight loss.   buy a pedometer. make sure you hit at least 10 000 steps per day during the course of your daily routine.    stress produces the hormone cortisol and interrupts the production of hormones such as testosterone.focus on creating a work life balance. spend 2 hours a day on leisure activities you enjoy. try to bring your workday down to 10 hours or less.start meditation  deep breathing  yoga  tai chi  and or qigong. these activities can reduce stress and help you sleep better. if you don t think you have time  start by taking four 2 3 minutes throughout the day to take 25 deep breaths per break.    if low testosterone has affected your sex life  then consider changing sexual activity to the morning. testosterone levels are naturally higher in the morning.    getting vitamin d requires you to spend some time  15 to 30 minutes  with a good amount of your skin in direct sunlight. keeping vitamin d levels high can produce up to 20  more testosterone. consider talking to a medical professional about vitamin d supplements if you work inside all day and cannot spend time in the sun.  moderate to mild zinc deficiencies have been shown to lower testosterone levels.talk to a knowledgeable healthcare provider about a zinc supplement.    some studies have shown that certain herbal supplements may help to increase testosterone or combat the effects of low testosterone. some of these herbal supplements include    tribulus terrestris  which has shown an increase in sexual activity in animal studies. follow manufacturer s instructions. withania somnifera  ashwaganda   which has been reported in preliminary clinical trials to increase sperm quality.most studies have used up to 450 mg four times a day. ginkgo biloba  which increases testosterone synthesis.dosage was 270 mg of ginkgo extract 4 times a day. follow manufacturer s instructions. yohimbe  which has been used to increase sexual interest and treat erectile dysfunction.doses vary but ranged from 5.4 mg  3 times a day  to 10.8 mg  3 times a day . follow manufacturer s instructions.    men with low testosterone levels may notice a variety of associated symptoms. these may include    erectile dysfunction  ed   including a decrease in the number and quality of erections smaller testes  hypogonadism  decreased sperm counts a decrease in muscle mass leading to decreased strength and endurance changes in blood lipids such as cholesterol levels osteopenia  softening of the bones  and osteoporosis  decreased bone density  hot flashes swollen or tender breasts  gynecomastia     in addition to physical effects  men may also notice mood changes associated with low testosterone. these can include    decreased sex drive  libido  fatigue mood changes  including depression  irritability  and anxiety problems with memory  concentration  or a sudden lack of self confidence    diagnosis involves a blood test along with a physical exam. the test is most often done using blood drawn in the morning. this is usually when testosterone levels are highest.   your doctor will diagnose the condition if your combination of symptoms and lab results indicate low testosterone levels.    under most circumstances  adults who have been medically diagnosed with low testosterone levels can safely increase their levels  and natural methods can be some of the healthiest ways to do so. that being said  you should avoid intentionally increasing your testosterone if you are still an adolescent or if you re an adult with normal or undiagnosed levels.   testosterone levels are usually highest during your adolescent years  but since your hormones fluctuate regularly during this time of your life  it s best to let them naturally adjust themselves rather than attempting to change them yourself.if you re concerned about low testosterone as a teenager  consult with your doctor before making any changes. increasing testosterone when your levels are already normal can negatively impact your health  even as an adult. for women  high testosterone may lead to polycystic ovarian syndrome  infertility  obesity  and thinning hair  among other problems.there s some debate regarding how harmful high testosterone can be for men  but some research suggests that excessively high levels can increase a man s risk of cardiovascular disease.  if you have no known health concerns other than low testosterone  most herbal supplements should be relatively safe to try on a short term basis. certain medical conditions may make these herbal remedies dangerous  however  so you may wish to avoid using herbs to increase testosterone if you have known health concerns.   for women  avoid most herbal supplements if you are  or might be  pregnant or if you re currently breastfeeding. tribulus  ashwagandha  ginkgo  and yohimbe are all considered unsafe under these conditions. for men  tribulus might be linked to prostate problems.ashwagandha may cause problems in people with diabetes  low blood pressure  stomach ulcers  auto immune diseases  and thyroid disorders.ginkgo may cause an allergic reaction if you re allergic to urushiols  like poison ivy and cashews. it could also cause problems if you have blood pressure irregularities  diabetes  hypoglycemia  gastro intestinal disorders  musculoskeletal disorders  nervous system disorders  seizures  skin disorders  psychiatric disorders  or heart disease.yohimbe is dangerous if you suffer from bleeding conditions  schizophrenia  prostate problems  ptsd  liver disease  kidney disease  blood pressure irregularities  heart disease  anxiety  depression  or diabetes.  if you re not currently on any medications  most herbal remedies are likely safe to use. you may need to avoid these remedies if you re currently on medications that could interact with them  however.   avoid tribulus if you re on blood pressure medication  diabetes medications  or steroids.ashwagandha may be dangerous if you re on immunosuppressants or sedative medications.ginkgo could negatively interact with heart disease agents  seizure medications  anticholinergic agents  antidepressants  and cyp450 metabolized agents.avoid yohimbe if you take or may take maois  clonidine  guanabenz  tricyclic antidepressants  antihypertensive drugs  naloxone  phenothiazines  or stimulant drugs.  as long as you do not have conditions or medications that may cause complications  testosterone herbal remedies are likely safe for adults when taken for six months or less.   beyond six months  some herbal remedies may result in complications like excessive bleeding stomach upset  diarrhea  and vomiting.difficulty sleeping may also be a result.  while moderate amounts of vitamin d and zinc can help your body produce more testosterone and stay healthy  excessive amounts of either nutrient can actually be toxic. it s usually best to get both nutrients from natural sources  but if you choose to take supplemental forms  simply make sure you follow the dosing instructions provided on the label.   the recommended dietary allowance of vitamin d is 600 iu  international units  daily. toxicity usually occurs in people who regularly take around 50 000 iu for several months  but this amount may be smaller for individuals with liver problems  kidney problems  or other health concerns.for zinc  the recommended daily allowance is between 8 and 11 mg daily in adults.the upper limit is about 40 mg daily  and toxicity typically occurs when individuals regularly intake more than this upper limit.  making healthier diet and exercise choices can be a great idea  even if you don t need to increase your testosterone levels. to get the most benefit out of your improved lifestyle while minimizing any possible risks  see your doctor before implementing any major changes.   in addition to testing your testosterone levels and notifying you of any personal health limitations  your doctor can work with you to determine the best treatment possible. your doctor may suggest medical remedies  but don t be afraid to let your doctor know if you strongly wish to stick with natural methods. as long as it doesn t present a threat to your health  most doctors will be willing to work out a strategy according to your wishes.  
query	90	thyroid hormone produce What are the main functions of the thyroid gland? Can Thyroid be cured? What are the main functions of the thyroid gland? What is the main cause of thyroid problems? What is the function of t3 and t4? What is the function of triiodothyronine? What is the function of t3 and t4? What foods are bad for thyroid? What is the function of t3 and t4? What organ is affected by TSH? What is the difference between t3 and t4? What is a good thyroid level? What is the difference between t3 and t4? What affects thyroid function? What is the difference between t3 and t4? What is a normal t4 level? Does thyroid affect brain function? Does thyroid affect mental health? Does thyroid affect brain function? Is a thyroid problem serious? Does thyroid affect brain function? How dangerous is hypothyroidism?  thyroid hormone is a derivative of the amino acid tyrosine. it has iodine atoms attached to it. therefore  its biosynthesis requires iodide ions that must be supplied in the diet in the form of tablets. otherwise goiter can result in individuals that are deprived of iodine in their diet. in the united states usually table salt is supported with a supplementary amount of iodine to ensure healthy function of the thyroid gland.    there are two types of thyroid hormones that are obtained from each other by biochemical conversions. these are called  thyroxine and tri iodo thyronine. in thyroxine there are four iodide atoms attached to the hormone while in tri iodo thyronine there are only three iodide atoms. most of the thyroxine hormone in the cells is converted to tri iodo thyronine in a biochemical process which involves the removal of one iodine atom from thyroxine. therefore  the most dominant form of the thyroid hormone is tri iodo thyronine.    both of these forms of the thyroid hormone are lipid soluble. therefore  they can penetrate the phospholipid bilayer of the cellular membrane readily. their receptors are located inside the nucleus and they exert their effect by increasing the rate of proteins translation or the synthesis of proteins in the cell.    thyroid hormone secretion is under a positive feedback control from the thyroid stimulating hormone  tsh  of the pituitary gland. namely  high concentration of tsh stimulates high secretion of thyroid hormone and low level of thyroid stimulating hormone leads to low secretion of thyroid hormone.    usually in states of hyperthyroidism in which there is excessive secretion of the thyroid hormone  there is in the blood little of the thyroid stimulating hormone. also in the case of hypothyroidism in which there is deficient secretion of the thyroid hormone to the blood circulation elevated level of tsh are observed in the blood of affected individuals. both of these effects that are observed in hyperthyroidism and hypothyroidism are direct result to the negative feedback control of the thyroid hormone on tsh or thyroid stimulating hormone.    thyroid hormone unlike other hormones in the body does not have a specific target organ to act upon. instead it acts in a universal manner in which its effect is done on all the cells of the body. its action increases all aspects of metabolism inside the body. in this sense  it has similarity to the hormones epinephrine and norepinephrine as far as the increase in metabolic rate in the body is concerned.    thyroid hormone increases all aspects of sugar metabolism including the uptake of glucose by cells in the liver and it increases th rate at which glucose is synthesized by the process of gluconeogenesis. also the thyroid hormone increases the rate at which compounds are absorbed in the gastrointestinal tract.   nan  lipids  under the effect of the thyroid hormone are promptly mobilized from fats tissue and are readily metabolized in the liver. the thyroid hormone decreases the level of cholesterol in the blood. in addition  it decreases the level of the phospholipids also.    this is so due to the increased activity of enzymes in the body by the effect of the thyroid hormone. for example  the increase in glucose metabolism in the body due to the effect of thyroid hormone renders a need for more of the hormone insulin to speed up the uptake of glucose by the liver cells.  
query	91	trichinosis stop
query	92	urinary incontinence prevent What can cause incontinence in cats? What causes incontinence in elderly? What can cause incontinence in cats? How do I know if my cat has kidney failure? Can cats have urinary incontinence? What medicine do you give a cat for a UTI? Can cats have urinary incontinence? How do you get cat pee smell out of a cat? Can cats have urinary incontinence? Why does my cat pee while sleeping? Why do female cats leak urine? Can cats get UTI from dirty litter box? Why do female cats leak urine? How do indoor cats get UTI? Why do female cats leak urine? How can I tell if my cat has a UTI? Is there a cure for incontinence in dogs? Is incontinence a reason to put a dog down? Is there a cure for incontinence in dogs? What can you do for old dog incontinence? Is there a cure for incontinence in dogs? Why has my dog suddenly become incontinent?  if your cat displays the symptoms of urinary incontinence  including an inability to urinate  bloody or cloudy urine  a loss of bladder control  or straining or crying out in pain when urinating  you should take them to the vet right away. getting your vet to diagnose the issue will ensure your cat gets the right treatment. your vet will do a physical exam of your cat  including looking at their abdominal area. they may also run several tests to determine the cause of your cat s bladder problems.your vet may run a urinalysis  where they will test your cat s urine for bacteria as well as red or white blood cells. your vet may also do an x ray of your cat s abdominal area to check for bladder stones. they may inject your cat with a special dye so the bladder is easier to see in the x rays.    there are several possible causes of urinary incontinence in cats and your vet will be able to tell you which one your cat is dealing with. you should discuss your cat s diagnosis with the vet so you understand why they are having issues with their bladder. the possible causes of urinary incontinence include feline diabetes  your cat may have developed diabetes  which can cause them to drink large amounts of water. they may then try to use the litter box but fail to make it in time. a urinary tract infection  uti   your cat may have a uti  which will cause them to try to urinate but to no avail. if you think your cat as a uti  get them to your vet right away. if left untreated  the infection can spread to your cat s bladder  which can lead to scarred bladder or a bacterial bladder infection. bladder stones  some cats are prone to bladder stones  which can cause straining when they try to urinate  constant urination  blood in their urine  and a tender abdominal area. old age  older cats may become senile and forget to urinate in their litter boxes. senior cats also have weakened muscles  making it more difficult from them to control their bladder. obesity  some cats who are overweight will have difficulty controlling their bladder. you may notice your cat appears overweight  especially if you cannot see their ribs.    your vet will outline your cat s treatment options  based on their diagnosis. your cat may require medication and diligent home care to ensure they recover. your vet may also suggest surgical intervention if your cat s situation is dire.if your cat has diabetes  your vet will prescribe medication and dietary changes. if your cat has a uti  your vet will prescribe antibiotics that your cat must take until the uti goes away. if your cat has bladder stones  your vet may suggest surgery to remove the bladder stones. you may also need to adjust your cat s diet.    you should make sure your cat gets the medication prescribed to them by the vet  such as antibiotics for a urinary tract infection. follow your vet s instructions on dosage and make sure your cat consumes the medication.if your vet prescribes medication in pill or capsule form  place the medication in the center of a small ball of canned cat food or a piece of cheese. try to get your cat to swallow the small ball with the medication whole  as they may not want to eat it if they bite into the medication and it leaves a bad taste in their mouth. you can also try to place the medication in your cat s mouth directly  though you should use caution as you do not want to get bit by your cat. to do this  hold your cat s head from the top with your non dominant hand  placing your fingers around your cat s cheekbones. then  tilt their head back so their jaw falls open. use your dominant hand to put the medication far back on your cat s tongue. then  shut their mouth and stroke their head or blow in their face to encourage them to swallow the medication.    your vet may recommend that you adjust your cat s diet if they are diagnosed with diabetes or obesity. you should follow your vet s recommendations and adjust your cat s diet so they are not at risk of other worsening health issues. a change in diet can also help your cat gain better control of their bladder.you should make sure you cat has access to fresh water on a regular basis  as this will allow your cat to drink the water and flush out their bladder.    you should also keep your cat s litter box clean and dry to encourage them to go to bathroom. you may try to clean the litter box more than usual so your cat feels more comfortable urinating in their litter box.if your cat is old and senile  you may place several litter boxes around your home so your cat also more opportunities to go to the bathroom in the litter box. you may also lead your cat to their litter box if they appear to have forgotten where it is located.you may also keep your cat s litter box in a room that has hardwood  tile  or linoleum floors so that if they have an accident on the way to the litter box  it is easier to clean up.    if your cat does not seem to be able to go to the bathroom in their litter box  your vet may recommend the use of diapers. you may need to put your cat in diapers temporarily until they recover. this will prevent accidents on your furniture or your carpet.  you should schedule a follow up appointment with your vet so your cat can be examined again and tested for bladder issues. your vet may do another urinalysis to determine if the treatment is working.if your cat appears unresponsive to treatment  your vet may run additional tests to try to identify other causes of the urinary incontinence.    if your cat is diagnosed with obstructions in their bladder  such as bladder stones  your vet may recommend surgery to remove them. the surgery can be invasive and expensive  but it will effectively relieve your cat s pain and discomfort.the surgery to remove bladder stones is called a cystotomy. it is performed by making an incision through your cat s belly and removing the stones from your cat s bladder. keep in mind cats who develop bladder stones have a high risk of getting them again. your vet may recommend medication or changes to your cat s diet to prevent the bladder stones from coming back.    if your cat s urinary incontinence is due to damage to their urinary tract  your vet may suggest surgery to repair your cat s urinary tract. though the surgery may be costly  it may be necessary if your cat s urinary tract is damaged.  your cat may need some tender loving care after their surgery to ensure they recover well. you should limit your cat s activity so they can heal. keep your cat indoors  such as in a crate or a small room in your home.you may also avoid giving your cat a bath so the incision area does not get wet. try to examine the incision area often to ensure it is healing properly. you may need to get a pet cone so your cat does not try to lick or pick at the incision area.  
