query	1	benchmarking have
query	59	job satisfaction get  knowing what you re good at  and thereby not good at  may lead you on a path to knowing where your skills may lead you best.    don t select a job in which you are weak. your liking for the job is utmost important to get higher satisfaction.    take the time to perform all your job duties to their fullest.    there is no replacement for this.    although you may think you know everything there is about a job  there s always something new to learn. don t just skip out on meetings or training classes just because you know everything there could be to the job. there may just a be a tidbit of information you may have forgotten  and the course may be only a small bit valuable.    be patient and wait for your job to finish before handing in a resignation letter. don t expect returns immediately for your job done. keep patience.    you have got your own brain and efforts.go on working till you get maximum satisfaction.of course every one has his own limitations.    jot down a few notes of what you need to get done during each day  in order of importance.    this will help you adjust to understanding potential conflicts in your day.    relax  your life will mean more than the work. you ll feel refreshed  knowing that you ll get the work done later while still being productive.    if you tend to eat  junk  food  your body will establish this ritual and make you feel like you yourself are  junk . add good healthy foods and you ll achieve a good working relationship.    think of your job as an adventure. stay positive for the positive aspects of any job you partake to doing.  
query	60	belief say What religion believes in reincarnation? How many lives does a human have? What religion believes in reincarnation? Can you believe in God and reincarnation? Does Kabbalah believe in reincarnation? Does Kabbalah believe in God? Does Kabbalah believe in reincarnation? Does Judaism believe one God? Does Kabbalah believe in reincarnation? How many commandments are there? How do you know if you were reincarnated? How do you do past life regression? How do you know if you were reincarnated? Did Buddha believe in reincarnation? What is the belief of reincarnation in Hinduism? What is the law of karma in Hinduism? What is the belief of reincarnation in Hinduism? What are the four stages of life in Hinduism? What is the belief of reincarnation in Hinduism? What is the significance of karma?  to believe in something  you must at least understand what it is. go to the bookstore  library  or search topics on the internet. look for hindu  buddhist  new age and wiccan approaches to reincarnation.    there are well known cases where children have gone to strange towns and known residents there and even insisted that a certain home was theirs. do these stories ring true for you or do you think adults prompted them     look for reincarnation proof in everything and everyone around you. what mechanism creates a child prodigy like mozart  could child prodigies simply have learnt their skills in previous lives and now remember them  do you have friends with incredible skills that came really easily to them     if they believe in it  do they have any examples they believe prove it     think undisturbed thoughts about life  death  in between  and reincarnation. consider whether it makes more sense to you that your mind simply stops existing after death. and if it doesn t  what do you think could happen to it  besides reincarnation     accepting new ideas takes time  as does finding proof that something is incorrect. take time to ensure your research totally convinces you.  
query	61	tagalog language teach
query	62	environmentalism support environmentalism and climate change awareness
query	63	bibliography write the bibliography What is bibliography and example? How do we write a bibliography? What is bibliography and example? Why is bibliography important? What goes in a bibliography? How do you write a bibliography in English? What goes in a bibliography? How do you write a bibliography for a school project? What goes in a bibliography? What is a bibliography in an assignment? How do you write a bibliography Harvard style? What is APA style of referencing? How do you write a bibliography Harvard style? How do you do footnotes? How do you write a bibliography Harvard style? What is Harvard referencing style?  reserve a page at the end of the paper for the bibliography. title it  references.  follow this heading with a list of articles  books  web publications  and other sources you used to inform your work.    articles are cited with the author s name  followed by the year  then the title of the article  the publication name  the volume and issue number  and the group of pages referenced. the format is as follows  author  a. a.    author  b. b.  year .  title of article.  title of journal  volume number issue number   pages.   example  jensen  o. e.  2012 .  african elephants.  savannah quarterly  2 1   88. if the article was retrieved online  include the words  retrieved from  followed by the web address. include as much information as you can find. if information is missing  leave it out.    start with the author s name  followed by the publication year  the title of the book  the location of the publisher  and finally the name of the publisher. the format is as follows  author  a. a.  year . title of book. location  publisher.   example  worden  b. l.  1999 . echoing eden. new york  new york  one two press.    include the author s name  the complete date  the title of the web page  and the words  retrieved from  with the web address. the format is as follows  author  a. a.  year  month day . title of web page document. retrieved from http   url to specific page   example  quarry  r. r.  may 23  2010 . wild skies. retrieved from http   wildskies.com. if no author is available  just start with the title. if no date is available  write  n.d.     apa requires the use of simple citations in parenthesis directly after the line or idea in your text for which you used a particular reference. the in text citations give limited information  and correspond with complete citations located in the bibliography at the end of the paper.   when paraphrasing a reference  include the author s last name and the year of publication. example  research showed that the monarch population has dwindled over the past ten years  jensen  2011 .  for direct quotes  include the author s last name  the year and the page number. example  the monarch butterfly population is  rapidly decreasing as a result of global warming   jensen  2011  p. 380 .  if you don t have an author s name  use the first few words of the publication title. example  fewer butterflies were seen on the california coast  butterfly news  2011 .     reserve a page at the end of your paper for the bibliography  referred to as  works cited  in mla style. write  works cited  at the top of the page  and list the books  articles  and websites that you used as sources in your paper.    start with the last name and first name of the author  followed by the title of the article  the title of the publication  the volume and issue number  the date  and the pages. be sure to use the correct italicization and punctuation. the format is as follows  author s last name  first name.  article title.  periodical title volume number date  pages.   example  green  marsha.  life in costa rica.  science magazine 1 4 mar. 2013  1 2. include as much information as you have on any given article.    include the author s last name and first name  the book title  the place of publication  the publishing company  and the publication date. the format is as follows  author s last name  first name. book title. additional information. city of publication  publishing company  publication date.   example  butler  olivia. parable of the flower. sacramento  seed press  1996.    start with the author s last and first name  if available    the title of the article or project  the title of the website  the date of publication  the name of the sponsoring institution  the date of access  and the full web address. the format is as follows  author s last name  first name.  title of work within a project or database.  title of site  project  or database. electronic publication information  date of publication or of the latest update  and name of any sponsoring institution or organization . date of access and  full url .   example  jong  june.  how to write an essay.  writing portal. 2 aug. 2012. university of california. 23 feb. 2013.  http   writingportal.com .    reserve a page for the bibliography at the end of your paper or book. write  bibliography  at the top and list the books  articles  websites  and so on that you used as sources in your work.    write the full name of the author  the article title  the journal or magazine title  the volume number  the date the article was published  and the page number. if you re citing a newspaper  leave out the volume number. the format is as follows  author first and last name.  article title.  journal title. volume number  date   page number.   example  skylar marsh.  walking on water.  earth magazine 4 2001   23.    write the full name of the author  the title of the book  the city of publication  the publisher  the publication year  and the page number. the format is as follows  walter white. space and time. new york  london press  1982.    write the name of the company or organization  the name of the web page or article  the date it was last modified  and the full web address. the format is as follows  company name.  name of web page.  date last modified. web address.   example  university of california.  history of university of california.  last modified april 3  2013. http   universityofcalifornia.com.  
query	64	email box send
query	65	google maps prepare Can you give me Google Maps? How do I use Google Maps on my phone? Can you give me Google Maps? Is the Google Maps app free? How do I use Google Maps in my car? What is the Google Maps lady's name? How do I use Google Maps in my car? How do I connect Google Maps to my car Bluetooth? How do I use Google Maps in my car? How do I use Google Maps on Android? What is the function of Google Maps? What does map stand for? What is the function of Google Maps? What is Google map in android? What is the function of Google Maps? How do I use Google Maps on my iPhone? How do I create a Google map? How can I change my location on Google? How do I create a Google map? Where is navigation settings in Google Maps? How do I create a Google map? How do I set my location on Google?  when you launch google maps  you should see a map  if your device can detect your current location  this will be of the surrounding area  and a text bar near the top of the screen. to find where an address is  simply type it in  using as much detail as you can  and hit enter or press the magnifying glass button.   for example  if you want to find 123 main street in appleton  california  you d type exactly that into the search bar  123 main street  appleton  ca. adding the zip code if you know it can help google maps find the place you re looking for  but you often won t need it.    if the place you re looking for has a name  for instance  if it s a business  a public building  a well known landmark  etc.   you usually won t have to put in its address. instead  just type in its name  or  if you can t remember it  your best guess  and press enter or click the magnifying glass. you can also add the city  state  and country if desired to get a more specific search.   for example  if you want to find the local library  you might type in something like  norman library appleton  ca.     sometimes  you may not know exactly where you need to go because you have many different choices  for instance  if you re deciding on a place to get dinner.  in this case  try to describe what you re looking for in general terms in the search bar. you can include the city  state  and so on if you re looking in a specific area.   for example  if you re looking for a place to get your car fixed  you might type in something like  car mechanics appleton  ca.     if your search brings up a single result  the map will move to display it and it will be marked with a dot. if your search brings up more than one result  the map will move to display some or all of them and each result will be marked with its own dot. in either case  you can zoom in and out to get a smaller or bigger picture of the location of your result s . to do this     browser  use the     buttons in the bottom right or scroll with the middle mouse button.  mobile  make a pinching motion with two fingers on the screen to zoom out. reverse this motion to zoom in.    if you get multiple results  clicking on any of the dots marked on the map should bring up the information that google maps has on it. depending on the type of location you re viewing  you may or may not see the following information    opening closing times reviews links to official websites photos of the location    one of the most useful features of google maps is that it allows you to get detailed  step by step directions to almost any place you can find in the world. to get directions  start by finding the place you want to go. you can do this with either its name or address   see the section above for greater detail.    when you find your destination  look in the information panel that pops up for a button that says  directions  and has an icon that looks like a fork in a road. click this to continue.    mobile  on mobile devices  instead  simply click the car icon in the bottom right that has a time value under it  e.g.  10 min.  1 hr 30 min.  etc.     if your device can detect where you currently are  it will automatically give you directions from your location to the destination you ve chosen. if it can t  you need to type your starting point into the text box that appears next to your destination.    often  google maps will offer you more than one route from the starting point you choose to your destination. for each route  it will display an estimated time for the trip and a short description of the route  e.g.   via i 880 north  . pick the route from the list that is most appealing to you. this may be the shortest one  the one that avoids highways  or something else entirely   it s up to you.    to see the directions for the route you ve chosen  do the following     browser  select the route from the list  then click  details  to see your directions. click each item in the list of directions to expand or collapse it so you can see the directions in greater detail. use the printer button at the top of the directions to print.  mobile  press  start navigation  for the route you want. google maps will begin to give you directions in real time. in other words  as you make each turn  it will update you with the next turn you ll need to make. click the tab at the bottom of the screen at any time to see a complete list of directions.    by default google maps finds directions for car traffic. if you re not traveling via car  you can still get accurate directions for your mode of transportation. as you are choosing the route you want  use the small icons at the top of the screen that look like different modes of transportation to get different types of directions. your options are    car public transportation  looks like a train  walking bicycle plane  browser only  for long distance trips     when you re planning an outing  it can be helpful to know ahead of time where restaurants  shopping centers  and so on are relative to the place you re visiting. finding businesses near a given location on google maps is easy. to start  just find this location with the search bar with its name or address.    when you find your location  the standard information panel should appear. look for the small link that says  search nearby  in this panel  it s underneath text that says  explore this area.      mobile  on mobile  instead of using a  search nearby  feature  you can just click once on the map to de select your location. any searches you make after this will be in the area surrounding the part of the map you re viewing.    now  you just need to describe what you re looking for to get a list of relevant results. when possible  your query should be written in the plural  e.g.   restaurants    barbers   etc.     mobile  with your location centered in the map  clear the search bar and type in your query.    to get an up to the minute view of how traffic is on the map  use the directions below. on the traffic readout  green areas have no traffic  yellow areas have moderate traffic  and red areas have heavy traffic.    browser  without any destination selected  click the small  traffic  link under the search bar.  mobile  tap the small tab in the bottom left and slide it left. click the  traffic  option in the list that displays.    this feature shows any bus  train  streetcar  or other public transit lines on the map. see below to activate it     browser  without any destination selected  click the small  transit  link under the search bar.  mobile  tap the small tab in the bottom left and slide it left. click the  transit  option in the list that displays.    this feature displays the locations of bike trails  lanes  and more. dark green lines denote trails  light green lines denote bike lanes  dotted lines denote bike friendly roads  and brown lines denote unpaved trails. see below     browser  without any destination selected  click the small  bicycling  link under the search bar.  mobile  tap the small tab in the bottom left and slide it left. click the  bicycling  option in the list that displays.    google street view allows you get up close images of locations on the map. you can even move around in this view as if you were walking down the street  to use street view  start by finding a location on the map you d like to view  either with its address or name.     once you find the place you re looking for  a panel of information on this location should pop up. click the  street view  button   it looks like a picture of the location itself.    mobile  on mobile  first  you must tap the tab at the bottom of the scree  not the driving directions button   then tap the street view button.    once you re in street view  you can look at your surroundings and even move around just like you were actually on the street. see below     browser  to look around  left click and hold down as you move the mouse around. to zoom in and out  use the middle mouse button or the     buttons in the bottom right. to move around  double click on a spot you d like to  walk  to and wait for the next screen to load.  mobile  to look around  tap and hold down as you move your finger across the screen. to zoom out  make a pinching motion with two fingers. to zoom in  reverse this motion. to move around  double tap on a spot you d like to  walk  to and wait for the next screen to load.  
query	66	property insurance receive  to ensure that all your property is correctly listed in the right rooms  place  post its   extra sticky  on each doorway and area of your home and write in the floor level and the room name.    to make sure that no rooms are left out later  list each room of each floor on a piece of paper. take a clear photo of this once it is filled out and hold on to it for later.    make sure your camera and or cell phone camera is set up and there is enough lighting. begin from the bottom floor and work your way up. once you choose a room to start  take a macro close up photo of the  post it  showing which room you are starting.   nan  in a clockwise direction  take clear  detailed photos of all of the contents in the room.  avoid camera shake blur.     ensure that they came out right  and important details such as what the item is  the brand  model    etc.  are displayed.   nan  start with taking a photo of the  post it  before you start a room  and complete these steps through all rooms of the house.  
query	67	voip phone use How do I connect my VoIP to my landline? Can I use my cordless phone with VoIP? How do I connect my VoIP to my landline? How do I setup a landline connection? Can I use VoIP phone at home? Does VoIP require a special phone? Can I use VoIP phone at home? Are VoIP calls free? Can I use VoIP phone at home? How much is VoIP monthly? How do I connect my VoIP phone to my wireless network? Does VoIP work over WiFi? How do I connect my VoIP phone to my wireless network? Can you plug a phone line into an Ethernet port? How do I connect my VoIP phone to my wireless network? How do I connect my landline to my router? Can a landline call a VoIP phone? Is VoIP better than landline? Can a landline call a VoIP phone? Is a VoIP number a cell phone? Can a landline call a VoIP phone? Can I use normal phone for VoIP?  this will isolate your in house phone line from the phone company and protect your voip adapter from damage.    this will activate all your existing home phone wiring on the voip phone service.  
query	68	separation of church and state allow
query	69	indian institute of technology joint entrance examination pass
query	70	history of television watch       nan nan nan    nan     you will get an lcd super television for your home and 1000 credits.  
