query	1	benchmarking practice comparing business processes performance metrics industry bests best practices companies. dimensions typically measured quality time cost. benchmarking used measure performance using specific indicator cost per unit measure productivity per unit measure cycle time x per unit measure defects per unit measure resulting metric performance compared others.also referred best practice benchmarking process benchmarking process used management organizations evaluate various aspects processes relation best practice companies processes usually within peer group defined purposes comparison. allows organizations develop plans make improvements adapt specific best practices usually aim increasing aspect performance. benchmarking may one event often treated continuous process organizations continually seek improve practices.
query	2	bodybuilding use progressive resistance exercise control develop one musculature aesthetic purposes. individual engages activity referred bodybuilder. competitive bodybuilding bodybuilders appear lineups perform specified poses later individual posing routines panel judges rank competitors based criteria symmetry muscularity size conditioning posing stage presentation. bodybuilders prepare competitions elimination nonessential body fat enhanced last stage combination extracellular dehydration carbohydrate loading achieve maximum muscular definition vascularity well tanning accentuate contrast skin spotlights. bodybuilders may use anabolic steroids performance enhancing drugs build muscles.
query	3	brainstorming group creativity technique efforts made find conclusion specific problem gathering list ideas spontaneously contributed members. words brainstorming situation group people meet generate new ideas solutions around specific domain interest removing inhibitions. people able think freely suggest many spontaneous new ideas possible. ideas noted without criticism brainstorming session ideas evaluated. term popularized alex faickney osborn 1953 book applied imagination.
query	4	business process management bpm discipline operations management people use various methods discover model analyze measure improve optimize automate business processes. combination methods used manage company business processes bpm. processes structured repeatable unstructured variable. though required enabling technologies often used bpm.it differentiated program management program management concerned managing group inter dependent projects. another viewpoint process management includes program management. project management process management use repeatable process improve outcome project.key distinctions process management project management repeatability predictability.
query	5	chain smoking practice smoking several cigarettes succession sometimes using ember finished cigarette light next. term chain smoker often also refers person smokes relatively constantly though necessarily chaining cigarette. term applies primarily cigarettes although used describe incessant cigar pipe smoking well. common form addiction. causes use cocaine amphetamine cigarettes result chain smoking.
query	6	funding act providing resources finance need program project. usually form money also take form effort time organization company. generally word used firm uses internal reserves satisfy necessity cash term financing used firm acquires capital external sources.sources funding include credit venture capital donations grants savings subsidies taxes. fundings donations subsidies grants direct requirement return investment described soft funding crowdfunding . funding facilitates exchange equity ownership company capital investment via online funding portal per jumpstart business startups act alternately jobs act 2012 u.s. known equity crowdfunding.
query	7	hair coloring hair dyeing practice changing hair color. main reasons cosmetic cover gray white hair change color regarded fashionable desirable restore original hair color discolored hairdressing processes sun bleaching. hair coloring done professionally hairdresser independently home. today hair coloring popular 75 women 18 men living copenhagen reported using hair dye according study university copenhagen . home coloring united states reached 1.9 billion 2011 expected rise 2.2 billion 2016.
query	8	traffic laws hit run act causing traffic accident stopping afterwards. considered supplemental crime jurisdictions. additional obligation many jurisdictions may additional obligation exchange information one financial responsibility including applicable insurance summon emergency services needed. may also requirement leave note containing pertinent information property owner present. history hit run laws arose difficulties early traffic collision victims faced identifying perpetrators could brought justice.
query	9	human trafficking trade humans purpose forced labour sexual slavery commercial sexual exploitation trafficker others. may encompass providing spouse context forced marriage extraction organs tissues including surrogacy ova removal. human trafficking occur within country trans nationally. human trafficking crime person violation victim rights movement coercion commercial exploitation. human trafficking trade people especially women children necessarily involve movement person one place another.people smuggling also called human smuggling migrant smuggling related practice characterized consent person smuggled.
query	10	language acquisition process humans acquire capacity perceive comprehend language words gain ability aware language understand well produce use words sentences communicate. language acquisition involves structures rules representation. capacity successfully use language requires one acquire range tools including phonology morphology syntax semantics extensive vocabulary. language vocalized speech manual sign. human language capacity represented brain.
query	11	mediation dynamic structured interactive process impartial third party assists disputing parties resolving conflict use specialized communication negotiation techniques. participants mediation encouraged actively participate process. mediation party centered process focused primarily upon needs rights interests parties. mediator uses wide variety techniques guide process constructive direction help parties find optimal solution. mediator facilitative manages interaction parties facilitates open communication.
query	12	prank call also known crank call phony call hoax call telephone call intended caller practical joke played person answering. often type nuisance call. recordings prank phone calls became staple obscure amusing cassette tapes traded among musicians sound engineers media traders united states late 1970s. among famous earliest recorded prank calls tube bar prank calls tapes centered louis red deutsch. comedian jerry lewis incorrigible phone prankster recordings hijinks dating 1960s possibly earlier still circulate day.
query	13	pull upper body strength exercise. pull closed chain movement body suspended hands pulls up. happens elbows flex shoulders adduct extend bring elbows torso. term chin traditionally referring pull chin brought top bar used 1980s refer pronated overhand grip supinated underhand grip called reverse grip chin up. later decades usage inverted using chin refer pull done supinated hand position pull refers specifically exercise done pronated hand position.pull ups use many different muscles upper body including latissimus dorsi biceps brachii.
query	14	question answering qa computer science discipline within fields information retrieval natural language processing nlp concerned building systems automatically answer questions posed humans natural language. overview question answering implementation usually computer program may construct answers querying structured database knowledge information usually knowledge base. commonly question answering systems pull answers unstructured collection natural language documents. examples natural language document collections used question answering systems include local collection reference texts internal organization documents web pages compiled newswire reports set wikipedia pages subset world wide web pagesquestion answering research attempts deal wide range question types including fact list definition hypothetical semantically constrained cross lingual questions. closed domain question answering deals questions specific domain example medicine automotive maintenance exploit domain specific knowledge frequently formalized ontologies.
query	15	context information security especially network security spoofing attack situation person program successfully identifies another falsifying data gain illegitimate advantage. spoofing tcp ip many protocols tcp ip suite provide mechanisms authenticating source destination message thus vulnerable spoofing attacks extra precautions taken applications verify identity sending receiving host. ip spoofing arp spoofing particular may used leverage man middle attacks hosts computer network. spoofing attacks take advantage tcp ip suite protocols may mitigated use firewalls capable deep packet inspection taking measures verify identity sender recipient message. referrer spoofing websites especially pornographic paysites allow access materials certain approved login pages.
query	16	spray painting painting technique device sprays coating paint ink varnish etc. air onto surface. common types employ compressed gas usually air atomize direct paint particles. spray guns evolved airbrushes two usually distinguished size size spray pattern produce. airbrushes hand held used instead brush detailed work photo retouching painting nails fine art. air gun spraying uses equipment generally larger.
query	17	translation communication meaning source language text means equivalent target language text. english language draws terminological distinction exist every language translating written text interpreting oral signed communication users different languages distinction translation begin appearance writing within language community. translator always risks inadvertently introducing source language words grammar syntax target language rendering. hand spill overs sometimes imported useful source language calques loanwords enriched target languages. translators including early translators sacred texts helped shape languages translated.because laboriousness translation process since 1940s efforts made varying degrees success automate translation mechanically aid human translator.
query	18	voting method group meeting electorate order make collective decision express opinion usually following discussions debates election campaigns. democracies elect holders high office voting. residents place represented elected official called constituents constituents cast ballot chosen candidate called voters . different systems collecting votes. politics democracy government chosen voting election way electorate elect i.e.
query	19	mother spanish todo sobre mi madre 1999 spanish drama film written directed pedro almod var starring cecilia roth marisa paredes antonia san juan pen lope cruz candela pe a. plot originates almod var earlier film flower secret 1995 shows student doctors trained persuade grieving relatives allow organs used transplant focusing mother teenager killed road accident. mother deals complex issues aids homosexuality transsexualism faith existentialism. film commercial critical success internationally winning oscar best foreign language film addition golden globe best foreign language film bafta awards best film english language best direction almod var . film also 6 goya awards including best film best director almod var best actress roth .
query	20	animal farm allegorical novella george orwell first published england 17 august 1945. book tells story group farm animals rebel human farmer hoping create society animals equal free happy. ultimately however rebellion betrayed farm ends state bad dictatorship pig named napoleon. according orwell fable reflects events leading russian revolution 1917 stalinist era soviet union. orwell democratic socialist critic joseph stalin hostile moscow directed stalinism attitude critically shaped experiences spanish civil war.
query	21	back future 1985 american science fiction film directed robert zemeckis written zemeckis bob gale. stars michael j. fox teenager marty mcfly accidentally travels back time 1985 1955 meets future parents becomes mother romantic interest. christopher lloyd portrays eccentric scientist dr. emmett doc brown friend inventor time traveling delorean automobile helps marty repair history return 1985. cast also includes lea thompson marty mother lorraine crispin glover father george thomas f. wilson biff tannen marty george arch nemesis.
query	22	braveheart 1995 american epic war film directed co produced mel gibson portrays william wallace late 13th century scottish warrior. film fictionally based life wallace leading scots first war scottish independence king edward england. film also stars sophie marceau patrick mcgoohan catherine mccormack. story inspired blind harry epic poem actes deidis illustre vallyeant campioun schir william wallace adapted screen randall wallace. development film initially started metro goldwyn mayer producer alan ladd jr.
query	23	give five 25th single japanese girl idol group akb48. also akb48 fifth sakura themed single first single 2012. single released japan february 15 2012.give five akb48 fifth sakura themed single. however unlike previous ones single title contain word sakura.the music video song give five
query	24	ignorance bliss fifth studio album british rapper skepta. released 31 may 2019 boy better know follow 2016 album konnichiwa. album features appearances nafe smallz key j hus cheb rabi b live lancey foux lay z wizkid boy better know. upon release ignorance bliss met positive reviews debuted number two uk albums chart. album supported singles bullet gun greaze mode nafe smallz.
query	25	road 1957 novel american writer jack kerouac based travels kerouac friends across united states. considered defining work postwar beat counterculture generations protagonists living life backdrop jazz poetry drug use. novel roman clef many key figures beat movement william s. burroughs old bull lee allen ginsberg carlo marx neal cassady dean moriarty represented characters book including kerouac narrator sal paradise. idea road kerouac second novel formed late 1940s series notebooks typed continuous reel paper three weeks april 1951. first published viking press 1957.
query	26	daughter french notre fille 1981 cameroonian drama film directed daniel kamwa. entered 12th moscow international film festival. film also selected cameroonian entry best foreign language film 53rd academy awards accepted nominee.
query	27	predator 1987 american science fiction action horror film directed john mctiernan written brothers jim john thomas. stars arnold schwarzenegger leader elite military rescue team mission save hostages guerrilla held territory central america. kevin peter hall co stars predator technologically advanced alien spying stalking hunting main characters. predator written 1984 working title hunter. filming ran march june 1986 creature effects devised stan winston budget around 15 million.
query	28	second season prison break american serial drama television series commenced airing united states august 21 2006 mondays 9 00 pm est fox broadcasting company. prison break produced adelstein parouse productions association rat television original television movie 20th century fox television. season contains 22 episodes concluded april 2 2007. series creator paul scheuring describes second season fugitive times eight likens second half great escape. prison break revolves around two brothers one sentenced death crime commit younger sibling genius devises elaborate plan help escape prison. brothers along six prisoners fox river state penitentiary manage escape second season follows massive manhunt chasing group.
query	29	run fast debut album julie ruin released september 3 2013. track 3 kind mixed james murphy lcd soundsystem. critical reception run fast received generally favorable reviews music critics. track listing music composed kathleen hanna sara landeau kenny mellman kathi wilcox carmine covelli. lyrics kathleen hanna kenny mellman.
query	30	shakespeare plays reputation among greatest english language western literature. traditionally plays divided genres tragedy history comedy translated every major living language addition continually performed around world. many plays appeared print series quartos approximately half remained unpublished 1623 posthumous first folio published. traditional division plays tragedies comedies histories follows categories used first folio. however modern criticism labeled plays problem plays elude easy categorisation perhaps purposely break generic conventions introduced term romances scholars believe later comedies.
query	31	showtime 2002 american buddy cop action comedy film directed tom dey. film stars robert de niro eddie murphy lead roles alongside rene russo william shatner pedro damian de niro real life daughter drena de niro. film released united states march 15 2002. plot film centers two lapd cops det. mitch preston robert de niro officer trey sellars eddie murphy paired reality police show run real trouble crime lord.
query	32	young simplified chinese traditional chinese 2013 chinese drama film directed zhao wei. based best selling novel name youth fading away xin yiwu. film zhao directorial debut. film english language title alludes song young british alternative rock band suede self titled debut album. addition novel film also based part zhao personal college experience 1990s.the film become major success chinese box office grossing us 118 million us 5 million budget.
query	33	somebody help 2007 american horror television film starring marques houston omarion written directed music producer chris stokes.the film premiered bet october 31 2007 released dvd united states november 13 2007. plot somebody help story brendan young marques houston darryl jennings omarion grandberry head girlfriends respectively serena brooklyn sudano kimmy alexis fields friends weekend stay remote cabin woods. couples settle things take eerie turn. one one group ends missing dead remaining forced band together figure behind killings.the murderer kills victims slicing parts body. killings order include barbara jessica friedman part head sliced andrea amanda lee entire scalp ripped mike garristone koch barbara boyfriend eyes fingernails ripped sheriff throat slit ken luke fryden andrea boyfriend teeth ripped smothered death.
query	34	staying alive 1983 american dance musical film starring john travolta dancer tony manero cynthia rhodes finola hughes joyce hyser julie bovasso dancers viktor manoel kevyn morrow. sequel saturday night fever 1977 . film directed sylvester stallone also co produced co wrote film original saturday night fever producer writer robert stigwood norman wexler respectively. along homefront one two films stallone wrote without star although cameo appearance . choreography done dennon sayhber rawles.
query	35	striptease 1996 american erotic black comedy film directed co produced written andrew bergman starring demi moore armand assante ving rhames robert patrick burt reynolds. based carl hiaasen novel name film centers fbi secretary turned stripper becomes involved child custody dispute corrupt politics. striptease released theatrically june 28 1996 columbia pictures universally panned critics several golden raspberry awards including worst picture. although underperformed north american box office film still managed moderate financial success overseas worldwide gross 113 million 50 million budget. nevertheless widely considered failure mostly performance domestically failing meet expectations.
query	36	take song norwegian synthpop band ha first released 1984. original version produced tony mansfield remixed john ratcliff. new version produced alan tarney group debut studio album hunting high low 1985 . song combines synthpop varied instrumentation includes acoustic guitars keyboards drums. considered band signature song.
query	37	terms endearment 1983 american comedy drama film adapted larry mcmurtry 1975 novel directed written produced james l. brooks starring shirley maclaine debra winger jack nicholson danny devito jeff daniels john lithgow. film covers 30 years relationship aurora greenway maclaine daughter emma winger . film became major critical commercial success. grossed 108.4 million domestic box office becoming second highest grossing film 1983 received leading eleven nominations 56th academy awards four highest five best picture best director best actress maclaine best adapted screenplay well best supporting actor nicholson . plot widowed aurora greenway shirley maclaine keeps several suitors arm length focusing instead close controlling relationship daughter emma debra winger .
query	38	devil wears prada 2006 american comedy drama film directed david frankel produced wendy finerman. screenplay written aline brosh mckenna based lauren weisberger 2003 novel name. film adaptation stars meryl streep miranda priestly powerful fashion magazine editor anne hathaway andrea andy sachs college graduate goes new york city lands job priestly co assistant. emily blunt stanley tucci co star co assistant emily charlton art director nigel respectively. adrian grenier simon baker tracie thoms play key supporting roles.
query	39	wizard oz 1939 american musical fantasy film produced metro goldwyn mayer. widely regarded one greatest films cinema history commercially successful adaptation l. frank baum 1900 children fantasy novel wonderful wizard oz. directed primarily victor fleming left production take troubled gone wind film stars judy garland dorothy gale alongside ray bolger jack haley bert lahr. characterized use technicolor fantasy storytelling musical score memorable characters film become american pop culture icon. nominated six academy awards including best picture lost gone wind also directed fleming.
query	40	incredible hulk 2008 american superhero film based marvel comics character hulk produced marvel studios distributed universal pictures. second film marvel cinematic universe mcu . film directed louis leterrier screenplay zak penn. stars edward norton bruce banner alongside liv tyler tim roth tim blake nelson ty burrell william hurt. incredible hulk bruce banner becomes hulk unwitting pawn military scheme reinvigorate super soldier program gamma radiation.
query	41	paper 1994 american comedy drama film directed ron howard starring michael keaton glenn close marisa tomei randy quaid robert duvall. received academy award nomination best original song make mind written performed randy newman. film depicts hectic 24 hours newspaper editor professional personal life. main story day murder couple visiting businessmen. reporters discover evidence suggesting police cover evidence suspects innocence rush scoop story midst professional private financial chaos.
query	42	pyramid 2014 american found footage supernatural horror film directed gr gory levasseur directorial debut produced alexandre aja distributed 20th century fox. plot follows archaeological team attempting unlock secrets lost pyramid find hunted insidious creature stars ashley hinshaw denis hare james buckley daniel amerman. pyramid released december 5 2014 negatively received critics. plot egypt three sided pyramid discovered buried 600 feet 180 desert surface archaeological team led dr. miles holden.
query	43	sixth sense 1999 american supernatural psychological thriller film written directed m. night shyamalan. film tells story cole sear haley joel osment boy able see talk dead malcolm crowe bruce willis child psychologist tries help him. film established shyamalan writer director introduced cinema public traits notably affinity surprise endings.released hollywood pictures august 6 1999 film well received critics praise given acting performances particularly willis osment toni collette atmosphere twist conclusion. sixth sense second highest grossing film 1999 behind star wars episode phantom menace taking 293 million us 379 million markets. film nominated six academy awards including best picture best director best original screenplay shyamalan best supporting actor osment best supporting actress collette.
query	44	tall man 2011 australian documentary directed tony krawitz. death cameron mulrunji doomadgee police custody palm island queensland 19 november 2004. synopsis tall man explores community reaction events surrounding death cameron doomadgee 36 year old palm island man walking home intoxicated singing favourite song let dogs arrested harassing attacking public bystanders. doomadgee arrested sergeant chris hurley tall man 45 minutes later found dead police custody liver almost split two four broken ribs ruptured spleen severe bruising head torn portal vein. police claimed death caused tripping step colluded protect chris hurley facing charges incident.
query	45	today also called today show american news talk morning television show airs nbc. program debuted january 14 1952. first genre american television world 68 years broadcasting fifth longest running american television series. originally weekday two hour program 7 00 a.m. 9 00 a.m. expanded sundays 1987 saturdays 1992. weekday broadcast expanded three hours 2000 four hours 2007 though time third fourth hours became distinct entities .
