query	53	a flood is an overflow of water that submerges land that is usually dry. in the sense of  flowing water , the word may also be applied to the inflow of the tide. floods are an area of study of the discipline hydrology and are of significant concern in agriculture, civil engineering and public health. flooding may occur as an overflow of water from water bodies, such as a river, lake, or ocean, in which the water overtops or breaks levees, resulting in some of that water escaping its usual boundaries, or it may occur due to an accumulation of rainwater on saturated ground in an areal flood. while the size of a lake or other body of water will vary with seasonal changes in precipitation and snow melt, these changes in size are unlikely to be considered significant unless they flood property or drown domestic animals. floods can also occur in rivers when the flow rate exceeds the capacity of the river channel, particularly at bends or meanders in the waterway. floods often cause damage to homes and businesses if they are in the natural flood plains of rivers. while riverine flood damage can be eliminated by moving away from rivers and other bodies of water, people have traditionally lived and worked by rivers because the land is usually flat and fertile and because rivers provide easy travel and access to commerce and industry. some floods develop slowly, while others can develop in just a few minutes and without visible signs of rain. additionally, floods can be local, impacting a neighborhood or community, or very large, affecting entire river basins
query	54	anti gravity  also known as non gravitational field  is creating a place or object that is free from the force of gravity. it does not refer to the lack of weight under gravity experienced in free fall or orbit, or to balancing the force of gravity with some other force, such as electromagnetism or aerodynamic lift. anti gravity is a recurring concept in science fiction, particularly in the context of spacecraft propulsion.  examples are the gravity blocking substance  cavorite  in h. g. wells s the first men in the moon and the spindizzy machines in james blish s cities in flight.  anti gravity  is often used to refer to devices that look as if they reverse gravity even though they operate through other means, such as lifters, which fly in the air by moving air with electromagnetic fields.
query	55	the hypertext transfer protocol  http  is an application protocol for distributed, collaborative, hypermedia information systems. http is the foundation of data communication for the world wide web, where hypertext documents include hyperlinks to other resources that the user can easily access, for example by a mouse click or by tapping the screen in a web browser. development of http was initiated by tim berners lee at cern in 1989. development of early http requests for comments  rfcs  was a coordinated effort by the internet engineering task force  ietf  and the world wide web consortium  w3c , with work later moving to the ietf. http 1.1 was first documented in rfc 2068 in 1997. that specification was obsoleted by rfc 2616 in 1999, which was likewise replaced by the rfc 7230 family of rfcs in 2014. http 2 is a more efficient expression of http s semantics  on the wire , and was published in 2015  it is now supported by major web servers and browsers over transport layer security  tls  using an application layer protocol negotiation  alpn  extension where tls 1.2 or newer is required.http 3 is the proposed successor to http 2, which is already in use on the web, using udp instead of tcp for the underlying transport protocol
query	56	php is a general purpose programming language originally designed for web development. it was originally created by rasmus lerdorf in 1994  the php reference implementation is now produced by the php group. php originally stood for personal home page, but it now stands for the recursive initialism php  hypertext preprocessor.php code may be executed with a command line interface  cli , embedded into html code, or used in combination with various web template systems, web content management systems, and web frameworks. php code is usually processed by a php interpreter implemented as a module in a web server or as a common gateway interface  cgi  executable. the web server outputs the results of the interpreted and executed php code, which may be any type of data, such as generated html code or binary image data. php can be used for many programming tasks outside of the web context, such as standalone graphical applications and robotic drone control.the standard php interpreter, powered by the zend engine, is free software released under the php license. php has been widely ported and can be deployed on most web servers on almost every operating system and platform, free of charge.the php language evolved without a written formal specification or standard until 2014, with the original implementation acting as the de facto standard which other implementations aimed to follow
query	57	english grammar is the way in which meanings are encoded into wordings in the english language. this includes the structure of words, phrases, clauses, and sentences, right up to the structure of whole texts. there are historical, social, cultural and regional variations of english. divergences from the grammar described here occur in some dialects. this article describes a generalized present day standard english   a form of speech and writing used in public discourse, including broadcasting, education, entertainment, government, and news, over a range of registers from formal to informal. there are differences in grammar between the standard forms of british, american, and australian english, although these are more minor than differences in vocabulary and pronunciation. modern english has largely abandoned the inflectional case system of indo european in favor of analytic constructions. the personal pronouns retain morphological case more strongly than any other word class  a remnant of the more extensive germanic case system of old english . for other pronouns, and all nouns, adjectives, and articles, grammatical function is indicated only by word order, by prepositions, and by the  saxon genitive or english possessive     s .eight  word classes  or  parts of speech  are commonly distinguished in english  nouns, determiners, pronouns, verbs, adjectives, adverbs, prepositions, and conjunctions
query	58	free education is education funded through government spending or charitable organizations rather than tuition funding. many models of free higher education have been proposed. primary school and other comprehensive or compulsory education is free in many countries  often not including primary textbook as well as certain post secondary administrative and sundry fees , including post graduate studies in the nordic countries. the article 13 of international covenant on economic, social and cultural rights ensures the right to free education at primary education and progressive introduction of it at secondary and higher education as the right to education.in university of oslo, there is no tuition fee except a small semester fee of nok 600   us 74 . from 2013 in northern europe, estonia started providing free higher education as well. sweden, until the early 21st century, provided free education to foreign students but changes have been introduced to charge fees to foreign students from outside the european community. denmark also has universal free education, and provides a monthly stipend, the  statens uddannelsesst tte  or  su , to students over 18 years of age or students who are under 18 and attending a higher education. bachelor and master s degree programmes in denmark are offered in either danish or english depending on the programme or university. argentina, brazil, cuba, czech republic, greece, hungary, and turkey provide free education at all levels, including college and university for its citizens
query	59	job satisfaction or employee satisfaction is a measure of workers  contentedness with their job, whether or not they like the job or individual aspects or facets of jobs, such as nature of work or supervision. job satisfaction can be measured in cognitive  evaluative , affective  or emotional , and behavioral components. researchers have also noted that job satisfaction measures vary in the extent to which they measure feelings about the job  affective job satisfaction . or cognitions about the job  cognitive job satisfaction .one of the most widely used definitions in organizational research is that of locke  1976 , who defines job satisfaction as  a pleasurable or positive emotional state resulting from the appraisal of one s job or job experiences   p. 1304 . others have defined it as simply how content an individual is with his or her job  whether he or she likes the job or not. it is assessed at both the global level  whether or not the individual is satisfied with the job overall , or at the facet level  whether or not the individual is satisfied with different aspects of the job . spector  1997  lists 14 common facets  appreciation, communication, coworkers, fringe benefits, job conditions, nature of the work, organization, personal growth, policies and procedures, promotion opportunities, recognition, security, and supervision.
query	60	belief is the attitude that something is the case or true. in epistemology, philosophers use the term  belief  to refer to personal attitudes associated with true or false ideas and concepts. however,  belief  does not require active introspection and circumspection. for example, few ponder whether the sun will rise, just assume it will. since  belief  is an important aspect of mundane life, according to eric schwitzgebel in the stanford encyclopedia of philosophy, a related question asks   how a physical organism can have beliefs  in the context of ancient greek thought, two related concepts were identified regarding the concept of belief  pistis and doxa. simplified, pistis refers to  trust  and  confidence , while doxa refers to  opinion  and  acceptance . the english word  orthodoxy  derives from doxa.  
query	61	tagalog is an austronesian language spoken as a first language by a quarter of the population of the philippines and as a second language by the majority. its standardized form, officially named filipino, is the national language of the philippines, and is one of two official languages alongside english. it is related to other philippine languages, such as the bikol languages, ilocano, the visayan languages, kapampangan, and pangasinan, and more distantly to other austronesian languages, such as the formosan languages of taiwan, malay  malaysian and indonesian , hawaiian, m ori, and malagasy.
query	62	environmentalism or environmental rights is a broad philosophy, ideology, and social movement regarding concerns for environmental protection and improvement of the health of the environment, particularly as the measure for this health seeks to incorporate the impact of changes to the environment on humans, animals, plants and non living matter. while environmentalism focuses more on the environmental and nature related aspects of green ideology and politics, ecology combines the ideology of social ecology and environmentalism. environmentalism advocates the preservation, restoration and improvement of the natural environment and critical earth system elements or processes such as the climate, and may be referred to as a movement to control pollution or protect plant and animal diversity. for this reason, concepts such as a land ethic, environmental ethics, biodiversity, ecology, and the biophilia hypothesis figure predominantly. at its crux, environmentalism is an attempt to balance relations between humans and the various natural systems on which they depend in such a way that all the components are accorded a proper degree of sustainability. the exact measures and outcomes of this balance is controversial and there are many different ways for environmental concerns to be expressed in practice. environmentalism and environmental concerns are often represented by the colour green, but this association has been appropriated by the marketing industries for the tactic known as greenwashing. environmentalism is opposed by anti environmentalism, which says that the earth is less fragile than some environmentalists maintain, and portrays environmentalism as overreacting to the human contribution to climate change or opposing human advancement.  
query	63	bibliography  from ancient greek          , romanized  biblion, lit.  book  and        ,  graph  ,  writing  , as a discipline, is traditionally the academic study of books as physical, cultural objects  in this sense, it is also known as bibliology  from ancient greek         , romanized   log   . carter and barker  2010  describe bibliography as a twofold scholarly discipline the organized listing of books  enumerative bibliography  and the systematic description of books as objects  descriptive bibliography .
query	64	an email box  also email mailbox,  e mailbox  is the destination to which electronic mail messages are delivered. it is the equivalent of a letter box in the postal system.
query	65	google maps is a web mapping service developed by google. it offers satellite imagery, aerial photography, street maps, 360  panoramic views of streets  street view , real time traffic conditions, and route planning for traveling by foot, car, bicycle and air  in beta , or public transportation. google maps began as a c   desktop program at where 2 technologies. in october 2004, the company was acquired by google, which converted it into a web application. after additional acquisitions of a geospatial data visualization company and a realtime traffic analyzer, google maps was launched in february 2005. the service s front end utilizes javascript, xml, and ajax. google maps offers an api that allows maps to be embedded on third party websites, and offers a locator for businesses and other organizations in numerous countries around the world. google map maker allowed users to collaboratively expand and update the service s mapping worldwide but was discontinued from march 2017. however, crowdsourced contributions to google maps were not discontinued as the company announced those features would be transferred to the google local guides program.google maps  satellite view is a  top down  or bird s eye view  most of the high resolution imagery of cities is aerial photography taken from aircraft flying at 800 to 1,500 feet  240 to 460 m , while most other imagery is from satellites
query	66	property insurance provides protection against most risks to property, such as fire, theft and some weather damage. this includes specialized forms of insurance such as fire insurance, flood insurance, earthquake insurance, home insurance, or boiler insurance. property is insured in two main ways open perils and named perils. open perils cover all the causes of loss not specifically excluded in the policy. common exclusions on open peril policies include damage resulting from earthquakes, floods, nuclear incidents, acts of terrorism, and war.  named perils require the actual cause of loss to be listed in the policy for insurance to be provided. the more common named perils include such damage causing events as fire, lightning, explosion, and theft.
query	67	a voip phone or ip phone uses voice over ip technologies for placing and transmitting telephone calls over an ip network, such as the internet, instead of the traditional public switched telephone network  pstn .digital ip based telephone service uses control protocols such as the session initiation protocol  sip , skinny client control protocol  sccp  or various other proprietary protocols.
query	68	the separation of church and state is a philosophic and jurisprudential concept for defining political distance in the relationship between religious organizations and the nation state. conceptually, the term refers to the creation of a secular state  with or without legally explicit church state separation  and to disestablishment, the changing of an existing, formal relationship between the church and the state.in a society, the degree of political separation between the church and the civil state is determined by the legal structures and prevalent legal views that define the proper relationship between organized religion and the state. the arm s length principle proposes a relationship wherein the two political entities interact as organizations independent of the authority of the other. the strict application of secular principle of la cit   secularity  is used in france, while secular societies, such as denmark and the united kingdom, maintain a form of constitutional recognition of an official state religion.the philosophy of the separation of the church from the civil state parallels the philosophies of secularism, disestablishmentarianism, religious liberty, and religious pluralism, by way of which the european states assumed some of the social roles of the church, the welfare state, a social shift that produced a culturally secular population and public sphere. in practice, church state separation varies from total separation, mandated by the country s political constitution, as in india and singapore, to a state religion, as in the maldives.
query	69	joint entrance examination   advanced  jee advanced , formerly the indian institutes of technology joint entrance examination  iit jee , is an academic examination held annually in india. it is conducted by one of the seven zonal iits  iit roorkee, iit kharagpur, iit delhi, iit kanpur, iit bombay, iit madras, and iit guwahati  under guidance of the joint admission board  jab . it is the sole prerequisite for admission in the indian institutes of technology. other universities like the rajiv gandhi institute of petroleum technology, indian institute of science education and research  iisers , and the indian institute of science also uses the score obtained in jee advanced as the basis for admission. any student who was admitted to iit cannot appear for the jee advanced, but the same is not the case with iisc, iiser, rgipt and other institutes, because these institutes only use jee advanced scores as a criterion for admission. the examination is organised each year by one of the iit, on a round robin rotation pattern. it has a very low qualification rate  about 9,369 in 479,651 in 2012   1.95   1  the qualification rate of the jee advanced in 2017 was approximately 0.92   about 11,000 out of 1,200,000 who applied for jee main .in 2013 the examination, originally called the iit jee, was renamed as jee  advanced , and the aieee was renamed jee  main 
query	70	the invention of television was the work of many individuals in the late 19th and early 20th centuries. the first practical transmissions of moving images over a radio system used mechanical rotating perforated disks to scan a scene into a time varying signal that could be reconstructed at a receiver back into an approximation of the original image. development of television was interrupted by the second world war.  after the end of the war, all electronic methods of scanning and displaying images became standard. several different standards for addition of color to transmitted images were developed, with different regions using technically incompatible signal standards.  television broadcasting expanded rapidly after world war ii, becoming an important mass medium for advertising, propaganda, and entertainment. television broadcasts can be distributed over the air by vhf and uhf radio signals from terrestrial transmitting stations, by microwave band signals from earth orbiting satellites, or by wired transmission to individual consumers by cable tv. many countries have moved away from the original analog radio transmission methods and now use digital television standards, providing additional operating features and conserving radio spectrum bandwidth for more profitable uses. television programming can also be distributed over the internet.  television broadcasting may be funded by advertising revenue, by private or governmental organizations prepared to underwrite the cost, or in some countries, by television license fees paid by owners of receivers
query	71	acupuncture is a form of alternative medicine and a key component of traditional chinese medicine  tcm  in which thin needles are inserted into the body. acupuncture is a pseudoscience because the theories and practices of tcm are not based on scientific knowledge, and it has been characterized as quackery. there is a range of acupuncture variants which originated in different philosophies, and techniques vary depending on the country in which it is performed. it is most often used to attempt pain relief, though acupuncturists say that it can also be used for a wide range of other conditions. acupuncture is generally used only in combination with other forms of treatment.the conclusions of numerous trials and systematic reviews of acupuncture are inconsistent, which suggests that it is not effective. an overview of cochrane reviews found that acupuncture is not effective for a wide range of conditions. a systematic review conducted by medical scientists at the universities of exeter and plymouth found little evidence of acupuncture s effectiveness in treating pain. overall, the evidence suggests that short term treatment with acupuncture does not produce long term benefits. some research results suggest that acupuncture can alleviate some forms of pain, though the majority of research suggests that acupuncture s apparent effects are not caused by the treatment itself
query	72	the apgar score is a method to quickly summarize the health of newborn children against infant mortality. virginia apgar, an anesthesiologist at newyork presbyterian hospital, developed the score in 1952 to quantify the effects of obstetric anesthesia on babies.the apgar score is determined by evaluating the newborn baby on five simple criteria on a scale from zero to two, then summing up the five values thus obtained. the resulting score ranges from zero to 10. the five criteria are summarized using words chosen to form a backronym  appearance, pulse, grimace, activity, respiration .
query	73	asthma is a common long term inflammatory disease of the airways of the lungs. it is characterized by variable and recurring symptoms, reversible airflow obstruction, and easily triggered bronchospasms. symptoms include episodes of wheezing, coughing, chest tightness, and shortness of breath. these may occur a few times a day or a few times per week. depending on the person, asthma symptoms may become worse at night or with exercise.asthma is thought to be caused by a combination of genetic and environmental factors. environmental factors include exposure to air pollution and allergens. other potential triggers include medications such as aspirin and beta blockers. diagnosis is usually based on the pattern of symptoms, response to therapy over time, and spirometry lung function testing. asthma is classified according to the frequency of symptoms, forced expiratory volume in one second  fev1 , and peak expiratory flow rate
query	74	back pain, also known as backache, is pain felt in the back. the back is divided into neck pain  cervical , middle back pain  thoracic , lower back pain  lumbar  or coccydynia  tailbone or sacral pain  based on the segment affected. the lumbar area is the most common area affected. episodes of back pain may be acute, sub acute, or chronic depending on the duration. the pain may be characterized as a dull ache, shooting or piercing pain, or a burning sensation. discomfort can radiate into the arms and hands as well as the legs or feet, and may include numbness, or weakness in the legs and arms. the majority of back pain is nonspecific with no identifiable causes. common underlying mechanisms include degenerative or traumatic changes to the discs and facets joints, which can then cause secondary pain in the muscles, and  nerves, and referred pain to the bones, joints and extremities. diseases and inflammation of the gallbladder, pancreas, aorta, and kidneys may also cause referred pain in the back. tumors of the vertebrae, neural tissues and adjacent structures can also manifest as back pain
query	75	brian  sometimes spelled bryan in english  is a male given name of irish and breton origin, as well as a surname of occitan origin. it is common in the english speaking world. it is possible that the name is derived from an old celtic word meaning  high  or  noble . for example, the element bre means  hill   which could be transferred to mean  eminence  or  exalted one . the name is quite popular in ireland, on account of brian boru, a 10th century high king of ireland. the name was also quite popular in east anglia during the middle ages. this is because the name was introduced to england by bretons following the norman conquest. bretons also settled in ireland along with the normans in the 12th century, and  their  name was mingled with the  irish  version. also, in the north west of england, the  irish  name was introduced by scandinavian settlers from ireland. within the gaelic speaking areas of scotland, the name was at first only used by professional families of irish origin
