query	101	espn  originally an initialism for entertainment and sports programming network  is an american basic cable sports channel owned by espn inc., owned jointly by the walt disney company  80   and hearst communications  20  . the company was founded in 1979 by bill rasmussen along with his son scott rasmussen and ed egan. espn broadcasts primarily from studio facilities located in bristol, connecticut. the network also operates offices in miami, new york city, seattle, charlotte, and los angeles. james pitaro currently serves as chairman of espn, a position he has held since march 5, 2018, following the resignation of john skipper on december 18, 2017. while espn is one of the most successful sports networks, there has been much criticism of espn, which includes accusations of biased coverage, conflict of interest, and controversies with individual broadcasters and analysts.  as of september 2018, espn is available to approximately 86 million television households  93.2  of households with pay television  in the united states.in addition to the flagship channel and its seven related channels in the united states, espn broadcasts in more than 200 countries, operating regional channels in australia, brazil, latin america, and the united kingdom, and owning a 20  interest in the sports network  tsn  as well as its five sister networks in canada
query	102	fedex corporation is an american multinational delivery services company headquartered in memphis, tennessee. the name  fedex  is a syllabic abbreviation of the name of the company s original air division, federal express  now fedex express , which was used from 1973 until 2000.  the company is known for its overnight shipping service and pioneering a system that could track packages and provide real time updates on package location, a feature that has now been implemented by most other carrier services.
query	103	the f d ration internationale de football association  fifa  fee f   french for international federation of association football  spanish  federaci n internacional de f tbol asociaci n  german  internationaler verband des association football  is a non profit organization which describes itself as an international governing body of association football, f tsal, beach soccer, and efootball. it is the highest governing body of football. fifa was founded in 1904 to oversee international competition among the national associations of belgium, denmark, france, germany, the netherlands, spain, sweden, and switzerland. headquartered in z rich, its membership now comprises 211 national associations. member countries must each also be members of one of the six regional confederations into which the world is divided  africa, asia, europe, north   central america and the caribbean, oceania, and south america. today, fifa outlines a number of objectives in the organizational statues, including growing football internationally, providing efforts to ensure football is accessible to everyone, and advocating for integrity and fair play. fifa is responsible for the organization and promotion of football s major international tournaments, notably the world cup which commenced in 1930 and the women s world cup which commenced in 1991. although fifa does not solely set the rules of football, that being the responsibility of the international football association board of which fifa is a member, it applies and enforces the rules across all fifa competitions. all fifa tournaments generate revenue from sponsorship  in 2018, fifa had revenues of over us  4.6 billion, ending the 2015 2018 cycle with a net positive of us 1
query	104	ford motor company, commonly known as ford, is an american multinational automaker that has its main headquarters in dearborn, michigan, a suburb of detroit. it was founded by henry ford and incorporated on june 16, 1903. the company sells automobiles and commercial vehicles under the ford brand, and most luxury cars under the lincoln brand. ford also owns brazilian suv manufacturer troller, an 8  stake in aston martin of the united kingdom and a 32  stake in jiangling motors. it also has joint ventures in china  changan ford , taiwan  ford lio ho , thailand  autoalliance thailand , turkey  ford otosan , and russia  ford sollers . the company is listed on the new york stock exchange and is controlled by the ford family  they have minority ownership but the majority of the voting power.ford introduced methods for large scale manufacturing of cars and large scale management of an industrial workforce using elaborately engineered manufacturing sequences typified by moving assembly lines  by 1914, these methods were known around the world as fordism. ford s former uk subsidiaries jaguar and land rover, acquired in 1989 and 2000 respectively, were sold to tata motors of india in march 2008. ford owned the swedish automaker volvo from 1999 to 2010. in 2011, ford discontinued the mercury brand, under which it had marketed entry level luxury cars in the united states, canada, mexico, and the middle east since 1938
query	105	the international business machines corporation  ibm  is an american multinational information technology company headquartered in armonk, new york, with operations in over 170 countries. the company began in 1911, founded in endicott, new york, as the computing tabulating recording company  ctr  and was renamed  international business machines  in 1924. ibm is incorporated in new york.ibm produces and sells computer hardware, middleware and software, and provides hosting and consulting services in areas ranging from mainframe computers to nanotechnology. ibm is also a major research organization, holding the record for most u.s. patents generated by a business  as of 2020  for 27 consecutive years. inventions by ibm include the automated teller machine  atm , the floppy disk, the hard disk drive, the magnetic stripe card, the relational database, the sql programming language, the upc barcode, and dynamic random access memory  dram . the ibm mainframe, exemplified by the system 360, was the dominant computing platform during the 1960s and 1970s. ibm has continually shifted business operations by focusing on higher value, more profitable markets
query	106	isuzu is a japanese commercial vehicle and diesel engine manufacturing company headquartered in tokyo.  its principal activity is the production, marketing and sale of isuzu commercial vehicles and diesel engines. it also has a number of subsidiaries, including anadolu isuzu  a turkish joint venture with anadolu group , sollers isuzu  a russian joint venture with sollers jsc , sml isuzu  an indian venture formerly known as swaraj mazda , jiangxi isuzu motors  a chinese joint venture with jiangling motors company group , isuzu astra motor indonesia, isuzu malaysia  isuzu hicom , isuzu uk, isuzu south africa, isuzu philippines, taiwan isuzu motors, isuzu vietnam, isuzu motors india and byd isuzu. isuzu has assembly and manufacturing plants in fujisawa, as well as in the tochigi and hokkaid  prefectures. isuzu branded vehicles are sold in most commercial markets worldwide. isuzu s primary market focus is on commercial diesel powered truck, buses and construction, while their japanese competitor yanmar focuses on commercial level powerplants and generators. by 2009, isuzu had produced over 21 million diesel engines, which can be found in vehicles all over the world. isuzu diesel engines are used by dozens of vehicle manufacturers, including general motors.the name isuzu translates into english as  fifty bells .
query	107	the liberal party of canada  french  parti lib ral du canada  is the oldest and longest serving political party in canada. the party has dominated federal politics for much of canada s history,  holding power for almost 70 years in the 20th century more than any other party in a developed country and as a result, it is sometimes referred to as canada s  natural governing party .the party espouses the principles of liberalism, and generally sits at the centre to centre left of the canadian political spectrum, with the conservative party positioned to the centre right and the new democratic party  who at times aligned itself with the liberals during minority governments , occupying the centre left to left.  like their federal conservative party rivals, the party is often described as a  big tent , attracting support from a broad spectrum of voters. in the late 1970s, prime minister pierre elliott trudeau claimed that his liberal party adhered to the  radical centre .the liberals  signature policies and legislative decisions include universal health care, the canada pension plan, canada student loans, peacekeeping, multilateralism, official bilingualism, official multiculturalism, patriating the canadian constitution and the entrenchment of canada s charter of rights and freedoms, the clarity act, legalizing same sex marriage, euthanasia, and cannabis, national carbon pricing, and reproductive choice.in the 2015 federal election, the liberal party under justin trudeau had its best result since the 2000 election, winning 39.5 percent of the popular vote and 184 seats, gaining a majority of seats in the house of commons. however, in the 2019 federal election, they lost their majority, winning 157 seats, but they still remained the largest party in the house.
query	108	little league baseball and softball  officially, little league baseball inc  is a 501 c  3  nonprofit organization based in south williamsport, pennsylvania, united states, that organizes local youth baseball and softball leagues throughout the united states and the rest of the world. founded by carl stotz, george bebble, and bert bebble in 1939 as a three team league in williamsport, pennsylvania, and formally incorporated on october 10, 1950, little league baseball encourages local volunteers to organize and operate little league programs that are annually chartered through little league international. each league can structure itself to best serve the children in the area in which the league operates. several specific divisions of little league baseball and softball are available to children ages 4 to 16. the organization holds a congressional charter under title 36 of the united states code.the organization s administrative office is located in south williamsport, pennsylvania. the first little league baseball world series was played in williamsport in 1947. the little league international complex hosts the annual little league baseball world series at howard j. lamade stadium and little league volunteer stadium, and is also the site of the peter j. mcgovern little league museum, which provides a history of little league baseball and softball through interactive exhibits for children
query	109	the los angeles lakers are an american professional basketball team based in los angeles. the lakers compete in the national basketball association  nba , as a member of the league s western conference in the pacific division. the lakers play their home games at staples center, an arena shared with the nba s los angeles clippers, the los angeles sparks of the women s national basketball association, and the los angeles kings of the national hockey league. the lakers are one of the most successful teams in the history of the nba, and have won 16 nba championships, the second most behind the boston celtics. the franchise began with the 1947 purchase of a disbanded team, the detroit gems of the national basketball league  nbl . the new team began playing in minneapolis, calling themselves the minneapolis lakers. initially a member of the nbl, the lakers won the 1948 nbl championship before joining the rival basketball association of america, where they would win five of the next six championships, led by star george mikan. after struggling financially in the late 1950s following mikan s retirement, they relocated to los angeles before the 1960 61 season. led by hall of famers elgin baylor and jerry west, los angeles made the nba finals six times in the 1960s, but lost each series to the celtics, beginning their long and storied rivalry. in 1968, the lakers acquired four time nba most valuable player  mvp  wilt chamberlain, and won their sixth nba title and first in los angeles in 1972, led by new head coach bill sharman
query	110	major league baseball  mlb  is a professional baseball organization and the oldest of the major professional sports leagues in the united states and canada. a total of 30 teams play in the national league  nl  and american league  al , with 15 teams in each league. the nl and al were formed as separate legal entities in 1876 and 1901, respectively. after cooperating but remaining legally separate entities beginning in 1903, the leagues merged into a single organization led by the commissioner of baseball in 2000. the organization also oversees minor league baseball, which comprises 256 teams affiliated with the major league clubs. with the world baseball softball confederation, mlb manages the international world baseball classic tournament. baseball s first openly all professional team was the cincinnati red stockings who were founded in 1869.  previously, some teams had paid some players under the table.  the first few decades of professional baseball were characterized by rivalries between leagues and by players who often jumped from one team or league to another. the period before 1920 in baseball is known as the dead ball era, during which players would rarely hit home runs
query	111	maroon 5 is an american pop rock band from los angeles, california. it currently consists of lead vocalist adam levine, keyboardist and rhythm guitarist jesse carmichael, bassist mickey madden, lead guitarist james valentine, drummer matt flynn, keyboardist pj morton, and multi instrumentalist sam farrar. original members levine, carmichael, madden, and drummer ryan dusick first came together as kara s flowers in 1994, while they were still in high school. after self releasing their independent album we like digging , the band signed to reprise records and released the album the fourth world in 1997. the album garnered a tepid response, after which the record label dropped the band and the members focused on college. in 2001, the band re emerged as maroon 5, pursuing a different direction and adding guitarist valentine. the band signed with octone records, an independent record label with a separate joint venture relationship with j records and released their debut album songs about jane in june 2002. aided by its lead single,  harder to breathe , which received heavy airplay, the album peaked at number six on the billboard 200 chart, and went platinum in 2004. the band won the grammy award for best new artist in 2005. in 2006, dusick left the band after suffering from serious wrist and shoulder injuries and was replaced by matt flynn
query	112	maybelline llc, branded as maybelline new york, is a major american makeup brand sold worldwide and a subsidiary of french cosmetics company l or al.
query	113	the miami heat are an american professional basketball team based in miami. the heat compete in the national basketball association  nba  as a member of the league s eastern conference southeast division. the heat play their home games at american airlines arena, and have won three nba championships. the franchise began play in the 1988 89 nba season as an expansion team. after a period of mediocrity, the heat would gain relevance during the 1990s following the appointment of former head coach pat riley in the role of team president. riley would construct the high profile trades of alonzo mourning in 1995, and of tim hardaway in 1996, which immediately propelled the team into playoff contention. mourning and hardaway would eventually lead the heat to four division titles, prior to their departures in 2001 and 2002, respectively. as a result, the team struggled, and entered into a rebuild in time for the 2002 03 season. led by dwyane wade, and following a trade for former nba most valuable player  mvp  shaquille o neal, miami advanced to play in the nba finals in 2006, where they clinched their first championship, led by riley as head coach. after the departure of o neal two years later, the team entered into another period of decline for the remainder of the 2000s
query	114	motorola, inc.    was an american multinational telecommunications company founded on september 25, 1928, based in schaumburg, illinois. after having lost  4.3 billion from 2007 to 2009, the company was divided into two independent public companies, motorola mobility and motorola solutions on january 4, 2011. motorola solutions is generally considered to be the direct successor to motorola, as the reorganization was structured with motorola mobility being spun off. motorola mobility was sold to google in 2012, and acquired by lenovo in 2014.motorola designed and sold wireless network equipment such as cellular transmission base stations and signal amplifiers. motorola s home and broadcast network products included set top boxes, digital video recorders, and network equipment used to enable video broadcasting, computer telephony, and high definition television. its business and government customers consisted mainly of wireless voice and broadband systems  used to build private networks , and public safety communications systems like astro and dimetra. these businesses  except for set top boxes, wireless networks, and cable modems  are now part of motorola solutions
query	115	nvidia corporation   en vid ee   , more commonly referred to as nvidia  stylized as nvidia, on logo styling nvidia with small  n  same size as  vidia   formerly stylized as nvidia on products from the mid 90s to early mid 2000s , is an american technology company incorporated in delaware and based in santa clara, california. it designs graphics processing units  gpus  for the gaming and professional markets, as well as system on a chip units  socs  for the mobile computing and automotive market. its primary gpu product line, labeled  geforce , is in direct competition with advanced micro devices   amd   radeon  products. nvidia expanded its presence in the gaming industry with its handheld shield portable, shield tablet, and shield android tv. since 2014, nvidia has diversified its business focusing on four markets  gaming, professional visualization, data centers, and auto. nvidia is also now focused on artificial intelligence.in addition to gpu manufacturing, nvidia provides parallel processing capabilities to researchers and scientists that allow them to efficiently run high performance applications. they are deployed in supercomputing sites around the world. more recently, it has moved into the mobile computing market, where it produces tegra mobile processors for smartphones and tablets as well as vehicle navigation and entertainment systems. in addition to amd, its competitors include intel, qualcomm, and arm  e
query	116	people for the ethical treatment of animals  peta   is an american animal rights organization based in norfolk, virginia, and led by ingrid newkirk, its international president. a nonprofit corporation with nearly 400 employees, it claims that it has 6.5 million members and supporters, in addition to claiming that it is the  largest animal rights group in the world.  its slogan is  animals are not ours to eat, wear, experiment on, use for entertainment, or abuse in any other way. founded in march 1980 by ingrid newkirk and fellow animal rights activist alex pacheco, the organization first caught the public s attention in the summer of 1981 during what became known as the silver spring monkeys case, a widely publicized dispute about experiments conducted on 17 macaque monkeys inside the institute of behavioral research in silver spring, maryland. the case lasted 10 years, involved the only police raid on an animal laboratory in the united states, triggered an amendment in 1985 to that country s animal welfare act, and established peta as an internationally known organization. today, it focuses on four core issues opposition to factory farming, fur farming, animal testing, and the use of animals in entertainment. it also campaigns for a vegan lifestyle and against eating meat, fishing, the killing of animals regarded as pests, the keeping of chained backyard dogs, cock fighting, dog fighting, beekeeping, and bullfighting.the group is the focus of controversy, both inside and outside the animal rights movement and around the world. newkirk, and formerly pacheco, are seen as the leading exporters of animal rights to the more traditional animal protection groups in the united states, but sections of the movement nonetheless say that peta is not radical enough law professor gary francione lists the group among what he calls  the new welfarists,  arguing that its work with industries to achieve reform, which continues in the tradition of henry spira, makes it an animal welfare group, not an animal rights group
query	117	the pga tour  stylized in all capital letters as pga tour by its officials  is the organizer of the main professional golf tours played primarily by men in the united states and north america. it organizes most of the events on the flagship annual series of tournaments also known as the pga tour, as well as pga tour champions  for golfers age 50 and older  and the korn ferry tour  for professional players who have not yet qualified to play in the pga tour , as well as pga tour canada, pga tour latinoam rica, and pga tour china. the pga tour is a nonprofit organization headquartered in ponte vedra beach, florida, a suburb of jacksonville.originally established by the professional golfers  association of america, it was spun off in december 1968 into a separate organization for tour players, as opposed to club professionals, the focal members of today s pga of america. originally the  tournament players division , it adopted the name  pga tour  in 1975 and runs most of the week to week professional golf events on the tournament known as the pga tour, including the players championship, hosted at tpc sawgrass  the fedex cup, with its finale at the tour championship at east lake golf club  and the biennial presidents cup. the remaining events on the pga tour are run by different organizations, as are the u.s. based lpga tour for women and other men s and women s professional tours around the world.
query	118	singapore airlines is the flag carrier airline of singapore with its hub at singapore changi airport. the airline is notable for using the singapore girl as its central figure in corporate branding. it has been ranked as the world s best airline by skytrax four times and topped travel   leisure s best airline rankings for more than 20 years.singapore airlines includes many airline related subsidiaries. sia engineering company handles maintenance, repair, and overhaul  mro  business across nine countries, with a portfolio of 27 joint ventures, including with boeing and rolls royce. singapore airlines cargo operates sia s freighter fleet and manages the cargo hold capacity in sia s passenger aircraft. it has two subsidiaries  silkair operates regional flights to secondary cities, while scoot operates as a low cost carrier. singapore airlines was the launch customer for the airbus a380   the world s largest passenger aircraft   as well as the boeing 787 10 and the ultra long range version of the airbus a350 900. it ranks amongst the top 15 carriers worldwide in terms of revenue passenger kilometers, and is ranked 10th in the world for international passengers carried. singapore airlines was voted as the skytrax world s best airline cabin crew 2019
query	119	tiscali s.p.a.  italian    tiskali   bit  tis  is an italian telecommunications company, based in cagliari, sardinia, that provides internet and telecommunications services to its domestic market. it previously had operations in other european nations through its acquisition of many smaller european internet service providers  isps  in the late 1990s.
query	120	visa inc.   or    also known as visa, stylized as visa  is an american multinational financial services corporation headquartered in foster city, california, united states. it facilitates electronic funds transfers throughout the world, most commonly through visa branded credit cards, debit cards and prepaid cards. visa does not issue cards, extend credit or set rates and fees for consumers  rather, visa provides financial institutions with visa branded payment products that they then use to offer credit, debit, prepaid and cash access programs to their customers. in 2015, the nilson report, a publication that tracks the credit card industry, found that visa s global network  known as visanet  processed 100 billion transactions during 2014 with a total volume of us 6.8 trillion.it was established in 1958 by bank of america  bofa  as the bankamericard credit card program. in response to competitor master charge  now mastercard , bofa began to license the bankamericard program to other financial institutions in 1966. by 1970, bofa gave up direct control of the bankamericard program, forming a consortium with the other various bankamericard issuer banks to take over its management. it was then renamed visa in 1976
