query	166	praise as a form of social interaction expresses recognition, reassurance or admiration. praise is expressed verbally as well as by body language  facial expression and gestures . verbal praise consists of a positive evaluations  of another s attributes or actions, where the evaluator presumes the validity of the standards on which the evaluation is based.as a form of social manipulation, praise becomes a form of reward and furthers behavioral reinforcement by conditioning. the influence of praise on an individual can depend on many factors, including the context, the meanings the praise may convey, and the characteristics and interpretations of the recipient.  while praise may share some predictive relationships  both positive and negative  with tangible  material  rewards, praise tends to be less salient and expected, conveys more information about competence, and is typically given more immediately after the desired behavior.praise is distinct from acknowledgement or feedback  more neutral forms of recognition  and from encouragement  expressedly future oriented .praise is given across social hierarchy, and both within the ingroup and towards an outgroup  it is an important aspect in the regulation of social hierarchy and the maintenance of group cohesion, influencing the potential for political action and social upheaval. when given by a dominant individual it takes the form of recognition and reassurance, reducing the potential of political action aiming for  when given by a submissive to a dominant individual it takes the form of deference, admiration or exultation, or deification. praise of gods may form part of religious rites and practices  see for example prayer of praise and praise and worship 
query	167	punta cana is a resort town within the punta cana b varo veron macao municipal district, in the municipality of hig ey, in la altagracia province, the easternmost province of the dominican republic. the area has beaches and balnearios which face both the caribbean sea and the atlantic ocean, and it is a tourist destination. the weather is hot and humid, especially in late summer and autumn when the northern tropics receive their most direct sunlight.
query	168	the rocky mountains, also known as the rockies, are a major mountain range located in western north america. the rocky mountains stretch 3,000 km  1,900 mi  in straight line distance from the northernmost part of british columbia, in western canada, to new mexico in the southwestern united states. the northern terminus is near the liard river, while the southernmost point is near albuquerque, adjacent the sandia manzano mountains. located within the north american cordillera, the rockies are distinct from the pacific coast ranges, cascade range, and the sierra nevada, which all lie farther to the west. the rocky mountains formed 80 million to 55 million years ago during the laramide orogeny, in which a number of plates began sliding underneath the north american plate. the angle of subduction was shallow, resulting in a broad belt of mountains running down western north america. since then, further tectonic activity and erosion by glaciers have sculpted the rockies into dramatic peaks and valleys. at the end of the last ice age, humans began inhabiting the mountain range. after europeans, such as sir alexander mackenzie, and americans, such as the lewis and clark expedition, began exploring the range, minerals and furs drove the initial economic exploitation of the mountains, although the range itself never experienced a dense population. of the 100 highest peaks in the rocky mountains, 78  including the 30 highest  are located in colorado, ten in wyoming, six in new mexico, and three in montana
query	169	san francisco international airport  iata  sfo, icao  ksfo, faa lid  sfo  is an international airport near san bruno and millbrae in unincorporated san mateo county. it is 13 miles  21 km  south of downtown san francisco, california, it has flights to points throughout north america and is a major gateway to europe and asia. sfo is the largest airport in the bay area and the second busiest in california, after lax. in 2017, it was the seventh busiest airport in the united states and the 24th busiest in the world by passenger count. it is the fifth largest hub for united airlines and functions as united s primary transpacific gateway. it also serves as a secondary hub for alaska airlines. it is a major maintenance hub for united airlines, and houses the louis a. turpen aviation museum and library. the airport is owned and operated by the city and county of san francisco, despite it being located in san mateo county. between 1999 and 2004, the san francisco airport commission operated city owned sfo enterprises, inc
query	170	saudi arabia, officially the kingdom of saudi arabia, is a country in western asia constituting the bulk of the arabian peninsula. with a land area of approximately 2,150,000 km2  830,000 sq mi , saudi arabia is geographically the largest sovereign state in western asia, the second largest in the arab world  after algeria , the fifth largest in asia, and the 12th largest in the world. saudi arabia is bordered by jordan and iraq to the north, kuwait to the northeast, qatar, bahrain, and the united arab emirates to the east, oman to the southeast and yemen to the south  it is separated from israel and egypt by the gulf of aqaba. it is the only nation with both a red sea coast and a persian gulf coast, and most of its terrain consists of arid desert, lowland and mountains. as of october 2018, the saudi economy was the largest in the middle east and the 18th largest in the world.  saudi arabia also has one of the world s youngest populations  50 percent of its 33.4 million people are under 25 years old.the territory that now constitutes saudi arabia was the site of several ancient cultures and civilizations. the prehistory of saudi arabia shows some of the earliest traces of human activity in the world. the world s second largest religion, islam, emerged in modern day saudi arabia
query	171	south india is the area encompassing the indian states of andhra pradesh, karnataka, kerala, tamil nadu and telangana as well as the union territories of andaman and nicobar, lakshadweep and puducherry, occupying 19.31  of india s area  635,780 km2 or 245,480 sq mi . covering the southern part of the peninsular deccan plateau, south india is bounded by the bay of bengal in the east, the arabian sea in the west and the indian ocean in the south. the geography of the region is diverse with two mountain ranges   the western and eastern ghats, bordering the plateau heartland. godavari, krishna, kaveri, tungabhadra and vaigai rivers are important non perennial sources of water.  bangalore, chennai, hyderabad, coimbatore, kochi, visakhapatnam,  thiruvananthapuram , mysore, vijayawada, madurai, mangalore, tiruchirappalli are some of the major cities. majority of the people in south india speak one of the four major dravidian languages  telugu, tamil, kannada and malayalam. during its history, a number of dynastic kingdoms ruled over parts of south india whose invasions across southern and southeastern asia impacted the history and culture in those regions. major dynasties that were established in south india include the cheras, cholas, pandyas, pallavas, satavahanas, chalukyas, rashtrakutas and vijayanagara. european countries entered india through kerala and the region was colonised by britain and other western european countries
query	172	sudan    arabic           as s d n , officially the republic of the sudan   arabic                   jumh riyyat as s d n , is a country in northeastern africa. it is bordered by egypt to the north, libya to the northwest, chad to the west, the central african republic to the southwest, south sudan to the south, ethiopia to the southeast, eritrea to the east, and the red sea to the northeast. sudan has a population of 43 million  2018 estimate  and occupies 1,886,068 square kilometres  728,215 square miles , making it africa s third largest country and also the third largest in the arab world. before south sudan s secession from sudan on 9 july 2011, the united sudan was the largest country in africa and the arab world by area. sudan s predominant religion is islam, and its official languages are arabic and english. the capital is khartoum, located at the confluence of the blue and white nile. since 2011, sudan has been the scene of an ongoing military conflict in its southern states. sudan s history goes back to the pharaonic period, witnessing the kingdom of kerma  c. 2500 bc 1500 bc , the subsequent rule of the egyptian new kingdom  c. 1500 bc 1070 bc  and the rise of the kingdom of kush  c
query	173	tehran or teheran is the capital of iran and tehran province. with a population of around 8.7 million in the city and 15 million in the larger metropolitan area of greater tehran, tehran is the most populous city in iran and western asia, and has the second largest metropolitan area in the middle east  after cairo . it is ranked 24th in the world by the population of its metropolitan area.in the classical era, part of the territory of present day tehran was occupied by rhages, a prominent median city. it was subject to destruction through the medieval arab, turkic, and mongol invasions. its modern day inheritor remains as an urban area absorbed into the metropolitan area of greater tehran. tehran was first chosen as the capital of iran by agha mohammad khan of the qajar dynasty in 1786, in order to remain within close reach of iran s territories in the caucasus, before being separated from iran as a result of the russo iranian wars, and to avoid the vying factions of the previously ruling iranian dynasties. the capital has been moved several times throughout history, and tehran is the 32nd national capital of iran. large scale demolition and rebuilding began in the 1920s, and tehran has been a destination for mass migrations from all over iran since the 20th century
query	174	times square is a major commercial intersection, tourist destination, entertainment center, and neighborhood in the midtown manhattan section of new york city, at the junction of broadway and seventh avenue. brightly lit by numerous billboards and advertisements, it stretches from west 42nd to west 47th streets, and is sometimes referred to as  the crossroads of the world ,  the center of the universe ,  the heart of the great white way , and  the heart of the world . one of the world s busiest pedestrian areas, it is also the hub of the broadway theater district and a major center of the world s entertainment industry. times square is one of the world s most visited tourist attractions, drawing an estimated 50 million visitors annually. approximately 330,000 people pass through times square daily, many of them tourists, while over 460,000 pedestrians walk through times square on its busiest days.formerly known as longacre square, times square was renamed in 1904 after the new york times moved its headquarters to the then newly erected times building, now one times square. it is the site of the annual new year s eve ball drop, which began on december 31, 1907 and continues to attract over a million visitors to times square every year.times square functions as a town square, but is not geometrically a square  it is closer in shape to a bowtie, with two triangles emanating roughly north and south from 45th street, where seventh avenue intersects broadway. broadway runs diagonally, crossing through the horizontal and vertical street grid of manhattan laid down by the commissioners  plan of 1811, and that intersection creates the  bowtie  shape of times square.the southern triangle of times square has no specific name, but the northern triangle is called father duffy square
query	175	the republic of trinidad and tobago is the southernmost island country in the caribbean. consisting of the main islands trinidad and tobago, and numerous much smaller islands, it is situated 130 kilometres  81 miles  south of grenada and 11 kilometres  6.8 miles  off the coast of northeastern venezuela. it shares maritime boundaries with barbados to the northeast, grenada to the northwest, guyana to the southeast, and venezuela to the south and west.the island of trinidad was inhabited for centuries by native amerindian peoples before becoming a colony in the spanish empire, following the arrival of christopher columbus in 1498. spanish governor don jos  mar a chac n surrendered the island to a british fleet under the command of sir ralph abercromby in 1797. during the same period, the island of tobago changed hands among spanish, british, french, dutch and courlander colonisers more times than any other island in the caribbean. trinidad and tobago were ceded to britain in 1802 under the treaty of amiens as separate states and unified in 1889. trinidad and tobago obtained independence in 1962, becoming a republic in 1976.trinidad and tobago has the third highest gdp per capita based on purchasing power parity  ppp  in the americas after the united states and canada
query	176	the west indies is a region of the north atlantic ocean and the caribbean that includes the island countries and surrounding waters of three major archipelagos  the greater antilles, the lesser antilles, and the lucayan archipelago.the region includes all the islands in or bordering the caribbean sea, plus the bahamas and the turks and caicos islands, which are in the atlantic ocean.  this term also includes modern day belize, guyana, suriname, and french guiana.
query	177	lager is a type of beer conditioned at low temperatures. lagers can be pale, amber, or dark. pale lager is the most widely consumed and commercially available style of beer. well known brands include pilsner urquell, molson canadian, miller, stella artois, beck s, brahma, budweiser budvar, corona, snow, tsingtao, singha, kirin, quilmes, heineken, kingfisher, carlsberg, birra moretti and tennents. as well as maturation in cold storage, most lagers are also distinguished by the use of saccharomyces pastorianus yeast, a  bottom fermenting  yeast that also ferments at relatively cold temperatures. it is possible to use lager yeast in a warm fermentation process, such as with american steam beer  while german altbier and k lsch are brewed with saccharomyces cerevisiae top fermenting yeast at a warm temperature, but with a cold storage finishing stage, and classified as oberg riges lagerbier  top fermented lager beer .until the 19th century, the german word lagerbier  de  referred to all types of bottom fermented, cool conditioned beer in normal strengths. in germany today, it mainly refers to beers in southern germany,  helles   pale  and  dunkel   dark . pilsner, a more heavily hopped pale lager, is most often known as  pilsner ,  pilsener , or  pils . other lagers are bock, m rzen, and schwarzbier
query	178	a pretzel is a type of baked pastry made from dough that is commonly shaped into a knot. the traditional pretzel shape is a distinctive symmetrical form, with the ends of a long strip of dough intertwined and then twisted back onto itself in a particular way  a pretzel loop . in modern times, pretzels come in a wide range of shapes. salt is the most common seasoning for pretzels, complementing the washing soda or lye treatment that gives pretzels their traditional skin and flavor acquired through the maillard reaction. other seasonings are cheeses, sugar, chocolate, cinnamon, sweet glazing, seeds, and nuts. varieties of pretzels include soft pretzels, which should be eaten shortly after preparation, and hard baked pretzels, which have a long shelf life.
query	179	the beetroot is the taproot portion of a beet plant, usually known in north america as the beet, and also known as the table beet, garden beet, sugar beet, red beet, dinner beet or golden beet. it is one of several cultivated varieties of beta vulgaris grown for their edible taproots and leaves  called beet greens   they have been classified as b. vulgaris subsp. vulgaris  conditiva  group.besides being used as a food, beets have uses as a food colouring and as a medicinal plant. many beet products are made from other beta vulgaris varieties, particularly sugar beet.
query	180	boric acid, also called hydrogen borate, boracic acid, and orthoboric acid is a weak, monobasic lewis acid of boron. however, some of its behaviour towards some chemical reactions suggest it to be tribasic acid in bronsted sense as well. boric acid is often used as an antiseptic, insecticide, flame retardant, neutron absorber, or precursor to other chemical compounds. it has the chemical formula h3bo3  sometimes written b oh 3 , and exists in the form of colorless crystals or a white powder that dissolves in water. when occurring as a mineral, it is called sassolite.
query	181	buttermilk is a fermented dairy drink. traditionally, it was the liquid left behind after churning butter out of cultured cream  most modern buttermilk is cultured, however. it is common in warm climates  including the balkans, south asia, the middle east and the southern united states  where unrefrigerated fresh milk sours quickly.buttermilk can be drunk straight, and it can also be used in cooking. in making soda bread, the acid in buttermilk reacts with the raising agent, sodium bicarbonate, to produce carbon dioxide which acts as the leavening agent. buttermilk is also used in marination, especially of chicken and pork, which the lactic acid helps to tenderize, retain moisture and allows added flavors to permeate the meat.
query	182	chess is a two player strategy board game played on a checkered board with 64 squares arranged in an 8 8 grid. the game is played by millions of people worldwide. chess is believed to be derived from the indian game chaturanga sometime before the 7th century. chaturanga is also the likely ancestor of the eastern strategy games xiangqi  chinese chess , janggi  korean chess , and shogi  japanese chess . chess reached europe by the 9th century, due to the umayyad conquest of hispania. the pieces assumed their current powers in spain in the late 15th century  the modern rules were standardized in the 19th century. play involves no hidden information. each player begins with 16 pieces  one king, one queen, two rooks, two knights, two bishops, and eight pawns. each piece type moves differently, with the most powerful being the queen and the least powerful the pawn. the objective is to checkmate the opponent s king by placing it under an inescapable threat of capture
query	183	the chrysler dodge plymouth neon is a front engine, front wheel drive compact car introduced in january 1994 for model year 1995 by chrysler s dodge and plymouth divisions in two  and four door bodystyles over two generations. marketed in europe, mexico, canada, japan, egypt, australia and south america as a chrysler, the neon was offered in multiple versions and configurations over its production life, which ended with model year 2005. the neon nameplate was subsequently resurrected in 2016 for the dodge neon, a rebadged variant of fiat tipo sedan for the mexican market.
query	184	clenbuterol is a sympathomimetic amine used by sufferers of breathing disorders as a decongestant and bronchodilator. people with chronic breathing disorders such as asthma use this as a bronchodilator to make breathing easier. it is most commonly available as the hydrochloride salt, clenbuterol hydrochloride.it was patented in 1967 and came into medical use in 1977.
query	185	copper is a chemical element with the symbol cu  from latin  cuprum  and atomic number 29. it is a soft, malleable, and ductile metal with very high thermal and electrical conductivity. a freshly exposed surface of pure copper has a pinkish orange color. copper is used as a conductor of heat and electricity, as a building material, and as a constituent of various metal alloys, such as sterling silver used in jewelry, cupronickel used to make marine hardware and coins, and constantan used in strain gauges and thermocouples for temperature measurement. copper is one of the few metals that can occur in nature in a directly usable metallic form  native metals . this led to very early human use in several regions, from c. 8000 bc. thousands of years later, it was the first metal to be smelted from sulfide ores, c. 5000 bc, the first metal to be cast into a shape in a mold, c. 4000 bc and the first metal to be purposefully alloyed with another metal, tin, to create bronze, c
query	186	dairy products or milk products are a type of food produced from or containing the milk of mammals. they are primarily produced from mammals such as cattle, water buffaloes, goats, sheep, camels and humans. dairy products include food items such as yogurt, cheese and butter. a facility that produces dairy products is known as a dairy, or dairy factory. dairy products are consumed worldwide, with the exception of most of east and southeast asia and parts of central africa.
query	187	diet coke or coca cola light is a sugar free and no calorie soft drink produced and distributed by the coca cola company.it contains artificial sweeteners instead of sugar. unveiled on july 8, 1982, and introduced in the united states on august 9, it was the first new brand since 1886 to use the coca cola trademark. the product quickly overtook the company s existing diet cola, tab, in sales.
query	188	diet  alternatively marketed as sugar free, zero calorie or low calorie  drinks or light drinks are sugar free, artificially sweetened versions of carbonated beverages with virtually no calories. they are generally marketed toward health conscious people, diabetics, athletes, and other people who want to lose weight, improve physical fitness, or reduce their sugar intake.
query	189	an ethernet hub, active hub, network hub, repeater hub, multiport repeater, or simply hub is a network hardware device for connecting multiple ethernet devices together and  making them act as a single network segment. it has multiple input output  i o  ports, in which a signal introduced at the input of any port appears at the output of every port except the original incoming. a hub works at the physical layer  layer 1  of the osi model. a repeater hub also participates in collision detection, forwarding a jam signal to all ports if it detects a collision. in addition to standard 8p8c   rj45   ports, some hubs may also come with a bnc or an attachment unit interface  aui  connector to allow connection to legacy 10base2 or 10base5 network segments. hubs are now largely obsolete, having been replaced by network switches except in very old installations or specialized applications. as of 2011, connecting network segments by repeaters or hubs is deprecated by ieee 802.3.
query	190	the ford aerostar is a range of passenger and cargo vans that was manufactured and marketed by ford in the united states and canada  a limited number were exported outside of north america.  the first minivan sold by ford, the aerostar was sold in a single generation from the 1986 to 1997 model years.  introduced shortly before the ford taurus, the vehicle derived its nameplate from its slope nosed  one box  exterior  although over six feet tall, the body of the aerostar retained a drag coefficient of cd 0.37, besting the lincoln mark vii . for the 1995 model year, the front wheel drive ford windstar was introduced to replace the aerostar  both minivans were sold concurrently through the 1997 model year.  in the ford model line, the role of the aerostar cargo van was left unfilled  the closest successor is the ford transit connect, introduced in 2010. a total of 2,029,577 aerostars were produced from 1985 to 1997. all production was sourced from the now closed st. louis assembly plant in hazelwood, missouri.
query	191	the french horn  since the 1930s known simply as the  horn  in some professional music circles  is a brass instrument made of tubing wrapped into a coil with a flared bell. the double horn in f b   technically a variety of german horn  is the horn most often used by players in professional orchestras and bands. a musician who plays a french horn is known as a horn player or hornist. pitch is controlled through the combination of the following factors  speed of air through the instrument  controlled by the player s lungs and thoracic diaphragm   diameter and tension of lip aperture  by the player s lip muscles the embouchure  in the mouthpiece  plus, in a modern french horn, the operation of valves by the left hand, which route the air into extra sections of tubing. most horns have lever operated rotary valves, but some, especially older horns, use piston valves  similar to a trumpet s  and the vienna horn uses double piston valves, or pumpenvalves. the backward facing orientation of the bell relates to the perceived desirability to create a subdued sound in concert situations, in contrast to the more piercing quality of the trumpet.  a horn without valves is known as a natural horn, changing pitch along the natural harmonics of the instrument  similar to a bugle . pitch may also be controlled by the position of the hand in the bell, in effect reducing the bell s diameter. the pitch of any note can easily be raised or lowered by adjusting the hand position in the bell. the key of a natural horn can be changed by adding different crooks of different lengths
