query	1	benchmarking is the practice of comparing business processes and performance metrics to industry bests and best practices from other companies. dimensions typically measured are quality, time and cost.  benchmarking is used to measure performance using a specific indicator  cost per unit of measure, productivity per unit of measure, cycle time of x per unit of measure or defects per unit of measure  resulting in a metric of performance that is then compared to others.also referred to as  best practice benchmarking  or  process benchmarking , this process is used in management in which organizations evaluate various aspects of their processes in relation to best practice companies  processes, usually within a peer group defined for the purposes of comparison. this then allows organizations to develop plans on how to make improvements or adapt specific best practices, usually with the aim of increasing some aspect of performance. benchmarking may be a one off event, but is often treated as a continuous process in which organizations continually seek to improve their practices. in project management benchmarking can also support the selection, planning and delivery of projects.in the process of best practice benchmarking, management identifies the best firms in their industry, or in another industry where similar processes exist, and compares the results and processes of those studied  the  targets   to one s own results and processes. in this way, they learn how well the targets perform and, more importantly, the business processes that explain why these firms are successful. according to national council on measurement in education, benchmark assessments  are short assessments used by teachers at various times throughout the school year to monitor student progress in some area of the school curriculum
query	2	bodybuilding is the use of progressive resistance exercise to control and develop one s musculature for aesthetic purposes. an individual who engages in this activity is referred to as a bodybuilder. in competitive bodybuilding, bodybuilders appear in lineups and perform specified poses  and later individual posing routines  for a panel of judges who rank the competitors based on criteria such as symmetry, muscularity, size, conditioning, posing, and stage presentation. bodybuilders prepare for competitions through the elimination of nonessential body fat, enhanced at the last stage by a combination of extracellular dehydration and carbohydrate loading, to achieve maximum muscular definition and vascularity, as well as tanning to accentuate the contrast of the skin under the spotlights. bodybuilders may use anabolic steroids and other performance enhancing drugs to build muscles. the winner of the annual ifbb mr. olympia contest is generally recognized as the world s top male professional bodybuilder. since 1950, the nabba universe championships have been considered the top amateur bodybuilding contests, with notable winners such as reg park, lee priest, steve reeves, and arnold schwarzenegger. winners generally go on to become professional athletes.
query	3	brainstorming is a group creativity technique by which efforts are made to find a conclusion for a specific problem by gathering a list of ideas spontaneously contributed by its members. in other words, brainstorming is a situation where a group of people meet to generate new ideas and solutions around a specific domain of interest by removing inhibitions. people are able to think more freely and they suggest as many spontaneous new ideas as possible. all the ideas are noted down without criticism and after the brainstorming session the ideas are evaluated. the term was popularized by alex faickney osborn in the 1953 book applied imagination.
query	4	chain smoking is the practice of smoking several cigarettes in succession, sometimes using the ember of a finished cigarette to light the next. the term chain smoker often also refers to a person who smokes relatively constantly, though not necessarily chaining each cigarette. the term applies primarily to cigarettes, although it can be used to describe incessant cigar and pipe smoking as well. it is a common form of addiction.  
query	5	funding is the act of providing resources to finance a need, program, or project. while this is usually in the form of money, it can also take the form of effort or time from an organization or company. generally, this word is used when a firm uses its internal reserves to satisfy its necessity for cash, while the term financing is used when the firm acquires capital from external sources.sources of funding include credit, venture capital, donations, grants, savings, subsidies, and taxes. fundings such as donations, subsidies, and grants that have no direct requirement for return of investment are described as  soft funding  or  crowdfunding .   funding that facilitates the exchange of equity ownership in a company for capital investment via an online funding portal as per the jumpstart our business startups act  alternately, the  jobs act of 2012    u.s.  is known as equity crowdfunding. funds can be allocated for either short term or long term purposes.
query	6	hair coloring, or hair dyeing, is the practice of changing the hair color. the main reasons for this are cosmetic  to cover gray or white hair, to change to a color regarded as more fashionable or desirable, or to restore the original hair color after it has been discolored by hairdressing processes or sun bleaching. hair coloring can be done professionally by a hairdresser or independently at home. today, hair coloring is very popular, with 75  of women and 18  of men living in copenhagen having reported using hair dye  according to a study by the university of copenhagen . at home coloring in the united states reached  1.9 billion in 2011 and was expected to rise to  2.2 billion by 2016.  
query	7	in traffic laws, a hit and run is the act of causing  a traffic accident and not stopping afterwards. it is considered a supplemental crime in most jurisdictions.
query	8	language acquisition is the process by which humans acquire the capacity to perceive and comprehend language  in other words, gain the ability to be aware of language and to understand it , as well as to produce and use words and sentences to communicate. language acquisition involves structures, rules and representation. the capacity to successfully use language requires one to acquire a range of tools including phonology, morphology, syntax, semantics, and an extensive vocabulary. language can be vocalized as in speech, or manual as in sign. human language capacity is represented in the brain. even though human language capacity is finite, one can say and understand an infinite number of sentences, which is based on a syntactic principle called recursion. evidence suggests that every individual has three recursive mechanisms that allow sentences to go indeterminately. these three mechanisms are  relativization, complementation and coordination.there are two main guiding principles in first language acquisition  speech perception always precedes speech production, and the gradually evolving system by which a child learns a language is built up one step at a time, beginning with the distinction between individual phonemes.linguists who are interested in child language acquisition have for many years questioned how language is acquired
query	9	mediation is a dynamic, structured, interactive process where an impartial third party assists disputing parties in resolving conflict through the use of specialized communication and negotiation techniques. all participants in mediation are encouraged to actively participate in the process. mediation is a  party centered  process in that it is focused primarily upon the needs, rights, and interests of the parties. the mediator uses a wide variety of techniques to guide the process in a constructive direction and to help the parties find their optimal solution. a mediator is facilitative in that she he manages the interaction between parties and facilitates open communication. mediation is also evaluative in that the mediator analyzes issues and relevant norms   reality testing  , while refraining from providing prescriptive advice to the parties  e.g.,  you should do..
query	10	a pull up is an upper body strength exercise. the pull up is a closed chain movement where the body is suspended by the hands and pulls up. as this happens, the elbows flex and the shoulders adduct and extend to bring the elbows to the torso.  the term chin up, traditionally referring to a pull up with the chin brought over the top of a bar, was used in the 1980s to refer to a pronated, or overhand, grip, with a supinated, or underhand, grip being called a  reverse grip  chin up.  in later decades, this usage has inverted, with some using  chin up  to refer to a pull up done with a supinated hand position, while  pull up  refers specifically to the exercise done with a pronated hand position.pull ups use many different muscles of the upper body, including the latissimus dorsi and the biceps brachii.
query	11	in the context of information security, and especially network security, a spoofing attack is a situation in which a person or program successfully identifies as another by falsifying data, to gain an illegitimate advantage.
query	12	spray painting is a painting technique where a device sprays a coating  paint, ink, varnish, etc.  through the air onto a surface. the most common types employ compressed gas usually air to atomize and direct the paint particles. spray guns evolved from airbrushes, and the two are usually distinguished by their size and the size of the spray pattern they produce. airbrushes are hand held and used instead of a brush for detailed work such as photo retouching, painting nails or fine art. air gun spraying uses equipment that is generally larger. it is typically used for covering large surfaces with an even coating of liquid. spray guns can be either automated or hand held and have interchangeable heads to allow for different spray patterns. single color aerosol paint cans are portable and easy to store.
query	13	translation is the communication of the meaning of a source language text by means of an equivalent target language text. the english language draws a terminological distinction  which does not exist in every language  between translating  a written text  and interpreting  oral or signed communication between users of different languages   under this distinction, translation can begin only after the appearance of writing within a language community. a translator always risks inadvertently introducing source language words, grammar, or syntax into the target language rendering. on the other hand, such  spill overs  have sometimes imported useful source language calques and loanwords that have enriched target languages. translators, including early translators of sacred texts, have helped shape the very languages into which they have translated.because of the laboriousness of the translation process, since the 1940s efforts have been made, with varying degrees of success, to automate translation or to mechanically aid the human translator. more recently, the rise of the internet has fostered a world wide market for translation services and has facilitated  language localization .
query	14	all about my mother  spanish  todo sobre mi madre  is a 1999 spanish drama film written and directed by pedro almod var, and starring cecilia roth, marisa paredes, antonia san juan, pen lope cruz and candela pe a. the plot originates in almod var s earlier film the flower of my secret  1995  which shows student doctors being trained in how to persuade grieving relatives to allow organs to be used for transplant, focusing on the mother of a teenager killed in a road accident. all about my mother deals with complex issues such as aids, homosexuality, transsexualism, faith, and existentialism. the film was a commercial and critical success internationally, winning the oscar for best foreign language film in addition to the golden globe for best foreign language film and the bafta awards for best film not in the english language and best direction  almod var . the film also won 6 goya awards including best film, best director  almod var , best actress  roth .
query	15	back to the future is a 1985 american science fiction film directed by robert zemeckis and written by zemeckis and bob gale. it stars michael j. fox as teenager marty mcfly, who accidentally travels back in time from 1985 to 1955, where he meets his future parents and becomes his mother s romantic interest. christopher lloyd portrays the eccentric scientist dr. emmett  doc  brown, his friend and the inventor of the time traveling delorean automobile, who helps marty repair history and return to 1985. the cast also includes lea thompson as marty s mother lorraine, crispin glover as his father george, and thomas f. wilson as biff tannen, marty and george s arch nemesis. zemeckis and gale wrote the script after gale wondered whether he would have befriended his father if they had attended school together. film studios rejected it until the financial success of zemeckis  romancing the stone. zemeckis approached steven spielberg, who agreed to produce the project at amblin entertainment, with universal pictures as distributor
query	16	braveheart is a 1995 american epic war film directed and co produced by mel gibson, who portrays william wallace, a late 13th century scottish warrior. the film is fictionally based on the life of wallace leading the scots in the first war of scottish independence against king edward i of england. the film also stars sophie marceau, patrick mcgoohan and catherine mccormack. the story is inspired by blind harry s epic poem the actes and deidis of the illustre and vallyeant campioun schir william wallace and was adapted for the screen by randall wallace. development on the film initially started at metro goldwyn mayer when producer alan ladd jr. picked up the project from wallace, but when mgm was going through new management, ladd left the studio and took the project with him. despite initially declining, gibson eventually decided to direct the film, as well as star as wallace. the film was filmed in scotland and ireland from june to october 1994 with a budget around  65 70 million. braveheart, which was produced by gibson s icon productions and the ladd company, was distributed by paramount pictures in north america and by 20th century fox internationally. released on may 24, 1995, braveheart received generally positive reviews from critics, who praised the performances, directing, production values, battle sequences, and musical score, but criticized its inaccuracies regarding wallace s title, love interests, and attire
query	17	 give me five is the 25th single by the japanese girl idol group akb48. it is also akb48 s fifth sakura themed single, and their first single of 2012. this single was released in japan on february 15, 2012.give me five  is akb48 s fifth sakura themed single. however, unlike the previous ones, this single s title doesn t contain the word sakura.the music video for the song give me five  is a 34 minute japanese television drama like style video. this video was directed by shigemichi sugita, and it stars akb48 members atsuko maeda, yuko oshima, yuki kashiwagi, minami takahashi. actor takanori jinnai also stars in the music video.give me five sold approximately 967,000 copies on its debut day, thus making it akb48 s 12th single to achieve no.1 on the oricon charts
query	18	on the road is a 1957 novel by american writer jack kerouac, based on the travels of kerouac and his friends across the united states. it is considered a defining work of the postwar beat and counterculture generations, with its protagonists living life against a backdrop of jazz, poetry, and drug use.  the novel is a roman   clef, with many key figures of the beat movement, such as william s. burroughs  old bull lee , allen ginsberg  carlo marx  and neal cassady  dean moriarty  represented by characters in the book, including kerouac himself as the narrator sal paradise. the idea for on the road, kerouac s second novel, was formed during the late 1940s in a series of notebooks, and then typed out on a continuous reel of paper during three weeks in april 1951. it was first published by viking press in 1957. when the book was originally released, the new york times hailed it as  the most beautifully executed, the clearest and the most important utterance yet made by the generation kerouac himself named years ago as  beat,  and whose principal avatar he is.  in 1998, the modern library ranked on the road 55th on its list of the 100 best english language novels of the 20th century.  the novel was chosen by time magazine as one of the 100 best english language novels from 1923 to 2005.
query	19	our daughter is a 1981 cameroonian drama film directed by daniel kamwa. it was entered into the 12th moscow international film festival. the film was also selected as the cameroonian entry for the best foreign language film at the 53rd academy awards, but was not accepted as a nominee.
query	20	run fast is the debut album by the julie ruin, released on september 3, 2013. track 3,  just my kind,  was mixed by james murphy of lcd soundsystem.  
query	21	shakespeare s plays have the reputation of being among the greatest in the english language and in western literature. traditionally, the plays are divided into the genres of tragedy, history, and comedy  they have been translated into every major living language, in addition to being continually performed all around the world. many of his plays appeared in print as a series of quartos, but approximately half of them remained unpublished until 1623, when the posthumous first folio was published. the traditional division of his plays into tragedies, comedies, and histories follows the categories used in the first folio. however, modern criticism has labeled some of these plays  problem plays  that elude easy categorisation, or perhaps purposely break generic conventions, and has introduced the term romances for what scholars believe to be his later comedies. when shakespeare first arrived in london in the late 1570s or early 1580s, dramatists writing for london s new commercial playhouses  such as the curtain  were combining two strands of dramatic tradition into a new and distinctively elizabethan synthesis. previously, the most common forms of popular english theatre were the tudor morality plays. these plays, celebrating piety generally, use personified moral attributes to urge or instruct the protagonist to choose the virtuous life over evil. the characters and plot situations are largely symbolic rather than realistic. as a child, shakespeare would likely have seen this type of play  along with, perhaps, mystery plays and miracle plays 
query	22	showtime is a 2002 american buddy cop  action comedy film directed by tom dey. the film stars robert de niro and eddie murphy in the lead roles alongside rene russo, william shatner, pedro damian and de niro s real life daughter drena de niro. the film was released in the united states on march 15, 2002.
query	23	so young is a 2013 chinese drama film directed by zhao wei. it is based on the best selling novel of the same name to our youth that is fading away by xin yiwu. the film is zhao s directorial debut. the film s english language title alludes to the song so young by the british alternative rock band suede from their self titled debut album. in addition to the novel, the film was also based in part by zhao s own personal college experience in the 1990s.the film has become a major success at the chinese box office, grossing over us 118 million with a us 5 million budget.  
query	24	striptease is a 1996 american erotic black comedy film directed, co produced and written by andrew bergman, and starring demi moore, armand assante, ving rhames, robert patrick and burt reynolds. based on carl hiaasen s novel of the same name, the film centers on an fbi secretary turned stripper who becomes involved in both a child custody dispute and corrupt politics. striptease was released theatrically on june 28, 1996, by columbia pictures and was universally panned by critics, and won several golden raspberry awards, including worst picture. although it underperformed at the north american box office, the film still managed to be a moderate financial success overseas, with worldwide gross of  113 million against its  50 million budget. nevertheless, it was widely considered a failure mostly because of its under performance domestically and failing to meet expectations. moore was paid a then unprecedented  12.5 million to star in the film, making her the highest paid actress in film history. the subsequent debacle of the film as well as contempt of her performance marked a massive downturn in her career.
query	25	 take on me  is a song by norwegian synthpop band a ha, first released in 1984. the original version was produced by tony mansfield, and remixed by john ratcliff. a new version was produced by alan tarney for the group s debut studio album hunting high and low  1985 . the song combines synthpop with a varied instrumentation that includes acoustic guitars, keyboards and drums. it is considered to be the band s signature song. the original  take on me  was recorded in 1984 and it took two versions and three releases finally to chart in the united kingdom, reaching number two on the uk singles chart in october 1985. in the united states in october 1985, the song became the only a ha song to top the billboard hot 100, assisted by the wide exposure on mtv of its innovative music video, directed by steve barron. the video features the band in a live action pencil sketch sequence. the video won six awards and was nominated for two others at the 1986 mtv video music awards.
query	26	terms of endearment is a 1983 american comedy drama film adapted from larry mcmurtry s 1975 novel, directed, written, and produced by james l. brooks, and starring shirley maclaine, debra winger, jack nicholson, danny devito, jeff daniels, and john lithgow. the film covers 30 years of the relationship between aurora greenway  maclaine  and her daughter emma  winger . the film became a major critical and commercial success. it grossed  108.4 million at the domestic box office becoming the second highest grossing film of 1983 and received a leading eleven nominations at the  56th academy awards, and won four of the highest five  best picture, best director,  best actress  for maclaine  and best adapted screenplay, as well as the best supporting actor  for nicholson .
query	27	the devil wears prada is a 2006 american comedy drama film directed by david frankel and produced by wendy finerman. the screenplay, written by aline brosh mckenna, is based on lauren weisberger s 2003 novel of the same name. the film adaptation stars meryl streep as miranda priestly, a powerful fashion magazine editor, and anne hathaway as andrea  andy  sachs, a college graduate who goes to new york city and lands a job as priestly s co assistant. emily blunt and stanley tucci co star as co assistant emily charlton and art director nigel, respectively. adrian grenier, simon baker, and tracie thoms play key supporting roles. in 2003, 20th century fox bought the rights to a film adaptation of weisberger s novel before it was completed for publication. however, the project was not greenlit until streep was cast in the lead role. principal photography ran for 57 days, primarily taking place in new york from october 2005 to december later that year. additional filming also occurred in paris. after premiering at the la film fest on june 22, 2006, the film was theatrically released in the united states on june 30
query	28	the wizard of oz is a 1939 american musical fantasy film produced by metro goldwyn mayer. widely regarded to be one of the greatest films in cinema history, it is the most commercially successful adaptation of l. frank baum s 1900 children s fantasy novel the wonderful wizard of oz. directed primarily by victor fleming  who left the production to take over the troubled gone with the wind , the film stars judy garland as dorothy gale alongside ray bolger, jack haley, and bert lahr. characterized by its use of technicolor, fantasy storytelling, musical score, and memorable characters, the film has become an american pop culture icon. it was nominated for six academy awards, including best picture, but lost to gone with the wind, also directed by fleming. it did win in two other categories  best original song for  over the rainbow  and best original score by herbert stothart. while the film was considered a critical success upon release in august 1939, it failed to make a profit for mgm until the 1949 re release, earning only  3,017,000 on a  2,777,000 budget, not including promotional costs, which made it mgm s most expensive production at that time.the 1956 television broadcast premiere of the film on the cbs network reintroduced the film to the public  according to the library of congress, it is the most seen film in movie history. it was among the first 25 films that inaugurated the national film registry list in 1989
