query	46	trust 2013 american comedy drama film written directed clark gregg starring gregg amanda peet sam rockwell saxon sharbino. debuted tribeca film festival april 2013 entered limited theatrical release united states june 2014. plot howard holloway clark gregg former child star struggling agent specializes representing child actors. howard ongoing feud successful agent aldo stankas sam rockwell poached several howard clients verge success. losing client howard encounters lydia saxon sharbino highly talented thirteen year old actress takes liking him.
query	47	porco rosso japanese hepburn kurenai buta lit. crimson pig 1992 japanese animated comedy adventure film written directed hayao miyazaki. based hik tei jidai age flying boat three part watercolor manga miyazaki. film stars voices sh ichir moriyama tokiko kato akemi okamura akio tsuka. toshio suzuki produced film.
query	48	prom night 1980 canadian slasher film directed paul lynch written william gray starring jamie lee curtis leslie nielsen. plot follows group high school seniors targeted prom masked killer seeking vengeance accidental death young girl six years earlier. features supporting performances casey stevens eddie benton mary beth rubens michael tough. prom night filmed toronto late 1979 budget 1.5 million. distributed avco embassy pictures premiered united states july 1980 select cities immediate financial success.
query	49	knowing 2009 science fiction thriller film directed alex proyas starring nicolas cage. project originally attached number directors columbia pictures placed turnaround eventually picked escape artists. production financially backed summit entertainment. knowing filmed docklands studios melbourne australia using various locations represent film boston area setting. film released march 20 2009 united states.
query	50	krrish hindi pronunciation kr 2006 indian hindi language superhero film directed produced written rakesh roshan starring hrithik roshan priyanka chopra rekha naseeruddin shah. second installment krrish franchise continuation koi... mil gaya relates story krishna son previous film protagonists inherits father superhuman abilities. falling love priya follows singapore takes persona krrish keep identity secret saving children burning circus. moment regarded superhero must later thwart plans evil dr.
query	51	law order special victims unit often abbreviated law order svu svu american crime drama television series created dick wolf nbc. stars mariska hargitay captain olivia benson commanding officer special victims unit formerly lead detective located fictionalized version new york city police department. christopher meloni played lead detective elliot stabler departing series 12 seasons. law order special victims unit follows style original law order episodes often ripped headlines loosely based real crimes received media attention. show premiered september 20 1999 second series wolf successful law order franchise. premiere 21st season september 2019 series became longest running us live action series television.as january 30 2020 law order special victims unit aired 470 original episodes surpassing episode count original law order series.
query	52	third season american serial drama television series lost commenced airing united states canada october 4 2006 concluded may 23 2007. third season continues stories group 40 people stranded remote island south pacific airplane crashed 68 days prior beginning season. lost universe season takes place november 28 december 21 2004. producers stated first season introducing survivors second season hatch third season others group mysterious island inhabitants.in response fan complaints scheduling previous seasons abc decided air episodes without reruns albeit two separate blocks. united states first block consisted six episodes aired wednesdays 9 00 pm twelve week break season continued remaining 16 episodes 10 00 pm.
query	53	mary poppins 1964 american musical fantasy film directed robert stevenson produced walt disney songs written composed sherman brothers. screenplay bill walsh dagradi based p. l. travers book series mary poppins. film combines live action animation stars julie andrews feature film debut mary poppins visits dysfunctional family london employs unique brand lifestyle improve family dynamic. dick van dyke david tomlinson glynis johns featured supporting roles. film shot entirely walt disney studios burbank california using painted london background scenes.mary poppins released august 27 1964 critical acclaim.
query	54	skol vikings ipa fight song minnesota vikings national football league. introduced around time team founded 1961. words music attributed james red mcleod composer edina minnesota. old recording usually played whenever team scores accompanied cheerleaders carrying flags spell team name per lyrics. also played end game victory.
query	55	2008 summer olympics officially known games xxix olympiad chinese pinyin rsh ji ji xi j ol np k nd nghu commonly known beijing 2008 international multi sport event held 8 24 august 2008 beijing china.a total 10 942 athletes 204 national olympic committees nocs competed 28 sports 302 events one event scheduled 2004 summer olympics . first time china hosted summer olympics third time games held east asia following 1964 olympics tokyo japan seoul 1988 summer olympics. second summer olympic games staged communist country moscow 1980 summer olympics third developing country mexico city 1968 summer olympics 1980 summer olympics soviet union first overall olympics hosted communist state since former yugoslavia hosted 1984 winter olympics sarajevo. beijing awarded 2008 games four competitors 13 july 2001 majority votes members international olympic committee ioc two rounds voting. government people republic china promoted games invested heavily new facilities transport systems.
query	56	baby shower party gift giving ceremony different names different cultures. celebrates delivery expected birth child transformation woman mother. etymology term shower often assumed mean expectant mother showered gifts. related custom called bridal shower may derived name custom 19th century presents put inside parasol opened would shower bride gifts. alternatively term possibly denotes first showing new baby wider family circle friends although baby shower usually held birth baby.
query	57	basketball team sport two teams commonly five players opposing one another rectangular court compete primary objective shooting basketball approximately 9.4 inches 24 cm diameter defender hoop basket 18 inches 46 cm diameter mounted 10 feet 3.048 high backboard end court preventing opposing team shooting hoop. field goal worth two points unless made behind three point line worth three. foul timed play stops player fouled designated shoot technical foul given one one point free throws. team points end game wins regulation play expires score tied additional period play overtime mandated. players advance ball bouncing walking running dribbling passing teammate require considerable skill.
query	58	chernobyl disaster nuclear accident occurred saturday 26 april 1986 no. 4 nuclear reactor chernobyl nuclear power plant near city pripyat north ukrainian ssr. considered worst nuclear disaster history one two nuclear energy disasters rated seven maximum severity international nuclear event scale 2011 fukushima daiichi nuclear disaster japan. accident started safety test rbmk type nuclear reactor commonly used throughout soviet union. test simulation electrical power outage aid development safety procedure maintaining cooling water circulation back generators could provide power time gap moment power outage moment back generators reach full power. operating gap one minute identified potential safety problem could cause nuclear reactor core overheat.
query	59	christmas dinner meal traditionally eaten christmas. meal take place time evening christmas eve evening christmas day itself. meals often particularly rich substantial tradition christian feast day celebration form significant part gatherings held celebrate arrival christmastide. many cases ritual element meal related religious celebration praying grace. actual meal consumed varies different parts world regional cuisines local traditions.
query	60	2018 fifa world cup 21st fifa world cup international football tournament contested men national teams member associations fifa every four years. took place russia 14 june 15 july 2018. first world cup held eastern europe 11th time held europe. estimated cost 14.2 billion expensive world cup. also first world cup use video assistant referee var system.the finals involved 32 teams 31 came qualifying competitions host nation qualified automatically.
query	61	flood overflow water submerges land usually dry. sense flowing water word may also applied inflow tide. floods area study discipline hydrology significant concern agriculture civil engineering public health. flooding may occur overflow water water bodies river lake ocean water overtops breaks levees resulting water escaping usual boundaries may occur due accumulation rainwater saturated ground areal flood. size lake body water vary seasonal changes precipitation snow melt changes size unlikely considered significant unless flood property drown domestic animals.
query	62	formula one also known formula 1 f1 highest class single seater auto racing sanctioned f ration internationale de l automobile fia owned formula one group. fia formula one world championship one premier forms racing around world since inaugural season 1950. word formula name refers set rules participants cars must conform. formula one season consists series races known grands prix french grand prizes great prizes take place worldwide purpose built circuits public roads. results race evaluated using points system determine two annual world championships one drivers constructors.
query	63	graduation award diploma academic degree ceremony sometimes associated students become graduates. date graduation often called graduation day. graduation ceremony also sometimes called commencement convocation invocation. graduation ceremony usually ceremony name apply university degrees associate bachelor master doctoral degrees . graduation ceremony college university level presiding officer another authorized person formally confers degrees upon candidates either individually en masse even though graduates may physically receive diploma later smaller college departmental ceremony.
query	64	gulf war 2 august 1990 28 february 1991 codenamed operation desert shield 2 august 1990 17 january 1991 operations leading buildup troops defense saudi arabia operation desert storm 17 january 1991 28 february 1991 combat phase war waged coalition forces 35 nations led united states iraq response iraq invasion annexation kuwait arising oil pricing production disputes. war also known names persian gulf war first gulf war gulf war kuwait war first iraq war iraq war term iraq war became identified instead post 2003 iraq war. war also earned nickname video game war daily broadcast images cameras board us bombers operation desert storm.on 2 august 1990 iraqi army invaded occupied kuwait met international condemnation brought immediate economic sanctions iraq members un security council. together uk prime minister margaret thatcher american president george h. w. bush deployed us forces saudi arabia urged countries send forces scene. array nations joined coalition forming largest military alliance since world war ii. great majority coalition military forces us saudi arabia united kingdom egypt leading contributors order.
query	65	honeymoon holiday taken newlyweds immediately wedding celebrate marriage. today honeymoons often celebrated destinations considered exotic romantic. history western culture westernized countries cultures custom newlywed couple going holiday together originated early 19th century great britain. upper class couples would take bridal tour sometimes accompanied friends family visit relatives able attend wedding. practice soon spread european continent known france voyage la fa anglaise translation english style voyage 1820s onwards.
query	66	immigration international movement people destination country natives possess citizenship order settle reside especially permanent residents naturalized citizens take employment migrant worker temporarily foreign worker.as economic effects research suggests migration beneficial receiving sending countries. research exceptions finds immigration average positive economic effects native population mixed whether low skilled immigration adversely affects low skilled natives. studies show elimination barriers migration would profound effects world gdp estimates gains ranging 67 147 percent. development economists argue reducing barriers labor mobility developing countries developed countries would one efficient tools poverty reduction.the academic literature provides mixed findings relationship immigration crime worldwide finds united states immigration either impact crime rate reduces crime rate. research shows country origin matters speed depth immigrant assimilation considerable assimilation overall first second generation immigrants.research found extensive evidence discrimination foreign born minority populations criminal justice business economy housing health care media politics united states europe.
query	67	islamic terrorism islamist terrorism radical islamic terrorism terrorist acts civilians committed violent islamists claim religious motivation.the largest numbers incidents fatalities caused islamic terrorism occurred places like iraq afghanistan nigeria pakistan yemen syria. 2015 four islamic extremist groups responsible 74 deaths islamic terrorism isis boko haram taliban al qaeda according global terrorism index 2016. since approximately 2000 incidents occurred global scale affecting muslim majority states africa asia also states non muslim majority united states united kingdom france germany spain belgium russia australia canada israel china india philippines along occasional targeting citizens italy sweden denmark new zealand south korea japan. attacks targeted muslims non muslims. number worst affected muslim majority regions terrorists met armed independent resistance groups state actors proxies elsewhere condemnation coming prominent islamic figures.justifications given attacks civilians islamic extremist groups come extreme interpretations quran hadith sharia law.
query	68	live aid dual venue benefit concert held saturday 13 july 1985 well ongoing music based fundraising initiative. original event organised bob geldof midge ure raise funds relief ongoing ethiopian famine. billed global jukebox event held simultaneously wembley stadium london england united kingdom attended 72 000 people john f. kennedy stadium philadelphia pennsylvania united states attended 100 000 people .on day concerts inspired initiative happened countries soviet union canada japan yugoslavia austria australia west germany. one largest scale satellite link ups television broadcasts time estimated audience 1.9 billion across 150 nations watched live broadcast nearly 40 world population.the impact live aid famine relief debated years. one aid relief worker stated following publicity generated concert humanitarian concern centre foreign policy western governments.
query	69	exodus charter myth israelites. spread books exodus leviticus numbers deuteronomy tells story enslavement israelites ancient egypt liberation hand tutelary deity yahweh revelations biblical mount sinai wanderings wilderness borders canaan land god given them.its message israel delivered slavery yahweh therefore belongs mosaic covenant. covenant terms yahweh protect chosen people long keep laws exclusively worship him. exodus laws remain central judaism recounted daily jewish prayers celebrated festivals passover well resonating non jewish groups early american settlers fleeing persecution europe african americans striving freedom civil rights. jan assmann refers possibly grandiose influential story ever told. consensus modern scholars bible give accurate account origins israel formed entity central highlands canaan late second millennium bce indigenous canaanite culture.
query	70	world war often abbreviated wwi ww1 also known first world war great war global war originating europe lasted 28 july 1914 11 november 1918. contemporaneously described war end wars led mobilisation 70 million military personnel including 60 million europeans making one largest wars history. also one deadliest conflicts history estimated nine million combatants seven million civilian deaths direct result war resulting genocides resulting 1918 influenza pandemic caused another 50 100 million deaths worldwide.on 28 june 1914 gavrilo princip bosnian serb yugoslav nationalist assassinated austro hungarian heir archduke franz ferdinand sarajevo leading july crisis. response 23 july austria hungary issued ultimatum serbia. serbia reply failed satisfy austrians two moved war footing.
query	71	flood overflow water submerges land usually dry. sense flowing water word may also applied inflow tide. floods area study discipline hydrology significant concern agriculture civil engineering public health. flooding may occur overflow water water bodies river lake ocean water overtops breaks levees resulting water escaping usual boundaries may occur due accumulation rainwater saturated ground areal flood. size lake body water vary seasonal changes precipitation snow melt changes size unlikely considered significant unless flood property drown domestic animals.
query	72	anti gravity also known non gravitational field creating place object free force gravity. refer lack weight gravity experienced free fall orbit balancing force gravity force electromagnetism aerodynamic lift. anti gravity recurring concept science fiction particularly context spacecraft propulsion. examples gravity blocking substance cavorite h. g. wells first men moon spindizzy machines james blish cities flight. anti gravity often used refer devices look reverse gravity even though operate means lifters fly air moving air electromagnetic fields.
query	73	hypertext transfer protocol http application protocol distributed collaborative hypermedia information systems. http foundation data communication world wide web hypertext documents include hyperlinks resources user easily access example mouse click tapping screen web browser. development http initiated tim berners lee cern 1989. development early http requests comments rfcs coordinated effort internet engineering task force ietf world wide web consortium w3c work later moving ietf. http 1.1 first documented rfc 2068 1997. specification obsoleted rfc 2616 1999 likewise replaced rfc 7230 family rfcs 2014.
query	74	php general purpose programming language originally designed web development. originally created rasmus lerdorf 1994 php reference implementation produced php group. php originally stood personal home page stands recursive initialism php hypertext preprocessor.php code may executed command line interface cli embedded html code used combination various web template systems web content management systems web frameworks. php code usually processed php interpreter implemented module web server common gateway interface cgi executable. web server outputs results interpreted executed php code may type data generated html code binary image data.
query	75	scheme programming language supports multiple paradigms including functional imperative programming. one three main dialects lisp alongside common lisp clojure. unlike common lisp scheme follows minimalist design philosophy specifying small standard core powerful tools language extension. scheme created 1970s mit ai lab released developers guy l. steele gerald jay sussman via series memos known lambda papers. first dialect lisp choose lexical scope first require implementations perform tail call optimization giving stronger support functional programming associated techniques recursive algorithms.
query	76	liability insurance also called third party insurance part general insurance system risk financing protect purchaser insured risks liabilities imposed lawsuits similar claims protects insured purchaser sued claims come within coverage insurance policy. originally individual companies faced common peril formed group created self help fund pay compensation member incur loss words mutual insurance arrangement . modern system relies dedicated carriers usually profit offer protection specified perils consideration premium. liability insurance designed offer specific protection third party insurance claims i.e. payment typically made insured rather someone suffering loss party insurance contract. general damage caused intentionally well contractual liability covered liability insurance policies.
query	77	english grammar way meanings encoded wordings english language. includes structure words phrases clauses sentences right structure whole texts. historical social cultural regional variations english. divergences grammar described occur dialects. article describes generalized present day standard english form speech writing used public discourse including broadcasting education entertainment government news range registers formal informal.
query	78	free education education funded government spending charitable organizations rather tuition funding. many models free higher education proposed. primary school comprehensive compulsory education free many countries often including primary textbook well certain post secondary administrative sundry fees including post graduate studies nordic countries. article 13 international covenant economic social cultural rights ensures right free education primary education progressive introduction secondary higher education right education.in university oslo tuition fee except small semester fee nok 600 us 74 . 2013 northern europe estonia started providing free higher education well.
query	79	interest rate amount interest due per period proportion amount lent deposited borrowed called principal sum . total interest amount lent borrowed depends principal sum interest rate compounding frequency length time lent deposited borrowed. defined proportion amount loaned lender charges interest borrower normally expressed annual percentage. rate bank lender charges borrow money rate bank pays savers keeping money account.the annual interest rate rate period one year. interest rates apply different periods month day usually annualised.
query	80	job satisfaction employee satisfaction measure workers contentedness job whether like job individual aspects facets jobs nature work supervision. job satisfaction measured cognitive evaluative affective emotional behavioral components. researchers also noted job satisfaction measures vary extent measure feelings job affective job satisfaction . cognitions job cognitive job satisfaction .one widely used definitions organizational research locke 1976 defines job satisfaction pleasurable positive emotional state resulting appraisal one job job experiences p. 1304 .
query	81	television tv sometimes shortened tele telly telecommunication medium used transmitting moving images monochrome black white colour two three dimensions sound. term refer television set television program tv show medium television transmission. television mass medium advertising entertainment news. television became available crude experimental forms late 1920s would still several years new technology would marketed consumers. world war ii improved form black white tv broadcasting became popular united states britain television sets became commonplace homes businesses institutions.
query	82	ethics governance accountability answerability blameworthiness liability expectation account giving. aspect governance central discussions related problems public sector nonprofit private corporate individual contexts. leadership roles accountability acknowledgment assumption responsibility actions products decisions policies including administration governance implementation within scope role employment position encompassing obligation report explain answerable resulting consequences. governance accountability expanded beyond basic definition called account one actions . frequently described account giving relationship individuals e.g.
query	83	belief attitude something case true. epistemology philosophers use term belief refer personal attitudes associated true false ideas concepts. however belief require active introspection circumspection. example ponder whether sun rise assume will. since belief important aspect mundane life according eric schwitzgebel stanford encyclopedia philosophy related question asks physical organism beliefs context ancient greek thought two related concepts identified regarding concept belief pistis doxa.
query	84	career individual metaphorical journey learning work aspects life. number ways define career term used variety ways. definitions oxford english dictionary defines word career person course progress life distinct portion life . definition relates career range aspects individual life learning work. career also frequently understood relate working aspects individual life career woman example.
query	85	citizenship european union eu afforded qualifying citizens european union member states. given citizens member states 1992 maastricht treaty time european community gaining legal identity. treaty established direct legal relationship new legal identity citizens establishing directly elected european parliament ability citizens bring cases directly european court justice ecj kirchberg luxembourg force since 1993. european union citizenship additional national citizenship. eu citizenship affords rights freedoms legal protections citizens.
