query	173	infant latin word infans meaning unable speak speechless formal specialised synonym baby young offspring human. term may also used refer juveniles organisms. newborn colloquial use infant hours days one month old. medical contexts newborn neonate latin neonatus newborn refers infant first 28 days birth term applies premature full term postmature infants birth term fetus used. term infant typically applied young children one year age however definitions may vary may include children two years age.
query	174	jason frederick kidd born march 23 1973 american professional basketball coach former player assistant coach los angeles lakers national basketball association nba . previously point guard nba kidd 10 time nba star five time nba first team member nine time nba defensive team member. nba championship 2011 member dallas mavericks two time olympic gold medal winner pro career part team usa 2000 2008. inducted player naismith memorial basketball hall fame. kidd played college basketball california golden bears drafted second overall dallas mavericks first round 1994 nba draft.
query	175	jean claude camille fran ois van varenberg born 18 october 1960 professionally known jean claude van damme french pronunciation klod v dam dutch v n jcvd belgian actor retired martial artist best known martial arts action films. popular projects include bloodsport 1988 cyborg 1989 kickboxer 1989 lionheart 1990 death warrant 1990 double impact 1991 universal soldier 1992 nowhere run 1993 hard target 1993 timecop 1994 street fighter 1994 sudden death 1995 maximum risk 1996 jcvd 2008 jean claude van johnson 2016 2017 series bouncer 2018 . early life education van damme born jean claude camille fran ois van varenberg 18 october 1960 berchem sainte agathe brussels belgium son eliana eug ne van varenberg accountant florist. father brussels bilingual mother flemish dutch speaking . roman catholic van damme paternal grandmother jewish.he began martial arts age ten enrolled father sh kan karate school.
query	176	jesus c. 4 bc c. ad 30 33 also referred jesus nazareth jesus christ first century jewish preacher religious leader. central figure christianity. christians believe incarnation god son awaited messiah christ prophesied old testament.virtually modern scholars antiquity agree jesus existed historically although quest historical jesus produced little agreement historical reliability gospels closely jesus portrayed bible reflects historical jesus. jesus galilean jew baptized john baptist began ministry. preached orally often referred rabbi .
query	177	johann sebastian bach 31 march o.s. 21 march 1685 28 july 1750 german composer musician baroque period. known instrumental compositions brandenburg concertos goldberg variations vocal music st matthew passion mass b minor. since 19th century bach revival generally regarded one greatest composers time.the bach family already counted several composers johann sebastian born last child city musician eisenach. orphaned age 10 lived five years eldest brother johann christoph continued musical formation l neburg. 1703 back thuringia working musician protestant churches arnstadt hlhausen longer stretches time courts weimar expanded organ repertory k mostly engaged chamber music.
query	178	john joseph travolta born february 18 1954 american actor singer dancer. travolta rose fame 1970s appearing television series welcome back kotter 1975 1979 starring box office successes saturday night fever 1977 grease 1978 . acting career declined 1980s enjoyed resurgence 1990s role pulp fiction 1994 since starred films get shorty 1995 broken arrow 1996 face 1997 swordfish 2001 cool 2005 wild hogs 2007 hairspray 2007 bolt 2008 taking pelham 123 2009 . travolta nominated academy award best actor performances saturday night fever pulp fiction. first golden globe award best actor motion picture musical comedy performance get shorty received total six nominations recent 2011.
query	179	kathleen mary griffin born november 4 1960 american comedian actress. starred numerous comedy specials cable tv released comedy albums. 2007 2008 griffin primetime emmy awards reality show kathy griffin life list. also appeared tv film numerous supporting roles. born oak park illinois moved los angeles 1978 studied drama lee strasberg theatre film institute became member improvisational comedy troupe groundlings.
query	180	ludwig van beethoven listen german lu tv fan tho fn listen baptised 17 december 1770 26 march 1827 german composer pianist. crucial figure transition classical romantic eras classical music considered one greatest composers time. beethoven born bonn capital electorate cologne part holy roman empire. musical talent obvious early age harshly intensively taught father johann van beethoven thought would enable become child prodigy like mozart. later taught composer conductor christian gottlob neefe.
query	181	luther ronzoni vandross jr. april 20 1951 july 1 2005 american singer songwriter record producer. throughout career vandross demand background vocalist several different artists including todd rundgren judy collins chaka khan bette midler diana ross david bowie ben e. king donna summer. later became lead singer group change released gold certified debut album glow love 1980 warner rfc records. vandross left group signed epic records solo artist released debut solo album never much 1981.
query	182	mariah carey born march 27 1969 1970 american singer songwriter actress record producer entrepreneur. referred songbird supreme guinness world records noted five octave vocal range melismatic singing style signature use whistle register. rose fame 1990 signing columbia records releasing eponymous debut album topped u.s. billboard 200 eleven consecutive weeks. soon carey became artist ever first five singles reach number one u.s. billboard hot 100 chart vision love emotions .following marriage sony music head tommy mottola carey achieved worldwide success follow albums music box 1993 merry christmas 1994 daydream 1995 . albums spawned carey successful singles including hero without want christmas fantasy always baby well one sweet day became u.s. best performing single 1990s.
query	183	pope benedict xvi latin benedictus xvi italian benedetto xvi german benedikt xvi born joseph aloisius ratzinger german pronunciation jo z f al zi ats 16 april 1927 retired prelate catholic church served head church sovereign vatican city state 2005 resignation 2013. benedict election pope occurred 2005 papal conclave followed death pope john paul ii. benedict chose known title pope emeritus upon resignation.ordained priest 1951 native bavaria ratzinger established highly regarded university theologian late 1950s appointed full professor 1958. long career academic professor theology several german universities appointed archbishop munich freising cardinal pope paul vi 1977 unusual promotion someone little pastoral experience. 1981 appointed prefect congregation doctrine faith one important dicasteries roman curia. 2002 election pope also dean college cardinals.
query	184	prince charming fairy tale character comes rescue damsel distress must engage quest liberate evil spell. classification suits heroes number traditional folk tales including snow white sleeping beauty cinderella even original story given another name name all. often handsome romantic characters essentially interchangeable serving foil heroine many variants viewed metaphor reward heroine achieves decisions makes. prominence character type makes obvious target revisionist fairy tales. prince charming also used term refer idealized man people dream future spouse.
query	185	roger federer german pronunciation r r fe r r born 8 august 1981 swiss professional tennis player ranked world no. 3 men singles tennis association tennis professionals atp . 20 grand slam singles titles history male player held world no. 1 spot atp rankings record total 310 weeks including record 237 consecutive weeks year end no. 1 five times including four consecutive.
query	186	samuel barclay beckett 13 april 1906 22 december 1989 irish novelist playwright short story writer theatre director poet literary translator. resident paris adult life wrote french english. beckett work offers bleak tragi comic outlook human existence often coupled black comedy gallows humour became increasingly minimalist later career. considered one last modernist writers one key figures martin esslin called theatre absurd .beckett awarded 1969 nobel prize literature writing new forms novel drama destitution modern man acquires elevation. elected saoi aosd na 1984. early life education samuel beckett born dublin good friday 13 april 1906 william frank beckett 1871 1933 quantity surveyor descendant huguenots maria jones roe nurse 35.
query	187	serena jameka williams born september 26 1981 american professional tennis player former world no. 1. 23 major singles titles man woman open era. women tennis association wta ranked world no. 1 singles eight separate occasions 2002 2017.
query	188	trinity laure ale home born march 15 1995 better known stage name tink american rapper singer songwriter. best known single treat like somebody collaboration singer producer jeremih tell nobody. since 2012 released seven mixtapes gone independent due label issues regarding release debut album. 2014 mixtape winter diary 2 forever featured top 10 r b album rolling stone billboard magazines.she also chosen part xxl 2015 freshman class. early life education trinity home born march 15 1995 calumet city illinois. home nicknamed tink friends elementary school used name ever since.
query	189	anthony jay robbins born anthony j. mahavoric february 29 1960 american author life coach philanthropist. robbins known infomercials seminars self help books including books unlimited power published 1987 awaken giant within published 1993 .in 2015 2016 robbins listed worth magazine power 100 list. seminars organized robbins research international. early life robbins born anthony j. mahavoric north hollywood california february 29 1960. robbins eldest three children parents divorced 7.
query	190	mark sinclair born july 18 1967 better known vin diesel american actor producer. rose international fame role dominic toretto fast furious franchise. diesel began career 1990 initially struggled gain roles created starred short film multi facial 1995 attracted attention director steven spielberg developing film saving private ryan. spielberg wrote elements film allow diesel appear helped kickstart career. subsequently voiced titular character iron giant 1999 gaining reputation action star starring fast furious xxx series chronicles riddick.
query	191	acapulco de ju rez spanish aka pulko e xwa es listen commonly called acapulco ak puul koh also us ahk city municipality major seaport state guerrero pacific coast mexico 380 kilometres 240 mi south mexico city. acapulco located deep semicircular bay port since early colonial period mexico history. port call shipping cruise lines running panama san francisco california united states. city acapulco largest state far larger state capital chilpancingo. acapulco also mexico largest beach balneario resort city.the city one mexico oldest beach resorts came prominence 1940s 1960s getaway hollywood stars millionaires.
query	192	alberta province canada. estimated population 4 067 175 2016 census canada fourth populous province populous canada three prairie provinces. area 660 000 square kilometres 250 000 sq mi . alberta neighbour saskatchewan districts northwest territories established provinces september 1 1905. premier jason kenney april 30 2019.
query	193	angola listen portuguese l officially republic angola portuguese rep blica de angola kikongo kimbundu umbundu repubilika ya ngola west coast country south central africa. seventh largest country africa bordered namibia south democratic republic congo north zambia east atlantic ocean west. angola exclave province province cabinda borders republic congo democratic republic congo. capital largest city angola luanda. territory angola inhabited since paleolithic era hosting wide variety ethnic groups tribes kingdoms.
query	194	arizona listen navajo hoozdo hahoodzo navajo pronunciation x zt x x ts odham al onak uto aztecan pronunciation onak state southwestern region united states. also part western mountain states. 6th largest 14th populous 50 states. capital largest city phoenix. arizona shares four corners region utah colorado new mexico neighboring states nevada california west mexican states sonora baja california south southwest.
query	195	british columbia bc french colombie britannique westernmost province canada located pacific ocean rocky mountains. estimated population 5.1 million 2019 canada third populous province. first british settlement area fort victoria established 1843 gave rise city victoria first capital separate colony vancouver island. subsequently mainland colony british columbia 1858 1866 founded richard clement moody royal engineers columbia detachment response fraser canyon gold rush. moody chief commissioner lands works colony first lieutenant governor british columbia hand picked colonial office london transform british columbia british empire bulwark farthest west found second england shores pacific .
query	196	chennai listen tamil en ai also known madras listen official name 1996 capital indian state tamil nadu. located coromandel coast bay bengal biggest cultural economic educational centre south india. according 2011 indian census sixth populous city fourth populous urban agglomeration india. city together adjoining regions constitute chennai metropolitan area 36th largest urban area population world. chennai among visited indian cities foreign tourists.
query	197	cincinnati sin sih nat ee major city u.s. state ohio government seat hamilton county. settled 1788 city located northern side confluence licking ohio rivers latter marks state line kentucky. city economic cultural hub cincinnati metropolitan area fastest growing economic power midwestern united states based increase economic output population 2 190 209 2018 census estimates. makes ohio largest metropolitan area nation 28th largest. city population estimated 302 605 cincinnati third largest city ohio 65th united states.
query	198	dormitory originated latin word dormitorium often abbreviated dorm building primarily providing sleeping residential quarters large numbers people boarding school high school college university students. countries also refer room containing several beds accommodating people. worldwide dormitories often single sex sexes accommodated separate floors separate rooms cases. unusual unrelated mixed sex occupancy bedroom except temporarily example travel hostel railway sleeping car . occur remarkable newsworthy example mixed sex sharing bedrooms norwegian army .
query	199	egypt listen ee jipt arabic mi r egyptian arabic r coptic kh mi officially arab republic egypt country spanning northeast corner africa southwest corner asia land bridge formed sinai peninsula. egypt mediterranean country bordered gaza strip israel northeast gulf aqaba red sea east sudan south libya west. across gulf aqaba lies jordan across red sea lies saudi arabia across mediterranean lie greece turkey cyprus although none share land border egypt. egypt one longest histories country tracing heritage back 6th 4th millennia bce. considered cradle civilisation ancient egypt saw earliest developments writing agriculture urbanisation organised religion central government. iconic monuments giza necropolis great sphinx well ruins memphis thebes karnak valley kings reflect legacy remain significant focus scientific popular interest.
query	200	egyptian pyramids ancient pyramid shaped masonry structures located egypt. november 2008 sources cite either 118 138 number identified egyptian pyramids. built tombs country pharaohs consorts old middle kingdom periods.the earliest known egyptian pyramids found saqqara northwest memphis. earliest among pyramid djoser built c. 2630 2610 bc third dynasty.
query	201	finland finnish suomi suo mi listen swedish finland f nland listen finland swedish finl nd officially republic finland finnish suomen tasavalta swedish republiken finland listen nordic country northern europe bordering baltic sea gulf bothnia gulf finland sweden west russia east estonia south north eastern norway north. capital largest city helsinki. major cities espoo tampere vantaa oulu turku jyv skyl lahti kuopio. finland population 5.52 million july 2019 majority live central south country speak finnish finnic language uralic language family unrelated scandinavian languages. finland eighth largest country europe sparsely populated country european union.
query	202	gay bar drinking establishment caters exclusively predominantly lesbian gay bisexual transgender lgbt clientele term gay used broadly inclusive concept lgbt queer communities. gay bars served centre gay culture one places people sex orientations gender variant identities could openly socialize. names used describe establishments include boy bar girl bar gay club gay pub queer bar lesbian bar drag bar dyke bar depending niche communities served. advent internet increasing acceptance lgbt people across western world relevance gay bars lgbt community somewhat diminished. areas without gay bar certain establishments may hold gay night instead.
query	203	glasgow also uk us scots glesga lez scottish gaelic glaschu kl xu populous city scotland third populous city united kingdom 2017 estimated city population 621 020. historically part lanarkshire city forms glasgow city council area one 32 council areas scotland local authority glasgow city council. glasgow situated river clyde country west central lowlands. fifth visited city uk.inhabitants city referred glaswegians informally weegies . glasgow also known glasgow patter distinct dialect scots language noted difficult understand outside city.
query	204	greece officially hellenic republic greek also known hellas greek country located southeastern europe. population approximately 10.7 million 2018 athens nation capital largest city followed thessaloniki. situated southern tip balkan peninsula greece located crossroads europe asia africa. shares land borders albania northwest north macedonia bulgaria north turkey northeast. aegean sea lies east mainland ionian sea west cretan sea mediterranean sea south.
query	205	hawai listen h wy ee hawaiian hawai h v j state united states america. state located pacific ocean state composed entirely islands. state encompasses nearly entire hawaiian archipelago 137 islands spread 1 500 miles 2 400 km . volcanic archipelago physiographically ethnologically part polynesian subregion oceania. southeastern end archipelago eight main islands order northwest southeast ni ihau kaua ahu moloka l na kaho olawe maui hawai i.
query	206	himalayas himalaya mountain range asia separating plains indian subcontinent tibetan plateau. range many earth highest peaks including highest mount everest nepal china . himalayas include fifty mountains exceeding 7 200 23 600 ft elevation including ten fourteen 8 000 metre peaks. contrast highest peak outside asia aconcagua andes 6 961 22 838 ft tall.lifted subduction indian tectonic plate eurasian plate himalayan mountain range runs west northwest east southeast arc 2 400 km 1 500 mi long. western anchor nanga parbat lies south northernmost bend indus river.
query	207	india hindi bh rat officially republic india hindi bh rat ga ar jya country south asia. seventh largest country area second populous country populous democracy world. bounded indian ocean south arabian sea southwest bay bengal southeast shares land borders pakistan west china nepal bhutan north bangladesh myanmar east. indian ocean india vicinity sri lanka maldives andaman nicobar islands share maritime border thailand indonesia. modern humans arrived indian subcontinent africa later 55 000 years ago.
query	208	iran persian ir n n listen also called persia officially islamic republic iran persian jomhuri ye esl mi ye ir n listen omhu ije esl mije n country western asia. 82 million inhabitants iran world 18th populous country. territory spans 1 648 195 km2 636 372 sq mi making second largest country middle east 17th largest world. iran bordered northwest armenia republic azerbaijan north caspian sea northeast turkmenistan east afghanistan pakistan south persian gulf gulf oman west turkey iraq. central location eurasia western asia proximity strait hormuz give geostrategic importance.
query	209	kansas city abbreviated kck third largest city state kansas county seat wyandotte county third largest city kansas city metropolitan area. situated kaw point junction missouri kansas rivers. borders johnson county kansas south kansas city missouri kcmo east kansas city kansas named. part consolidated city county government known unified government . wyandotte county also includes independent cities bonner springs edwardsville portion lake quivira unincorporated area known loring.
query	210	kelowna city okanagan lake okanagan valley southern interior british columbia canada. serves head office regional district central okanagan. name kelowna derives okanagan language term grizzly bear .the kelowna metropolitan area population 194 882 third largest metropolitan area province behind vancouver victoria. additionally city kelowna seventh largest city province. ranks 22nd largest canada largest inland city british columbia.
query	211	kings island 364 acre 147 ha amusement park located 24 miles 39 km northeast cincinnati mason ohio. owned operated cedar fair park first opened 1972 taft broadcasting company. part larger effort move expand coney island popular resort destination along banks ohio river prone frequent flooding. 300 million capital investments park features 100 attractions including fourteen roller coasters 33 acre 13 ha water park. early history kings island appeared popular sitcoms received widespread recognition record breaking attractions events.
query	212	lake ozarks reservoir created impounding osage river northern part ozarks central missouri. parts three smaller tributaries osage included impoundment niangua river grandglaize creek gravois creek. lake surface area 54 000 acres 220 km2 1 150 miles 1 850 km shoreline. main channel osage arm stretches 92 miles 148 km end end. total drainage area 14 000 square miles 36 000 km2 .
query	213	madrid spanish capital populous city spain. city almost 3.3 million inhabitants metropolitan area population approximately 6.5 million. second largest city european union eu surpassed berlin monocentric metropolitan area second largest eu smaller paris. municipality covers 604.3 km2 233.3 sq mi .madrid lies river manzanares centre country community madrid comprises city madrid conurbation extended suburbs villages community bordered autonomous communities castile le n castile la mancha. capital city spain seat government residence spanish monarch madrid also political economic cultural centre country.
query	214	melbourne listen mel b rn capital populous city australian state victoria second populous city australia oceania. name refers urban agglomeration 9 993 km2 3 858 sq mi comprising metropolitan area 31 municipalities also common name city centre. city occupies much coastline port phillip bay spreads hinterlands towards dandenong macedon ranges mornington peninsula yarra valley. population 5 million 19 population australia inhabitants referred melburnians .the city founded 30 august 1835 british colony new south wales free settlers colony van diemen land modern day tasmania . incorporated crown settlement 1837 named melbourne governor general richard bourke 10 april 1837 honour british prime minister william lamb 2nd viscount melbourne.
query	215	mombasa mom bass also us bah coastal city kenya along indian ocean. city known white blue city kenya. country oldest circa 900 ad second largest city capital nairobi population 1 208 333 people according 2019 census. metropolitan region second largest country population 3 528 940 people.mombasa regional cultural economic hub extra large port international airport important regional tourism center. located east coast kenya also home one state house kenya considered second capital name.
query	216	mount everest nepali sagarmatha tibetan chomolungma chinese zhumulangma earth highest mountain sea level located mahalangur himal sub range himalayas province no. 1 eastern nepal. situated distance 160 kms northeast kathmandu 174 km northwest provincial capital biratnagar international border nepal province no. 1 china tibet autonomous region runs across summit point.the current official elevation 8 848 29 029 ft recognised china nepal established 1955 indian survey subsequently confirmed chinese survey 1975.in 1865 everest given official english name royal geographical society recommended andrew waugh british surveyor general india chose name predecessor post sir george everest despite everest objections.mount everest attracts many climbers highly experienced mountaineers. two main climbing routes one approaching summit southeast nepal known standard route north tibet.
