question	44	when planning an infiltration  it is important to know the area you will be  working  in. don t be ridiculous and infiltrate an area that is either against the law to infiltrate or will get you into serious trouble if you are caught. know the likelihood of being caught in your area. always wear clothing that is suitable to your particular environment. if there are people in the target area  know their whereabouts at all times  have some good footwear. if you want  bring a friend. if you are spotted  don t panic  this will only inhibit your thought process and you could make some bad choices. if you are caught  just accept the fact and turn in. find some good hiding spots  roofs are very valuable  as no one will think to look up. learn how to move fluidly. don t ever bring a weapon unless it s necessary and is just an airsoft gun or small knife. if climbing is necessary in order to reach your objective  wear weight lifter s gloves. if infiltrating during the day  use proper camouflage. when inside of a building  constantly be alert. follow the law.
question	45	take a class at a racing school. enroll in a racing program. get your racing license. enter an amateur school race series. try kart racing. get a kart racing license. buy your kart. enter a race. complete two years in junior single seater racing events. turn 18 years old. accumulate 40 race points. accumulate 300 driving hours in a formula 1 car. accept an offer to drive for an f1 team. getting sponsorships. pay to drive in f1.
question	46	walk confidently onto the stage. look the presenter in the eye. take the diploma with your left hand and shake the presenter s hand with your right. continue to watch your step as you walk offstage. know when to change the tassel. be on time for every graduation related ceremony. prepare everything you need in advance of the big day. attend your school s graduation rehearsal. practice with your friends or family. avoid boasting or making a scene onstage. return to your seat and let your peers have their moment. let your excitement out when it comes time to throw hats.
question	47	discuss your honeymoon plans. mid  april  higher spring break pricing will prevail. discuss where you would like to go  and talk about how long you are willing to travel to get there. consider trying a new locale within a well known destination to fulfill the desire for  something different.  try to plan activities in your travel that give you time away from the touristy crowds  and allows you to really spend time and rediscover your significant other. select a travel consultant to save money and avoid mistakes. you can book online  but you ll rarely save money and in fact you will usually pay more when you consider you don t get the personal service that comes with the travel consultant making your arrangements for you. consider an inclusive resort to really get the most for your money  but remember  not all all inclusive resorts are created equal.
question	48	
question	49	know if the case is a misdemeanor  offense  or felony and whether the felony is pre or post indicted to know whether you are filing a cpl 240.20 or a cpl 190.50 demand. obtain the complaint from the prosecuting attorney. grab a criminal  tan  file and fill out the clients name and his docket or index number. put all the intake information into outlook  including dates of birth and internet e mail information. calendar the da s response to the 240.20 notice for 17 days from the date of mailing. calendar a date for omnibus motions 45 days from the date of arraignment or the date we filed our notice of appearance. if not already accomplished  file a notice of appearance with the court and the district attorney. immediately return the case to the attorney who will next handle it  and then make sure that they have reviewed the file within 48 hours or sooner if the case is calendered before then. have a signed retainer letter in the file or a retainer letter that the attorney will get signed on or before the next court appearance. check to make sure your accounting department has set up a file on this client on quickbooks or pro law or your billing and time management system. send the client a welcome to the firm letter  as well as a letter reminding him about his next court date.
question	50	start a savings account. earn money in high school. consider your goals. research financial aid options. complete the fafsa. look for grants and scholarships. check out food service related scholarships. take out a loan. apply for work study programs. join the military. find a roommate. buy used books and supplies. take advantage of student discounts. use public transportation or ride a bike. budget responsibly.
question	51	look up on one or more of the various search engines. know and teach scriptures. teach people the warnings signs and also how to react like warning sign  1   if he says to give up medication because god s going to heal you  do not under any circumstances follow what he is telling you because this is a big and definite tip off that this  healer  is fake.just like for example if megai love music from youtube is offered a ride by  dish network workers  who look friendly but he  megailovemuzic from youtube  calls dish network and says like  hi  my name is  name  and i am at  where megailovemuzic is at  and this is a dish network vehicle s license plate number  license plate number is told  are these workers really dish network workers  and the dish network customer service says  no in fact there is no scheduled dish network service for  address  for example  this is a big and definite tip off that these  dish network workers   are evil doers who have intentions on first tricking him then getting him to a secluded location then harming and hurting and quite possible murdering him so he should not ever go in these  dish network workers   dish network  vehicle.same thing if a televangelist says like  give up medication  for example  this is highly illegal and dangerous to follow and you should not follow his  holy  advice. get and make post cards  youtube videos  etc. ask yourself important questions like what is he saying   answer the important questions  in your mind of course  like he is saying and insisting that god will protect me from this mean dishwasher i have at my dishwashing job . act on the answers to your important questions like going to the police to report a mean dishwasher assaulting you at your dishwashing job for example and tell yourself either in your mind or verbally or both like  good and holy advice  that i should just trust in god  because even the demons believe in god and tremble james 2  19  so i must never just trust god  i must do actions as well to get what i need done get done. take heed of websites  others etc.
question	52	learn about the eastern front. research the western front. learn about the pacific theater. study the major forces involved in the war. read primary source books. read secondary source books. check out the public library. watch films. view films about the eastern front in wwii. see movies about the western front in wwii. watch movies about the pacific theater in wwii. interview a veteran. go to a museum. take a class at a local college. take a trip to normandy. visit a former concentration camp.
question	53	determine your home s risk of flooding. calculate the amount of coverage you will need. see if you are a member of the national flood insurance program  nfip . contact an insurance agent. ask your agent questions. get your elevation certificate. complete your application and pay your fee. get private insurance. know you have a 30 day waiting period. renew your policy. be clear about your deductible. know the limits of coverage.
question	54	define the forces on either end of the strand. account for acceleration. account for rotational acceleration. understand that tension due to gravity changes throughout a swinging object s arc. account for friction. lift parallel vertical loads using a pulley. lift loads using a pulley with non parallel vertical strands. use multiple strands to support a hanging object.
question	55	understand embedding. find the game you d like on your website. copy the embed code. paste the code into the body of your web page. follow the terms of service. know the risks of hosting. find a game site that allows downloads. download the game. upload the game file to your website directory. link to the game. embed the game instead. follow terms of service.
question	56	remember nothing is as difficult as it seems. collect everything that you need to get started with what you want to learn. get started with basics of coding  print a message  declare variables  perform some mathematics manipulation  run some loops  apply comments  etc. follow the step by step procedure as prescribed in a book  white paper  article  research  etc. deface your mind to make it remember what you learn. practice and apply what you learned.
question	57	change your wrong impression of grammar. forget the myth of listening. speak. learn vocabulary by heart. accept what can t understand. read in english.
question	58	decide what exactly you want to learn. search. evaluate your options. work hard. keep in mind that some programs actually issue ces  continuing education units . realize that some online classes are courses and are simply a matter of downloading printing the page and reading it and learning from that. classes online use a variety of software. find out if you need to  be there in person   or if you download the lesson  do it  and upload the results. get to know someone  or multiple  someones  .
question	59	identify your strengths  weaknesses and likings for a job. select your job where your strengths are used to the maximum extent. perform your job honestly and sincerely. work hard with. keep learning new things. don t expect large miracles in your job. don t compare your performance and returns with others. get organized and stay organized. get to personally know the types of people you work with. take a few occasional breaks during the day. limit processed foods and drinks  including coffee. develop a positive relationship with your job.
question	60	understand what atheism is. know what agnosticism is. know what a coexist is. consider the consequences. talk about it with someone you trust. tell your parents. be confident.
question	61	understand the origins of the language. understand that simlish was developed further by linguists and speech actors for use in the sims. know that there are a few english words in simlish  thrown in for variety. discover that a great deal of simlish is created in song  beginning with hot date. use the sims and pay attention to the sounds. find and download various famous recording artists who  as part of a promotional campaign  have released version of their songs in simlish. record your voice and practice improvising in simlish  then play back the results to see how close you are to the voices in the game and the music.
question	62	assess your level of fitness. next  choose your half marathon event. many charitable organizations hold marathons  half marathon and 5k races to raise money for their causes. register for your half marathon event. begin your training at least 12 weeks prior to the date of your half marathon event. find running trails or circuits where you can accurately judge the distance  such as a local track or a neighborhood sidewalk  which you can measure the distance of in your car . create a training calendar and post it in a prominent place to help you stay motivated every day of your training. spend your first 2 weeks running 3 miles  4.8 km  twice  with a 4 mile  6.4 km  run at the end of the week. increase your short run by half a mile  0.8 km  every 2 weeks  while increasing your long run at the end of the week by 1 mile  1.6 km . increase your long run by 1 mile  1.6 km  every week when you reach the last 3 to 4 weeks of your training  so that you complete a 10 mile  16 km  run the week before your half marathon event. leave at least one day between each run. devote 1 day each week to stretching and strength training with light to moderate weights. rest for 1 day each week. lower your level of training the week before you run a half marathon. rest for the two days prior to the half marathon event. eat a light  nutritious meal prior to your race  and stick with the foods you typically eat during your training. pack your running gear  such as a timer and glycogen  and a change of clothes the night before the race. stretch slowly and thoroughly after you cross the finish line to aid in your recovery.
question	63	after bringing up your computer  click on the programs and select microsoft office. when you add a new citation to a document  you create a new source that will appear in the bibliography. select the style that you want to use. next  on the  references  tab  in the  citations   bibliography  box  click  insert citation . this tutorial will go with choosing  add new source . click at the end of the sentence or phrase that you want to cite and click  insert citation . produce your bibliography or work cited page.
question	64	log in to your gmail account.  find the  settings  link in the upper right corner. check  enable undo send  and customize the time delay. send yourself a test email. click  undo  when you are redirected to your inbox. confirm that the message has not been sent.
question	65	go to google maps. correct your location. allow access. check if the information is right. launch the maps app.
question	66	ask your insurance agent if you qualify for customer discounts. move all of your insurance policies to your homeowners insurance company. raise your deductible. upgrade basic house systems such as electrical  heating  plumbing and roofing. add more security systems to your home. clear brush and trim trees around your house if you live in a fire prone region. improve your credit score.
question	67	get a voip phone adapter. the voip company you obtain your phone adapter from should send you instructions on how to hook it up. connect a telephone to the line 1 port of the phone adaptor using a standard phone line. power on your phone adapter by plugging in the power cord to the back of the adapter and the plug into the wall outlet. wait a couple minutes while your phone adaptor starts up. there may be updates that need to be downloaded  such as new firmware or changes to your features. pick up your telephone receiver and listen for a dial tone.
question	68	determine which state you should file for divorce in and what grounds are available in that state. decide if a no fault divorce is most appropriate  before investigating fault grounds. narrow the list of fault grounds down to only those that are available to you in your specific situation. determine the final ground s  for divorce by eliminating any remaining grounds that do not make sense in your specific situation.
question	69	start the plan. join bridge courses. buy study materials. join a good college. keep it up. do well in exams.
question	70	log in to youtube. open the guide menu by clicking the horizontal bars. click history. delete all watched videos. remove just one video from your history. stop videos from entering your history in the future. manage your search history. remove youtube from your browser history. open the youtube app on your device. touch the guide icon. select history. touch the trash icon. sign out to clear your search history. open the youtube app. use menu items to remove your watch history. clear your search history. open the guide. select settings. clear your watch history.
question	71	know who determines whether an acupuncturist is licensed. learn about the educational requirements of a licensed acupuncturist. recognize the extensive training needed to become a licensed acupuncturist. recognize the differences between a licensed acupuncturist and someone who claims to be certified in acupuncture. research your state s regulations on acupuncture licensing. search online for a licensed acupuncturist in your area. ask your physician for a recommendation. verify state licensing. research an acupuncturist s ratings and patient reviews. request a patient referral from the licensed acupuncturist. verify board certification and licensing when scheduling an appointment. find out if your insurance will cover the treatment and if the acupuncturist accepts insurance. meet with the licensed acupuncturist. consider the specialty of the licensed acupuncturist. be patient with your search.
question	72	learn an acronym to help. look at the appearance score. look at the scores for heart rate. understand the score for the grimace response. watch your baby s movement to determine muscle tone. learn the rating for breathing. analyze the whole score. don t be afraid of low scores. prepare for interventions from the medical team. be aware where the test will be performed. understand the one minute test. learn about the five minute test. watch for it to be given a third time.
question	73	work with your doctor to develop an asthma action plan. get a prescription. use an anti inflammatory. take a bronchodilator. use allergy medication. consider bronchial thermoplasty. limit exposure to triggers. maintain your overall health. control heartburn and gerd. employ deep breathing. explore herbal remedies. learn your risk factors. recognize signs and symptoms. undergo asthma tests. receive definitive diagnosis.
question	74	use cold therapy. try heat therapy. take it easy for a few days. get regular exercise. wear a neck or back brace. use a support pillow. change your lifestyle. try over the counter pain relievers. use a topical pain reliever. get a prescription medication. try muscle relaxants. talk to your doctor about a narcotic pain medicine. ask about anti seizure or antidepressant medications. get an epidural steroid injection. determine if you need surgery. talk to your doctor about spinal decompression surgery. undergo physical therapy. try spinal manipulation. consider acupuncture.
question	75	be aware of your risk. recognize your risk increases with age. ask about your family s medical history. limit exposure to radiation. understand what kinds of radiation do not cause brain cancer. change your eating and nutritional habits. exercise regularly. learn the symptoms. have a doctor diagnose brain cancer. treat brain cancer. learn the risks of not getting treatment.
question	76	avoid irritating your median nerves. stretch your wrists. take over the counter  otc  anti inflammatories. use cold therapy. wear a wrist splint. change your sleeping position. alter your work station. make an appointment with your doctor. ask about corticosteroid injections. consider surgery as a last resort. be patient with recovery.
question	77	look at the markings. acknowledge rare colour variations. feel the dog s coat. determine if the dog sheds. examine the dog s build. look for brown or blue eyes. recognize deviations. use a dog breed identification app. ask the owner. ask your veterinarian. talk with the breeder. purchase a dna test kit online. read and follow the instructions. swab the dog s cheek. mail the kit. read the results.
question	78	know the symptoms of acute viral hepatitis. understand that chronic hepatitis may be asymptomatic. treat chronic fatigue seriously. pay attention to your regular lab work. get a liver enzyme test. get a viral antibody test. get tested for viral proteins and genetic material. have tests to rule out other conditions. get further testing after a positive diagnosis. know if you are at risk for hepatitis c. hepatitis c is a type of viral hepatitis that is typically transmitted by blood contact. understand the risk factors for hepatitis b. learn how hepatitis a is transmitted.
question	79	follow a sleep schedule. create a peaceful sleep environment. relax. exercise regularly. watch your diet. talk to your doctor. consider medication. participate in a sleep study. learn the causes. know the effects. try new methods.
question	80	decide to whom you will donate. contact a transplant center. get matched. have a health screening. know the risks of surgery. understand the long term risks. figure out the finances. ask the doctor what kind of surgery you will have. follow all pre operative instructions. be prepared for the recovery period. get follow up treatment. adhere to post surgical restrictions.
question	81	figure out the cause of your pain. consider other physical symptoms. be aware of allergies to otc medications. identify conditions that limit usage of otc pain relievers. keep potential drug interactions in mind. try ibuprofen for aches and inflammation. use aspirin for anything that hurts. take naproxen sodium for longer relief. reach for acetaminophen. read the active ingredients to avoid overdose. talk to your doctor or pharmacist.
question	82	make an appointment with your doctor or healthcare practitioner. empty your bladder before measuring. change into a hospital gown. lay on the examination table. lay still and breathe normally as the doctor palpates your uterus. allow the doctor to measure your fundal height. get dressed and discuss your results with your doctor. if your fundal height measurement is abnormal  schedule a follow up. empty your bladder and remove your clothing. grab a measuring tape. lay on your back. find your pubic bone. find your fundus. measure from your pubic bone to your fundus. if your fundal height appears abnormal  contact your doctor.
question	83	notice if you feel muscle weakness or can t move. speak and see if your speech is slurred. look in the mirror to see if your eyelids are drooping. breathe deeply to see if you have any trouble or shortness of breath. check your vision to see if you are seeing blurry or double. assess symptoms in infants differently. visit your doctor if you recognize the above symptoms. undergo a physical examination to get a preliminary diagnosis. your doctor will look for additional symptoms  which include  decreased or absent lachrymation  tearing   fixed and dilated pupils  decreased deep tendon reflexes  extremely dry mouth  urinary retention as unable to empty the bladder  and inability to perform basic functions such as walking  speech and coordinating movements. get a series of diagnostic tests to confirm botulism. treat the dangerous symptoms of botulism. decrease toxin load. treat wounds  in appropriate cases. utilize proper technique for canning and dispose of expired food products properly. do not give infants less than one year old honey or corn syrup. cleanse any wounds with hot warm water and soap.
question	84	verify your sprint phone is listed under  which sprint phones can i use on boost   at http   www.boostmobile.com support faq phones devices activate a sprint phone . navigate to the boost store locator page at http   www.boostmobile.com stores . enter your five digit zip code  then click  find.  the page will refresh to display a list of boost mobile stores in your area. visit the nearest boost mobile store to speak to a boost representative. inform the representative that you want to use your sprint phone with boost mobile. provide the representative with the information required to activate your sprint phone. wait for the boost mobile representative to activate your sprint phone. navigate to the boost mobile phone activation page at https   activate.boostmobile.com boostapp handsetidentifier.do. select the option that best represents your activation needs  then click  next.  in most cases  you ll be selecting the option to activate a phone as a new customer  or swap a phone as an existing customer. follow the on screen instructions to activate your sprint phone. wait for boost mobile to contact you after processing your activation request.
