question	1	download fraps from the fraps homepage. open fraps. set a hotkey for recording video. minimize fraps. open your game. if you want to take a video  press the hotkey you set for video capture. set hotkeys for the benchmarking and frame rate overlay functions. configure additional options for your benchmarking and overlay functions. minimize fraps and begin your game. set a screenshot hotkey. configure your screenshot options. minimize fraps and open your game. when you want to take a screenshot of your game  press the hotkey you set for screen captures.
question	2	determine what your goal is. find a gymas a bodybuilding beginner you have to find a gym around your neighborhood and it will be much better if you can go to it by foot because it will help you to defeat all excuses about not going  and the gym atmosphere is a very important key for your success because it helps you to concentrate more which means better results for you . find a training partnerbodybuilding sport have a lot of challenges not every bodybuilding beginner can deal with it   in fact 90  of the bodybuilding beginner didn t achieve their goals whatever it is lose fat   build muscle   gain weight  become a fitness model  etc because they didn t have the amount of support and motivation all bodybuilding beginners really need. as a bodybuilding beginner you have to look for help. one of the most important steps you have to take as a bodybuilding beginner is knowledge. set high hopes. first week painwell   everyone of us have a daily activities his body used to do it continuously and when he add a new activity like bodybuilding sport  his body will suffer for a while from this new activity and you will feel some pain in your body  however it will quickly disappeared it will take almost one week only 3 training session  my advice is just be patient because all bodybuilding beginner pass this pain in one week only. food challengeevery bodybuilding beginner he or she have to change the way they eat   as we said before nutrition is a very important factor in any sport . facing injury challengemost bodybuilding beginner face this challenge. don t try any diet medicine to get fast results  ask your doctor first  because this is the most common fault almost all beginner female bodybuilders make and it may cause some injury to your body. keep energy high. track your progress. purchase necessary tools   it will give you a good support to reach your target . as a bodybuilding beginner  female or male you have to keep in mind these three rulestrain hardeat wellsleep well
question	3	define the objective of your brainstorming session. come up with a starting point. decide what you want from your business idea. brainstorm with a group of people. set up your brainstorming location. research relevant subject matter. think independently. question market assumptions. honor all suggestions and ideas. ask questions. document your brainstorming session. repeat your brainstorming session. assess your ideas. define all the factors and details that need to be considered. choose the best idea. create a business plan. get started.
question	4	buy an e cigarette kit. charge the battery for the e cigarette. screw in the liquid cartridge. be aware of the difference between smoking a cigarette and smoking an e cigarette. do a  primer puff . draw slowly and steadily on the e cigarette. hold the vapor for three to five seconds. wait at least 30 seconds to feel the effects of the nicotine.
question	5	decide which kind of funding you need. talk with your lawyer. identify companies that fund lawsuits. research companies. analyze the strength of your case. consider whether you really want funding. ask questions. apply. sign a contract. receive your money.
question	6	use multiple treatments to reduce damage. expect some level of damage. be prepared for an orange tinted hair color during the process. take great care of your hair. pre condition your hair. gather ingredients and prepare your area. mix bleach with a developer. test a strand of hair. section your hair into four parts. apply the mixture evenly through your hair. wrap your hair in foil. let your hair sit for 30 to 45 minutes. apply toner to your hair. rinse out the toner and apply conditioner. repeat this process two weeks later. gather your ingredients. boil water and allow tea to steep. pour mixture into a spray bottle. sit out in the sun. apply conditioner to your hair.
question	7	mentally note the other car s license plate number  make  model and color. make sure nobody is hurt. call the police as soon as possible. move your car safely. turn on your hazard lights and turn off the engine. get out of your car if it s safe to do so. look for witnesses. exchange information with the other driver. document the incident. tell the police officer exactly what happened. avoid admitting fault. notify your insurance company of the accident. make a claim with your insurance company.
question	8	consider roadblocks to adult language acquisition. assess and assist learner motivation. facilitate student interaction. build vocabulary directly and  incidentally.  it is estimated that an adult needs to understand about 3 000 word families  think  thought  and thoughtful are in one word family  for instance  to be able to understand a foreign language from context.traditional vocabulary building methods  like memorization  drills  and tables  can still be utilized in the classroom with success. be flexible. compare classic and modern approaches. see the pros and possible cons of newer views. don t ignore traditional methods. find the right balance. let the adults be kids. help students help one another. offer goals and rewards. don t skip the work.
question	9	check with your courthouse. search for mediators online. contact a private mediation center. check with your bar association. hire the mediator. talk with the mediator ahead of mediation. think about what you want. analyze your best alternative to settlement. identify your bottom line. listen to the mediator s opening statement. make an opening statement. talk with each other. identify what the other side wants. caucus individually with the mediator. write down your agreement. don t insult the other side. think before speaking. decline to assign motivations to someone s actions. avoid  always  and  never  statements.
question	10	exercise just before you study. try light exercise while you study. go to the gym right after studying. take a walk around the library. exercise at your desk. determine an appropriate amount of exercise. choose an aerobic exercise. make time for your workout. focus on consistency. make the exercise an enjoyable experience. know that exercise boosts mental function. exercise to reduce stress. incorporate exercise to improve energy.
question	11	choose a genre to spoof  not one specific movie. watch every movie and scene from the genre you want to spoof  taking notes. aim for the plot holes and start poking fun. invert the expectations and tropes of your film comically. push the  normal  of the movie you re parodying to its comical extreme. understand what makes the original so successful  underscoring or arguing its message. consider making an actor or actress the  straight man  to illustrate what is a joke and what is being taken at face value. don t rely purely on references to create laughs  instead using them as a jumping off point. breakdown the visual style of the movies you re spoofing  and shoot it similarly if possible. give your actors characters to reference for their performance. play the ridiculous moments  straight  for the funniest results. pay attention to costumes and set design  mimicking the original as much as possible to make it feel like a sequel. toss in visual jokes that mimic or mock the original. allow a little seriousness into the film to make the comedy hit harder. aim for a quick  high paced film  especially in comedic moments.
question	12	get a plain t shirt and wash to remove any shrinking. set up your work area. place a piece of cardboard inside the t shirt. paint your design using fabric paint. let the paint dry. remove the cardboard. finished. wash your shirt. place a sheet of cardboard inside your t shirt. position your stencil  and make sure that it is secure. squirt the paint out onto a paper plate. dab your foam brush into the paint. tap the paint onto the stencil.keep dabbing and tapping until you get the coverage you want. remove the stencil before the paint dries. let the paint dry completely  then set the paint using a clothing iron  if desired. remove the cardboard from inside the shirt. wash your t shirt to remove any shrinking.even if your shirt says  pre shrunk  on it  it would still be a good idea to wash it. tuck a folded up newspaper or cardboard inside the shirt. position your stencil  and secure  if necessary. move to a well ventilated area and get set up. spray the shirt. let the paint dry for 15 minutes before doing a second coat.you can speed up the drying process with a hairdryer. let the paint dry for another 10 to 15 minutes before removing the stencil and newspaper cardboard. let the shirt finish drying for a few more minutes.once the shirt is dry  you can pull the cardboard out and wear your shirt.
question	13	use flashcards. take your first word. flip the flashcard. start practicing. our brain can keep words best for a long time when we put them in odd sentences or place them in an odd way into a sentence. choose a word. write a sentence. it happens that in japanese words you might see a part which looks like a word in your mother tongue. with this method you can not only learn new words  but also trim your hearing skills. turn on your computer and go to youtube. listen to the source you ve found. go to google translate or search in a dictionary this word. this is a really good way to actively work on your japanese skills and also try to get a feeling for new words. choose one japanese word and look at the translation. create at least 3 sentences with the japanese word. go on with the next words.
question	14	spend time with her. adversely  don t hover. identify problems and try your best to fix whatever they may be. understand that she will still miss her mother. let her be busy. focus on being a father. it might seem a bit weird when your daughter starts asking you to play with her barbie dolls alongside her  but you ll need to get used of it  as this will allow you two to bond. ask for help. talk about her mother. make her laugh.
question	15	relax your mind and thoughtsrelaxing your mind clears out your thoughts  negative energy  and stress. lay down on your stomach in a comfortable position. you will need a helper at this point. with the ice cube on your neck  have your helper put on some soothing music  and try to fall asleep with the intention of gazing into the future. once you wake up  write what you saw in your dream in the notebook. signs of the dreams.
question	16	wait for the pit to break open. listen to the music and go with the flow. two stepping during fast paced breakdowns is a good idea. throw down when the music gets heavier and starts to sound very brutal. throw in some spin kicks if there s room  or maybe try something that s unique. if the song seems to stop abruptly but the band still looks ready to go  then you re in for a breakdown any second.
question	17	review the score sheet. learn about the upper section. choose where to score your points. learn about the lower section. score a three of a kind. score a four of a kind. score a full house. score a small or large straight. score a yahtzee. fill in the chance box. calculate your total score. determine who goes first. roll the dice the first time. roll the dice a second time. roll the dice a third time. keep going until each player has taken 13 turns. maximize your chance at a yahtzee. go for the 35 point bonus. aim for straights early on. score high yahtzees in the upper section late in the game.
question	18	drive to the tooth rock trailhead. start on the paved historic columbia river highway trail that departs from the trailhead parking area. go up that trail until the trail splits. head up this steep trail for about 100 feet  30 m  until you end up at a 4 way junction. when this road splits  bear left  the road on the right will have two signs marking it trail  400 and 034 . after that  you will cross several service roads. turn left onto the tanner butte trail  401  toward the waterfalls. after hiking 2.2 miles  3.5 km  through the forest from the tanner butte trailhead  you ll come across a campsite. follow the trail downhill.
question	19	implement a token economy  if your daughter is preschool elementary school aged. help and encourage her. praise her often. ask her nicely to do what you want  and show gratitude when she does it. negotiate with her. trigger her empathy. set limits and offer choices. put her in timeout. ground her if she is an older child. always punish reasonably.
question	20	learn the difference between a good stranger  and a bad stranger. quickly walk away if a stranger approaches you. start kicking and screaming. run and tell an adult  for example  your parents  teacher  etc. bite them as hard as you can. strangers will use treats or toys to trick children into going somewhere with them. a stranger may ask you to help them look for a pet or carry something for them.
question	21	select a play. choose a good edition. familiarize yourself with the most frequent  shakespearisms.  language is always evolving  and some of the words in shakespeare s plays have a different meaning today than when the plays were written  or they are no longer in use. understand shakespeare s use of grammar. enjoy shakespeare s wordplay. gather other resources you might need. read carefully and slowly. take notes as you read. reread the text. keep reading. take more notes after each section. discuss the text with friends. perform or speak the play. watch a play  a movie  or listen to audio recordings of shakespeare s work. read a plot synopsis.
question	22	enter create a sim. make a mother with traits like brave  athletic  handy  slob  and bookworm to boost her handiness skills. create the husband with traits like natural cook  green thumb  family oriented  neat  and perfectionist traits. pick the career for the husband or make him a stay at home dad. pick a job for the mother. create the children.
question	23	make adoption ordinary. tell the child early. be honest and open. explain the birth mother s decision. emphasize that you love your child and will never give her up. keep communication open. expand on the story as the child grows older. be supportive to connections with your child s origins.
question	24	pick the perfect outer garment. wear the right undergarments. put on a pair of killer shoes. have sultry hair. wear sexy makeup. dim the lights. put a chair in the middle of the room. prepare some sexy music. let loose. stride into the room like a professional. maintain a sexy expression. take off your top. remove your skirt. work your body. kick off your shoes and take off your stockings. put your shoes back on. take off your bra. take off your underwear. kick off your heels.
question	25	figure out what you would like to forget. think about what bothers you the most about the memory. erase the memory with a ritual release. remove your  trigger objects.  consider hypnosis. try thinking about unpleasant details while doing pleasant things. make some new memories. find ways to improve on bad memories. consider talking to a therapist.
question	26	master the basics. practice  practice  practice. get creative. get the sounds right. put the whole phrase together. make it effortless. know the subtle differences. pick your phrase and get the pronunciation down. say it.
question	27	get out your calender. prepare in advance. before you start your day  plan where this is going to take place. you may light some candles in the bathtub  but if there is a small window  open it a tiny bit so that there is some fresh air. now lay the fluffy towel where it s easy to reach so you won t be cold  and your fresh comfy cloths  along with your hair tie so you can tie your hair into a high ponytail to get it out of your face  as well unless you have a robe you want to wear. next  go buy some snacks and rent out a chick flick movie. if you want  you can turn off your cell phone or page so that you won t be bothered. now go and relax 
question	28	make sure you are connected to the internet. open the start menu. click on  run . type cmd.exe  and press ok. in the window that opens up  type in  telnet towel.blinkenlights.nl  without the quotes  and hit enter or in first line enter  o  without quotes and in second line type towel.blinkenlights.nl then hit enter  source computer. it may take a minute to connect  but soon it will play star wars episode iv in ascii. note  this is not a hidden movie in windows. go to control panel   programs   turn windows feature on or off and check both telnet boxes to turn telnet on. open up the  start  menu and go to  search . type in  telnet  and press enter. in the following window  type  o   type this without quotes  and press enter. now type  towel.blinkenlights.nl   again  without quotes  and press enter. open your  applications  folder. locate and open the  utilities  folder. open the application  terminal . type in  telnet towel.blinkenlights.nl   without the quotes  and press enter.
question	29	
question	30	make her a mixtape. write a poem. write her a song. get to know her. avoid pickup lines. wait until you re alone together. let her know that you love her.
question	31	gather your supplies. cut out cardboard shapes. glue the triangles to the square. glue the triangles together. let the glue dry completely. paint the pyramid with white school glue. sprinkle on the sand. let the pyramid dry. make the cardboard base. roll the clay. measure out the clay pyramid sides. cut out the triangles. bevel the edges. form the shape of a pyramid. create ridges in the pyramid. paint the pyramid. cut a cardboard square. make a sugar cube square. add the second step to the pyramid. add the remaining steps. let the glue completely dry. paint the pyramid with glue. sprinkle it with sand.
question	32	look for ghosts in old houses. look for ghosts in cemeteries. look for ghosts in old schools. look for ghosts in old prison buildings. look for ghosts in former insane asylums. look for ghosts in former battlefields. look for ghosts at the site of a murder or accident. listen to local folklore. use a manual camera. use a camcorder. use a tape recorder. use an emf detector. use other specialist equipment. download a ghost hunting app. look out for any paranormal activity. use the box and burial method. use the candle method.
question	33	learn to count  one and two  three and four  five six.  learn to step in time to the eight beat rhythm. know that men and women should do the same step with the opposite foot. understand the starting position. the man should step forward with his left foot. the man should step forward with his right foot. the man should step his left foot back one step. the man should step his right foot back one foot length behind his left foot. the man should shift his weight onto his left foot. the man should shift his weight onto his right foot. the man should step back his left foot to meet the right. the man should step his left foot forward  repeating the first step. repeat all the steps.
question	34	define your core values. imagine what it could be like in the future. determine what needs improvement and what doesn t. get feedback. make smart goals. seek out information on how to pursue that change. make sure you are ready to change. be your own coach. consider outside help. practice  practice  practice  acknowledge that setbacks are normal. focus on what you will do in the future. accept and affirm yourself.
question	35	evaluate why you don t think you can trust your boyfriend. don t jump to conclusions. reflect on your past relationships. talk with your boyfriend about how you are feeling. make sure you hold yourself to the same standard. make an effort to strengthen your relationship with your boyfriend. recognize signs of more serious trust issues. consider where else these trust issues may come from. work with a licensed mental health professional. remember that both people in the relationship need to be able to trust each other. make a commitment to trusting someone. think about your boyfriend s feelings. talk with each other face to face. make an agreement not to gossip about your relationship. agree to admit mistakes and apologize. learn to forgive. make time for yourself. keep working at it. talk with your boyfriend about the loss of trust. look for opportunities in this difficult situation. establish new guidelines for your relationship. be sensitive and empathetic. learn to trust your instincts and intuition. don t let fear control your relationship. seek help.
question	36	search kakariko village. search death mountain. search hyrule field. search hylia. search lorule field. search thieve s village.
question	37	get glowing skin. whiten your smile. clean up your eyebrows. hydrate your hair. use a good deodorant or antiperspirant product. add a pop of color to the eyes. change up your hair. treat yourself like a celebrity with a lip color change. prioritize what s in your purse. don t forget your ticket  wear a dress that fits the pear shaped figure. wear a dress that fits a slim figure. wear a dress that fits the busty style. wear a dress that fits the petite style. consider yourself lucky if you have an hourglass figure  wear a dress that fits an apple shaped body.
question	38	research the members of the band. listen to as much of the band s music as possible. follow the band on any mutual social media platforms. try talking to other people who like the band as well  or who have liked the band for longer than you. try to see the band live. look into the band s merchandise. find out if there are any autobiographies or biographies about the band. if you re so inclined  look into any fanfiction written about your band. inform people of your decision to support the band. consider starting a fan blog  fan page or fansite for the band. occasionally take a break from the band.
question	39	become familiar with devanagari script. study the hindi vowels. study the hindi consonants. distinguish between  voiced  and  unvoiced  consonants. distinguish between  aspirated  and  unaspirated  consonants. listen to a recording of the hindi alphabet and then try to mimic the recording. learn how to write the hindi alphabet. become familiar with hindi nouns. become familiar with hindi pronouns. become familiar with hindi verbs. learn the basics of conjugating verbs. continue to practice your conversational hindi with longer phrases and sentences. purchase a good hindi dictionary. learn the days of the week. learn basic words for time and place. practice common phrases with a partner or with a recording. use online lessons to practice your skills. find a good textbook. read as much as you can in hindi. watch movies in hindi. attend indian cultural events. find friends who speak hindi.
question	40	determine whether grounds for eviction exist. have an informal discussion with the tenant. send the tenant an official letter. draft a notice of eviction. deliver the notice of eviction to the tenant. complete an affidavit of service and have it notarized. file a complaint if the tenant does not remedy the situation or vacate the rental unit. go to court on the date that is mentioned in the summons.
question	41	watch season 3 on netflix. stream season 3 on other streaming sites. buy the dvd set. research season 3. call your local basic cable provider. watch the current season.
question	42	tuck your teddy or stuffed animal in bed if he or she has one. take your teddy or stuffed animal s temperature. give your teddy or stuffed animal pretend medicine. make some fake soup for your teddy or stuffed animal. set your teddy or stuffed animal up in bed. make a pretend hot water bottle or ice pack and place it on your teddy or stuffed animal s feet or head. sing your teddy or stuffed animal a lullaby to help him or her sleep. give your teddy or stuffed animal a cup of fake cocoa or hot chocolate. make your teddy or stuffed animal a get well card. give your teddy or stuffed animal lots of hugs and kisses.
question	43	make the guest list. pick out invitations. include the necessary information. send the invitations at least 3 weeks in advance. select a theme for the shower. create your own decorations. make a memorable centerpiece for your refreshment or gift table. decide on the menu. prepare fruit punch and drinks. buy or make a cake. plan a variety of games. provide favors.
