question	153	review the eligibility requirements to become a taxi driver in glasgow. attend topographical courses on the city of glasgow  a requirement regardless of your intended employer. download and fill out the application to take the topographical test  available on the glasgow city council website  https   www.glasgow.gov.uk index.aspx articleid 4992 . pass the topographical test in order to proceed with obtaining your glasgow taxi driver license. download and fill out the application for taxi driver licensing after meeting the eligibility requirements. submit the application for taxi driver license and the necessary documentation by mail or in person to the licensing section  room 29  235 george street  glasgow  g1 1qz. obtain a 1 year glasgow taxi driver license. agree to a criminal background check conducted by disclosure scotland. attend an interview at glasgow taxis limited. learn the dispatch system for glasgow taxis limited.
question	154	take a ferry from italy to greece. fly from italy to greece. take the train from italy to greece. drive from italy to greece.
question	155	know the advantages of an llc. understand an llc s disadvantages. choose your company name. make sure the name you pick is not already registered. reserve your name. check for a business domain url. get a business email address. get a registered agent. use the hawaii business express  hbe . fill out a hawaii articles of organization. apply for an irs ein number. create an operating agreement. obtain licenses and permits. hire employees. set up record keeping. file your tax form. e file with the state. e file using commercial software. search tax licenses. file quarterly taxes. file annual reports.
question	156	do the necessary pre research  before  you plan to come  do your research on the region you would like to visit for trekking and for that you may take help through different search engines on the internet that will provide you information regarding the area  local tours and guides. know the region  the himalayan mountain chain is spread southeast to northwest across the asian continent. planning and preparation  the first and foremost part is that you like hiking in the first place  physical condition  when you are planning to trek in himalayas  it demands a degree of physical fitness in which muscles are conditioned to take the rigors of ascent and descent in long marches. mental condition  mental preparation is more complex than physical condoning. preparation for the trip  there are various factors to consider  both mental and physical  in preparation for the trip. food and fitness  first rule for anyone interested in trekking in the himalayan region is that one must be good in physical and mental condition. altitude sickness  no other mountains deserve the kind of respect the himalaya do in terms of altitude. the trekker medical kit  should include wound disinfectants  band aids in different sizes  gauze pads and rolls  mosquito repellents if crossing malarial areas  thermometer  analgesics  and anti inflammatory and other antibiotics as prescribed by a doctor from a travel clinic.
question	157	do some intense research for accurate sources  whether they are travel companies or personal accounts. try to figure out the costs involved. try to contact the travel companies inside iran for better prices. if you are american  you need to go on a guided tour. chose where you want to go. buy a travel guidebook. book your hotels on the spot. use the bus. make a list of places you want to visit by looking up in internet. get a guide  if you need  by asking from your hotel reception. if you need a car  ask your hotel. try to improvise. accept the invitations that you might get from local people  if they invited you to their homes or restaurants. bring your cell phone and use it there  you can get local sim cards for  50. bring your laptop  if you really need it  but you should know that is going to be a hassle since there are tons of computers all over the place hotels  cafe nets  shops ...etc open a google mail and upload your photos as you travel into google by attaching them to a letter and send it to yourself. bring a slim camera  instead of a chunky one. dress conservatively. use lonelyplanet forum for asking your questions from people who already have traveled to iran.
question	158	review the rules of the barbecue cook off. learn about the backgrounds of the cook off judges. participate in internet discussion groups about barbecue. obtain items as required for the barbecue cook off. use meat that is high in quality. develop a unique flavor for your barbecue. develop a sauce or glaze that is not extremely messy. display your barbecue in an appetizing and clean manner. keep your food warm or hot.
question	159	have a good personality. practice multi tasking and speedy serving even in your free time. work as quickly as possible. memorize faces. stay modest if a regular wants to buy you a drink  don t splurge on the most expensive one. make eye contact with your customers and maintain it when talking to them. keep your cool. learn from your colleagues. keep the bar clean and tidy. make suggestions. uphold the law. plan  suggest events. be presentable.
question	160	separate all the kings  or jacks  if you prefer  and three extra cards of any other type. fan out the cards so that the four kings show  with the three extra cards hidden behind the fourth king. explain that the kings are going to rob a bank. at this point  stack the cards all together and place them face down on the top  roof  of the deck. take the first spare card off the top. send the second  king  to the second floor  putting the next card somewhere in the middle of the deck. send the third  king  to the vault at the bottom. the fourth stays on top to be the lookout. have the top king say that the police are coming  so everybody needs to go to the top. make a show of taking the four cards off the top of the deck and showing them to the audience. display the four  rescued  kings alongside the deck and invite someone from the audience to search the remaining deck for the spare kings that they will assume you inserted. hide two random cards behind the second king when you fan them out. show the audience the top card  the first king   then send it to the bottom of the deck. send the next two cards  which aren t kings  to the middle of the deck without showing the audience  since you showed them the first one  they re more likely to take your word for it that the next two are kings as well . show them the fourth card  the second king   which the audience will believe is the fourth and last king. cut the deck  putting the bottom half on top and thus putting the first king back with the other three kings. fan out the deck and show the audience that the kings have stuck together through it all.
question	161	use a light action rod with 4 to 6 pound test line. choose a lure that mimics native baitfish. use night crawlers  minnows or salmon for live bait. use a depth finder. try jigging for trout. troll for trout when they re scattered. watch the line continuously.large trout will slowly swim away after biting the bait. look in north american lakes. find them in cold  deep water. fish for trout all year round. fish near dropoffs and ledges. look near feeding areas.
question	162	tour melbourne city. watch a football match. visit docklands  southbank  chinatown. the melbourne zoo is very fine. as with most australian cities  the beach is very popular. relaxing in a cafe is also a great thing to do. wondering the many laneways in the city. visit the melbourne museum. visit the melbourne visitors information centre at fed square. download local travel apps to navigate the city like a local.
question	163	ensure you have both parents ids   photocopies for each  original birth certificate and photocopy  school leaving certificate and a photocopy  results slip and photocopy if available  and lastly your birth clinic card. take these documents to your assistant chief  chief . ensure you arrive at the district officer s office early in the morning together with all your documents due to the large number of people. return the form and documents to the appropriate officer. the officer should take your thumb prints and hand you forms that you should take for signing. once you are done. finally you should be issued with a waiting card and advised on when to collect your id.probably after 2 months.
question	164	contact experienced mountain climbing companies who have a strong track record on everest. discuss the supplies and services covered for the expedition. determine your budget for the expedition. compare the prices and services provided by several climbing companies. pay for the expedition and set your expedition date. follow a strict training program six months before your expedition date. focus on building cardiovascular strength and endurance. build muscle mass through free weights and interval training. do several big climbs before you commit to everest. enroll in an everest training camp. get the necessary gear for the climb.
question	165	contact your nearest embassy. get contact information for a local attorney. choose the best qualified attorney for your case. ask your attorney to explain the process. work with your attorney to prepare for trial. attend the trial. explore the possibility of immunity. find out if you can be extradited or deported. make a human rights plea to be released.
question	166	organize your travel papers. book a flight. pick out accommodations that work for you. pack appropriately. make the journey by car. visit prague castle. see charles bridge. tour one of the many museums. take a stroll through old town. spend a day shopping in new town. sign up for a river cruise. enjoy good food and beverages. slow things down with a trip to the countryside.
question	167	look at your finances. create a savings plan. research vacation costs. talk to your travel partners. determine your activity level. think about your vacation goals. weigh the pros and cons of different climates. plan the length of your vacation. choose barbados. enjoy a cuban vacation. spend some time in the dominican republic. soak up the sun in ocho rios  jamaica. choose a mexican vacation. choose park city  utah. choose new york city. hang out in new orleans.
question	168	visit the many lakes  locally known as lochs  across the park. climb the multiple mountains on offer. take a look at the variety of castles. ride the cairngorm funicular railway. walk through the delightful forests. try mountain biking. explore the waterfalls. visit the shows  theme parks and attractions. go skiing.
question	169	debark from your airplane and gather your luggage from the baggage claim. choose your preferred method of san francisco transportation  train  taxi  shuttle or car. check what terminal you are currently in. buy your ticket. insert your ticket into the fare turnstile. board the bart train  or wait for its arrival. ride the train for approximately 30 minutes. exit the train at your downtown destination. continue to your destination. exit terminal 1  2  3 or international on the arrivals level. locate a taxi dispatcher and line up to get the next available taxi. load your baggage into the taxi. give the driver your destination in downtown san francisco. ride for approximately 25 to 35 minutes  until you reach your destination. pay the taxi driver. unload your baggage and continue to your downtown destination. find the departures level of your terminal. exit the airport at the departures level. locate the shared vans shuttles sign. tell the driver your destination. ride in the van until the driver reaches your destination. pay the driver after he unloads your baggage. board the blue line on the air train  until you reach the rental car center station. rent a car. exit the airport heading west  turn right at the fork. follow the us 101 north until you see the octavia fell exit. scheduling your wingz airport ride takes just a few second. you will receive a confirmation with your wingz driver s contact info. text your driver upon landing to determine a pick up spot at the departures level. your wingz driver will be waiting for you at the curb.
question	170	drive on the right side of the road. get a license. don t drive over the speed limit. drive in the extreme right lane if you are traveling slower than other traffic  be alert for traffic exiting and entering the road  particularly if the right side is not curbed. use turn signal indicators in the direction you want to go when changing lanes  turning  and waiting at signals  etc. keep in mind that women can t drive in this area.
question	171	dial your country s exit code. dial  91   the country code for india. put in the appropriate area code. finish the number. call india from the usa or canada. dial  00  from most other countries. dial  0011  to call india from australia. use  001  or  002  to call from various asian countries. dial india from indonesia. call india from japan. call india from israel.the exit code for israel depends on the telephone carrier you use. call india from brazil. call india from chile. dial india from columbia.
question	172	consult your doctor about whether you should be hospitalized. gets lots of rest. stay hydrated. take acetaminophen to reduce pain and fever. prevent further mosquito bites. discuss your travel history with your doctor. check yourself for mosquito bites. suspect yellow fever if you have flu like symptoms. visit your doctor for testing. be alert for the recurrence of more serious symptoms. get vaccinated. use insect repellent. wear protective clothing. protect yourself throughout the day and night.
question	173	locate the road entrance. drive or walk up the road. be very cautious when going through the tunnel. pay at the main entrance. browse through the visitor s booth. walk the trail. learn that there are three separate staircases on the trail. go through the artillery observation platform. follow the path towards the top and enjoy the view.
question	174	multiply the radicands. factor out any perfect squares in the radicand. place the square root of the perfect square in front of the radical sign. square a square root. multiply the coefficients. factor out any perfect squares in the radicand  if possible. multiply the square root of the perfect square by the coefficient.
question	175	consult your doctor about whether you should be hospitalized. gets lots of rest. stay hydrated. take acetaminophen to reduce pain and fever. prevent further mosquito bites. discuss your travel history with your doctor. check yourself for mosquito bites. suspect yellow fever if you have flu like symptoms. visit your doctor for testing. be alert for the recurrence of more serious symptoms. get vaccinated. use insect repellent. wear protective clothing. protect yourself throughout the day and night.
question	176	do a search on the internet or your cattle breeds book on  corriente  cattle. study the characteristics of the breed. memorize the details and characteristics of this breed. go on a field trip or road trip and see if you can find farms and ranches with corriente cattle.
question	177	get a glass. pour the apple cider into the glass. pour the lager into the glass. stir with a bar spoon. let settle. top off. pour the hard cider at an angle into the glass. hold the tablespoon upside down over the glass. pour the guinness over the center of the tablespoon.
question	178	do some split kicks. kick to the side for t kicks. stretch in a split position. do heel stretches. try a bow and arrow stretch. pull your left thigh into the side of your body. place your left arm under your knee. grasp your hands behind your back. extend your leg. grab your foot with the opposite hand. pull your leg closer to your ear. loop your arm behind your leg. release your foot and connect your hands. get into the captain s pose. bring your left arm in front of your left thigh. shift your weight. grasp your hands behind you. tuck your left shin into your chest. release your arms. straighten your leg. grab your left foot with your right hand. release your left arm in front of you. let go of your foot and connect your hands. get into the bow and arrow stretch. wrap your left arm around your left leg. release your foot and grab left hand with your right hand. kick your left leg into the air. grab onto your left foot with your left hand. bring your left arm down and around your thigh. connect your hands behind your back.
question	179	purchase fresh beetroots. trim the leaves off the beetroot. wash the beetroot. store the cleaned beetroots. peel the beetroot. serve raw sliced beetroot as an appetizer. add shredded beet to a recipe. wrap your beetroots in foil. bake the beetroots. peel and trim the cooked beetroots. make a baked beetroot salad. quarter and trim your cleaned beetroots. prepare a stovetop basket steamer. steam the beetroots. peel and serve the beetroots.
question	180	inventory potential roach habitats in your home. check these areas for infestation. note any areas roaches would live  feed  or lay eggs. check areas roaches may live for unpleasant smells. clean areas of any food debris or standing water. use borax if you are uncomfortable making boric acid. react excess hydrochloric acid  muriatic acid  with borax to produce boric acid and salt water. filter out the boric acid crystals. take the borax or boric acid and place it in a container. sprinkle or spray the borax or boric acid on target areas. remove electrical outlet covers  dust inside the walls with borax. cover any noted areas with a light dusting of insecticide. sprinkle the borax or boric acid  dry  on any carpet or rug. wipe down any targeted areas with a damp cloth before using the surface.
question	181	stir all the ingredients together. alternatively  shake the ingredients together in a jar. cut or multiply the ingredients as needed. add chocolate or other baking chips. use nuts. mix in dried fruit. combine with cinnamon and other warm spices. save fresh ingredients for later. store the mix in a sealed  labeled jar. include instructions.
question	182	obtain a chess board. learn the basic rules. find an opponent. do finger stretches before you begin to play. face off against your opponent over the chess board. inspect everything about the table. move first if you re playing. continue playing until one player wins or both draw. play standard games of chess. play a slightly longer game. practice with stronger players. study game tactics.
question	183	know the details behind classic chrysler vehicles before you begin your search. try a local search for a classic chrysler by looking at the newspaper classifieds. buy a regional vehicle trader publication at convenience stores or gas stations as an alternative means to finding a classic chrysler in your area. look nationally and internationally for a classic chrysler by surfing the internet. try running a chrysler search at fossilcars.com. narrow your selection down to one vehicle or a small handful to do further research. refer to the online version or a hard copy of the kelley blue book to determine the vehicle valuation of the chrysler that you are considering. contact the seller and iron out a price. settle on how  after purchasing a classic chrysler  it will make its way to you. discuss payment and wrap up the transaction. finished.
question	184	increase your horse s time out on pasture. keep your horse s stable well ventilated. store hay properly. use low dust bedding in your horse s stall. clean your horse s stall. wet down indoor arenas or arenas with little to no window or ventilation. eliminate hay from your horse s diet. soak your horse s hay before feeding it to him. feed your horse a complete pelleted feed. add low dust foods to your horse s diet. feed your horse at chest level. give your horse systemic corticosteroids. administer a bronchodilator. consider aerosolized steroids. avoid certain medications.
question	185	bring water and cleaning agent to a boil. test the crud s bond. dislodge the crud. add water to baking soda. remove stains with fabric softener. freeze off burnt on foods and other materials. scrub stains with aluminium foil. use cottage cheese as a paste for stains. scrub with apple cider vinegar. soak copper in beer. scrub with lemon slices and salt. make a cream of tartar and water bath. use ketchup as a paste.
question	186	buy organic milk. be aware that if you are trying to drink more milk by putting milk inside your tea  the benefits of the tea will be cancelled entirely. be aware of all the vitamins and minerals found in milk calcium  keeps bones and teeth healthy  helps your body maintain bone mass. drink milk to avoid illnesses. be aware as to whether or not milk or milk products are made out of pasteurized milk or not. drink milk to help reduce acidity. drink milk to have clear skin. drink milk for healthy teeth. drink milk to lose weight.
question	187	buy 1 2 liter bottle of diet coke. buy 1 package of mentos. obtain one roll of masking tape. buy protective goggles. find a wide open space to build the rocket in. wear appropriate attire. gather your materials. cut 2 4 inch  10.2 centimeter  strips of masking tape. remove 5 to 7 mentos from the roll. lay the mentos on to one of the 4 inch  10.2 centimeter  strips of tape. place the other 4 inch  10.2 centimeter  strip of tape on top of the mentos. cut a 3 inch  7.62 centimeter  strip of masking tape and roll it around your finger  sticky side out. attach the rolled tape to the top of the mentos. fasten the mentos cartridge into the bottom of the diet coke cap. double tape the cartridge to the cap. twist the  loaded  cap on to the diet coke bottle. shake the bottle.  launch  it  try again. enjoy the show. clean up after yourself. try different amounts of mentos. combine mint and fruit mentos in one cartridge. make a larger rocket. make it a contest.
question	188	
question	189	gather needed materials. turn off and connect the consoles. connect the consoles to separate televisions or monitors. turn on your consoles. turn your consoles off and set everything up. turn on your consoles and create a link. play your system link game.
question	190	look on the driver s side front door panel. check the driver s side front door lock pillar. locate the color code on the manufacturer s label. find the vehicle identification number  vin  under the dashboard. check other locations if the vin is not under the dashboard. call the ford company. enter your vin on a website.
question	191	learn the proper way to hold the horn. form an embouchure with your lips. blow into the horn. memorize the keys. learn how to control volume. learn how to read sheet music. learn the notes you re playing. understand the clefs. recognize the tempo. play a simple melody. play more complex melodies. play standing up. learn advanced techniques. get lessons. watch tutorial videos. practice  practice  practice. ask questions. store your horn in a sturdy case. clean the instrument after you play it. conduct maintenance once a week or so. clean your instrument thoroughly every few months. repair any broken pieces.
question	192	listen for grinding. pay close attention to vehicle vibrations. tie the vibration to engine speed or wheel speed. pay attention to jerky shifts. watch the tachometer. look for leaking transmission fluid. make sure the transmission fluid is full. assess the state of the transmission fluid. take note of how long it takes to shift out of park. ensure the transmission will shift into each gear. check the level of gear oil in the transmission. determine if the gear oil has been burnt. listen for sounds with the clutch pressed and de pressed.
question	193	go to a butcher that sells specialty meat. select a cut of fresh meat. learn how to bring out the best flavor in goat meat. cube the coat meat. marinate the meat and vegetables. brown the meat and vegetables. add the stock and tomato paste. simmer the stew for two hours. serve the stew when the meat is tender. choose goat meat to roast. marinate the goat meat. preheat the oven to 300  f  150  c . wrap the meat in foil. roast the meat for one hour. serve the meat with rice and peas.
question	194	
question	195	look for an ionic or tourmaline dryer for thick  frizzy hair. consider a ceramic or porcelain dryer if you have fine or dry hair. opt for a titanium dryer if you have a lot of hair. choose a blow dryer in the proper wattage range. pay attention to the dryer s weight. find a dryer with multiple heat settings. opt for a dryer with a cool setting. consider purchasing a dryer with a diffuser. decide whether you need a dryer with a concentrator nozzle.
question	196	identify your target market. create materials for marketing a business. choose marketing channels.
question	197	choose the components you would like to build the computer with. when you receive the parts  assemble them together  as detailed below unscrew one side panel of the pc caseinstall the cpu into the motherboard cpu socket  be careful to align the cpu properly into the socket. install the operating system  by starting the computer  inserting the setup disk  then selecting  select boot device   followed by the cd dvd drive  for example  ide cd dvd device   then follow the instructions on screen
question	198	
