question	85	check for an elevated heart rate.all types of shock  including distributive shock  typically present with a faster than normal heart rate  over 100 beats per minute . observe an increased respiratory rate.in addition to an elevated heart rate  all types of shock also typically present with rapid respiration. feel for warm extremities.in distributive shock specifically  which includes septic shock   a person s extremities  hands and feet  will typically be warmer than usual. notice decreased urination.in shock  because the body perceives a lack of effective blood flow and oxygenation  it will seek to conserve fluids. evaluate for a fever.because infection   sepsis   is the number one cause of distributive shock  it is key to test for the presence of a fever. look for signs of confusion.shock typically presents with confusion  and often with a decreased level of consciousness. measure blood pressure.in shock  the blood pressure is lower than normal. take note of an infection preceding the onset of shock.the number one reason for someone to go into distributive shock is due to an infection that gets worse and spreads to the bloodstream  called  sepsis  . consider the possibility of anaphylaxis.another reason for someone to go into distributive shock is due to anaphylaxis   a systemic allergic reaction  which may occur in response to a bee sting or other allergy. assess for other common causes of distributive shock.other common causes of distributive shock include  sirs   systemic inflammatory response syndrome   pancreatitis  kidney problems  called  addisonian crisis    burns  toxic shock syndrome  most common in women who are menstruating who have left a tampon in for too long   and  neurogenic shock   a subtype of distributive shock caused by a spinal cord injury that results in decreased blood vessel tone . test for lactic acidosis.a blood test for lactate can indicate the presence of lactic acidosis. evaluate white blood cell counts.measuring white blood cells via a blood test is also very helpful in assessing for the presence of an infection  which is the leading cause of distributive shock. assess vital organ function. opt for other diagnostic tests as needed to determine the underlying cause. begin treatment.
question	86	determine your skin type. decide if you have sensitive skin. assess any conditions that affect your skin. consider your complexion. record your findings. determine how much money you want to spend. decide whether you prefer organic or synthetic products. get to know the active ingredients. figure out how comprehensive you would like your line to be. ask for recommendations. try samples. read online reviews. consider side effects and consumer reports. buy the basics  then add on.
question	87	try books and tapes on spoken english. read out loud. record your practice sessions.use a hand held voice recorder  or speak through a microphone connected to a stereo set or boom box. take your time. maintain good posture. support your speech from the diaphragm. practice diaphragmatic breathing. stand tall. get assessed by a local speech and language therapist. see a speech and language pathologist or a psychologist. get braces. look for possible physical causes to your speech disorder. determine if the cause is a learning disability. consider if your speech disorder was caused by an emotional problem. find out whether your speech impediment is permanent. see if your speech impediment is genetic.
question	88	know what muscle atrophy means. learn about disuse atrophy  the leading cause of muscle atrophy. understand the causes of neurogenic atrophy. recognize the symptoms of muscle atrophy. seek medical advice if you think you are experiencing muscle atrophy. work with experts. consult your doctor or health provider before starting on any muscle building programs. find a personal trainer or physical therapist. start easy  then work your way up to more intense exercise. begin with water exercise or aquatic rehabilitation. walk around the pool. do knee lifts in the pool. complete water push ups. move on to body weight exercises. learn how to do squats. perform lunges. try some triceps dips. do some basic ab crunches. try resistance exercises. incorporate some cardio into your workouts. don t forget to stretch. learn some specific stretches. eat plenty of protein. increase your carbohydrate intake. eat good fats such as omega 3 fatty acids. understand why stress is bad for your muscles. get enough sleep.
question	89	ask yourself if you want to improve your sexual function.if you have a low sex drive  or if your sex drive has declined with age  you might want to give it a boost with some extra testosterone. ask yourself if you want a healthier body.men who suffer from low testosterone may experience increased body fat and larger breasts.at the same time  they might experience a decrease in bone mass  muscle  and overall energy levels. ask yourself if you want a healthier mind.low testosterone can lead to depression and reduced self confidence. think about easing your menopause. identify whether you want to transition from female to male. ensure you will be safe while using testosterone. learn about the effects and side effects of using testosterone. make a list of questions and concerns about testosterone before visiting the doctor.as with any other health condition or prescription drug  it is important to be informed before talking with your doctor so as to avoid confusion or misunderstanding. consult a doctor about whether you need to take testosterone.your doctor can run tests to help you determine if supplemental testosterone would help you.in men  low testosterone is diagnosed by a full body examination that helps rule out alternatives to low testosterone levels like pituitary tumors or thyroid problems. don t assume you need testosterone just because your levels are lower than average.normal testosterone levels can vary from person to person  and there is in fact no absolute definition of low testosterone. stay aware of cardiovascular problems.testosterone has the potential to negatively impact your cardiovascular health. look for other side effects. monitor your mental  physical  and sexual health for changes and side effects.testosterone therapy can cause significant changes in your mental  physical  and sexual health  and it is important that you keep track of these changes and any side effects so that you can discuss them with your doctor during your next visit. use testosterone patches.patches are simple to use. take testosterone through injections.injections are usually the least expensive and fastest form of delivery  and they can be delivery weekly  biweekly  or monthly  depending on which compound your doctor prescribes. take testosterone nasal gel.this method works similarly to any other nasal spray  except you do not breathe in when applying the gel. use caution.
question	90	eat the right vegetables and fruits. cut out processed and refined foods. avoid alcohol and tobacco products. find sources of iodine. increase your selenium intake. take vitamin a supplements. get more aerobic exercise. see your doctor. learn about thyroid conditions. recognize symptoms of hyperthyroidism. learn the causes of hyperthyroidism. recognize the symptoms of hypothyroidism. consider the causes of hypothyroidism. get a diagnosis if you think you might have hypothyroidism. know the side effects of hypothyroidism. take synthetic hormones for hypothyroidism. ask about radioactive iodine for hyperthyroidism. take other medications for hyperthyroidism. consider surgery for hyperthyroidism.
question	91	buy fresh meat with a healthy pink color to grill. clean the meat and trim away any imperfections. consider marinading the meat before grilling it. bring the pork to room temperature before grilling. season the meat on the outside immediately before grilling. start the grill 20 or 30 minutes before grilling tenderloin. sear the pork for 2 minutes on each side. move the meat to the cooler side of the grill. cook for approximately 20 minutes. remove your pork tenderloin from the grill and let it rest for 15 minutes. slice the pork into 3 4 inch  1.9 cm  thick portions and serve immediately. while cool  slice tenderloin into steaks an inch and a half thick. season both sides of the meat liberally. sear the pork on each side. serve grilled tenderloin on a bun  sandwich style. butterfly the marinaded tenderloin. prepare the stuffing. spread your stuffing onto the pork. tie up the stuffed tenderloin. grill normally. let rest  then remove the twine.
question	92	identify the forms of incontinence that you can prevent. stop smoking. lose weight to prevent incontinence. increase zinc in your diet. increase your lycopene intake. eat more soy. add more omega 3 fatty acids to your diet. stay hydrated. practice timed voiding. avoid incontinence causing food and drinks. try out some kegel exercises. avoid diuretics. consider avoiding muscle relaxants. identify antihypertensive drugs that may cause incontinence. look for symptoms of overflow incontinence. see your doctor. identify medications that can lead to overflow incontinence. ask about medications designed to treat overflow incontinence. consider surgical options for severe symptoms. identify symptoms of stress incontinence. identify causes of stress incontinence. lose weight. use kegel exercises. consider surgical weight loss options. identify causes of neurogenic bladder incontinence. try physical psychological therapy options. discuss medication options with your doctor. discuss surgical options with your doctor. identify the symptoms of an overactive bladder. use timed voiding. ask your doctor about potential medications.
question	93	decide to whom you will donate. contact a transplant center. get matched. have a health screening. know the risks of surgery. understand the long term risks. figure out the finances. ask the doctor what kind of surgery you will have. follow all pre operative instructions. be prepared for the recovery period. get follow up treatment. adhere to post surgical restrictions.
question	94	understand the common stereotype of nammers. get a facebook. dress like a nammer. listen to nammer music. get a nammer attitude. have a nice car  or a boyfriend with a nice car. hang out in nammer hotspots. you should now be nammer  and don t be afraid to claim you re a nammer. get a dragon tattoo.
question	95	click the  sign up  link located at the top of the aol homepage. enter your name. create a username. make a password. enter your date of birth. select your gender. enter your zip  postal  code. select a security question. enter your mobile number. enter an alternate email address. click  sign up  button. chat using aim. ensure you have a modem. choose a plan. sign up. download the aol software. connect to aol.
question	96	add liquid ingredients and ice to a blender. blend until smooth. serve. optionally  add a bacardi 151 floater. fill a glass with ice. add the liquid ingredients. add the following ingredients in large bucket 750 ml of blackberry brandy750 ml of 99 bananas  banana liqueur750 ml of bacardi light rum750 ml of captain morgan spiced rum750 ml of malibu coconut rum. mix all ingredients well. on the day of celebration  open a bottle.
question	97	determine the application. acquire the right tools. purchase the paint. painting is much the same process as with latex  but the drying time for alkyd paints is longer  and the need for ventilation is greater. before the final coat of paint  sand with a very fine grit sanding sponge or paper  wipe off the surface with a clean cloth  and then wipe with a tack rag.
question	98	understand why high blood pressure  bp  is dangerous. be aware that diet and lifestyle can cause hypertension. understand that some medications may cause your child to develop high blood pressure. be aware that some infants can be at a higher risk of developing high blood pressure. learn how to monitor your child s bp at home. purchase a bp monitor that fits your child. attach the cuff to your child s arm. place a stethoscope under the cuff. pump up the pressure of the cuff. take a reading of your child s blood pressure. recognize high blood pressure in your child. monitor any headaches your child feels. take your child to the hospital if you notice signs of brain trauma caused by severe blood pressure. watch for any signs that your child s heart is struggling with the severe blood pressure. check your child s urine for blood. understand that you should take your child to get evaluated by a doctor  but that there is a chance of misdiagnosis. help prevent misdiagnosis by having your child s blood pressure checked twice during your visit to the doctor s office.
question	99	understand that it is the north carolina commissioner of banks  nccob  that regulates north carolina mortgages and lending. present yourself as a north carolina mortgage broker only if you are licensed or you meet one of the exempt categories. apply for a license as a north carolina mortgage broker through the national mortgage licensing system  nmls at http   mortgage.nationwidelicensingsystem.org . request a criminal background check  which will include presenting your fingerprints to the nmls for processing by the fbi. complete education requirements required by the 2008 secure and fair enforcement for mortgage licensing act  safe . pass the national and north carolina mortgage loan origination tests. give authorization for a credit report through the nmls. provide a  75 000 surety bond. establish a principal mortgage broker office in the state of north carolina. update your form mu4 information with nmls if you change employers after becoming a licensed mortgage broker.
question	100	wear as much black as possible. pay attention to the actual game  this is vital as sox fans are not casual. understand the history of the white sox. come ready to tailgate. go to schaller s pump on at least once per season and sip a south side beer in the can. be ready to laugh in the face of cub fans who will come up with countless  non baseball  reasons for why the north side club is better than the south side club. when going to white sox games  take the el. never  and i repeat  never throw anything on the field. learn about the sox rivals  minnesota twins  detroit tigers  cleveland indians  and chicago cubs  their biggest rival .
question	101	
question	102	find the appropriate number. dial with a touchtone phone. find the option you want. skip to a representative. email fedex. choose a label for your inquiry. fill in your information. fill in your comment. pick a way to file. fill in biographical information. fill in the package information. send in your form.
question	103	learn the basic rules. don t just smash the buttons. practice your gameplay. learn offensive plays. build a good defense. pressure your opponent. dribble and pass the ball. don t rush.
question	104	use the number of valve cover bolts to narrow down the type of engine you have in front of you. locate the id tag under coil attaching bolts for six cylinder and some eight cylinder engines. check under the dipstick attaching bolts on eight cylinder  352 model engine. look under the heat indicator bulb  carburetor attaching stud  and ignition coil bolt if you still can t find the tag. learn to read the id tag appropriately. looks for nine digit casting tags to learn more about your engine s make and model. read the first two digits in the identification tag to find the year the engine was made. read the third digit in the casting number to determine the engine design. make sure that the fourth digit is always an  e.  this digit stands for the type of part. read the next 4 digits  which are the last digits in the motor number. check the last digit  usually a letter  to determine the version of your part.
question	105	this document assumes that you might have another vendor version of java installed on your ubuntu linux system  such as openjdk or oracle java which is common when you use ubuntu linux.  first  of all we will remove and disable other vendor versions of java so there is no system conflict with multiple versions of java.let s assume you have openjdk installed on your system if so we are going to remove openjdk by issuing the following commands to remove openjdk from your system issue the following command type copy paste  sudo apt get purge openjdk   this command will completely remove openjdk jre from your system second  we will disable oracle java if it is installed by editing the  etc profile system path.in this exercise we will comment out the references to oracle java in the system wide  etc profile file i also recommend deleting the oracle java folders if you have them so they do not cause system conflicts.for example if you have oracle java installed in  usr local java follow these instructions to remove oracle javatype copy paste  cd  usr local javatype copy paste  rm  rf jdk1.7.0type copy paste  rm  rf jre1.7.0 if oracle java is installed on your system you will comment out the references to oracle java in the  etc profile  .profile or .bashrc file. for example  as root  use a text editor such as nano or gedit to edit your  etc profile. you may have a file that looks like this java home  usr local java jdk1.7.0path  path  home bin  java home binjre home  usr local java jre1.7.0path  path  home bin  jre home binexport java homeexport jre homeexport path you want to make sure you comment out the references to oracle java  using the    symbol in your  etc profile  .profile and .bashrc file so change the file to look like this   java home  usr local java jdk1.7.0  path  path  home bin  java home bin  jre home  usr local java jre1.7.0  path  path  home bin  jre home bin  export java home  export jre home  export path save the  etc profile file and exit download the ibm java 7.0 sdk and jrenote in order to download ibm sdk jre you will have to be a registered user  following the provided links from the ibm website in order to register. download the version of ibm java sdk and jre for your system architecture  in this case we are using the ibm java sdk jre for 64 bit ubuntu linux  which is ibm java sdk 7.0 0.0 linux x86 64.tgzibm java jre 7.0 0.0 linux x86 64.tgz once the ibm java sdk and jre has been downloaded you will proceed to set up a development environment for the ibm jdk and jre. create a directory to hold the ibm java sdk and jre using the following command type copy paste  sudo  s mkdir  p  opt ibm javatype copy paste  chmod  r 755  opt ibm javathis makes the directory available to all users on the system change into the download directory and copy the ibm java sdk and jre to  opt ibm java  directorytype copy paste  cd  home  your user name  downloadstype copy paste  sudo  s cp  r ibm java sdk 7.0 0.0 linux x86 64.tgz  opt ibm javatype copy paste  sudo  s cp  r ibm java jre 7.0 0.0 linux x86 64.tgz  opt ibm java next change into your ibm java directorytype copy paste  cd  opt ibm java make the compressed ibm java binaries executable for all users on the system by running the following commands type copy paste  sudo  s chmod a x ibm java sdk 7.0 0.0 linux x86 64.tgztype copy paste  sudo  s chmod a x ibm java jre 7.0 0.0 linux x86 64.tgz unpack the ibm java sdk by issuing the following commandstype copy paste  sudo  s tar xvzf ibm java sdk 7.0 0.0 linux x86 64.tgztype copy paste  sudo  s tar xvzf ibm java jre 7.0 0.0 linux x86 64.tgz the ibm sdk and the jre will unpack into a single directory called  opt ibm java ibm java x86 64 70 also  you need to edit the system wide path  etc profile in order to create a system wide path for the ibm java sdk jre on ubuntu linux. enter the following information below export path   path   opt ibm java ibm java x86 64 70 bin  opt ibm java ibm java x86 64 70 jre bin  path save the file and exit next  inform the system that ibm java sdk jre is availabletype copy paste  sudo update alternatives   install   usr bin java   java    opt ibm java ibm java x86 64 70 jre bin java  1type copy paste  sudo update alternatives   install   usr bin java   javaws    opt ibm java ibm java x86 64 70 jre bin javaws  1type copy paste  sudo update alternatives   install   usr bin javac   javac    opt ibm java ibm java x86 64 70 bin javac  1 inform your ubuntu linux system  that ibm java sdk jre must be the default java. also reload your system wide path  etc profile by typing the following command  type copy paste  . test to see if ibm java installed correctly by using the command type copy paste  java  version you should receive a message that displays java version  1.7.0 ea java tm  se runtime environment  build pxa6470 20100531 04 ibm j9 vm build2.6  jre 1.7.0 ibm j9 2.6 linux amd64 64 jvmxa6470 20100522 58582  jit enabled  aot enabled j9vm   r26 head 20100521 1457 b58494 jit dev 20100507 15747gc   r26 head 20100521 1652 b58499j9cl   20100522 58582 jcl   20100514 02 based on sun 7b76 test that your ibm java compiler works by using the command type copy paste  javac  versionyou should receive a message that displays javac 1.7.0 internalyou can also switch between different installed vendors of java  such as openjdk  oracle and ibm by using the command type copy paste  sudo update alternatives   config javamake sure you select the java directory which references ibm java and press enter.
question	106	verify that the egr valve needs to be replaced  and purchase the part. park vehicle on a flat surface and open the hood. allow the engine to cool. remove the negative     battery terminal. remove the plastic engine cover. disconnect the wire connection from the egr. spray some wd 40 around the base of the egr valve and over the bolts to help loosen them. using a 12mm socket with extension ratchet  remove both bolts. remove the old egr valve and gasket from its base. clean the egr valve mounting base  the two in out holes on the engine  with carb cleaner  as there will be burned residue and buildup. make sure the base is clean and smooth before installing the new egr valve. spray a bit of carb cleaner into the new egr valve to prime it. set the new gasket over the base and place new egr valve over it. align it with the bolt holes. insert bolts and tighten with ratchet. reconnect wiring to the new egr valve. reconnect negative     terminal to battery. note  radio presets are lost when you disconnect the battery 
question	107	brush up on your knowledge about government. ask your parents and other family members about their political leanings. learn about the history of major political parties. understand the main differences between parties. communicate with elected officials and party candidates. stay up to date on political news. take a test on the internet. follow your gut feeling. think about health care issues. consider your thoughts about education. assess your feelings about taxes and welfare. research energy and environmental issues. learn about us history and major us political parties. make a comparison sheet of republican and democratic values. consider third parties.
question	108	recognize that there are several division leagues that make up the minor league baseball organization. recognize that all major league baseball teams have at least one ball club assigned to each minor league baseball league designation. find out the location of your nearest minor league baseball team  unless you are so devoted to a certain major league team that you d like to invest your time in watching only their club s games. recognize that the minor league baseball team s schedule is much shorter than that of a major league baseball team s games. obtain the tickets to the game. plan ahead  when deciding what to pack for the few hour minor league baseball event. realize that most teams  games aren t ever played in big cities major metropolitan areas  but are played in bigger cities bigger than the towns you might not be recognizing as cities are . plan your travel route to the stadium  well before you leave your home. travel to the stadium. locate the section along with seat number  s  to find the seats you ll need to sit in to watch the game. wait it out  until the game begins.
question	109	use available buses. consider the available los angeles metro rail system. set up a carpooling system. live near your work. keep your car costs down.
question	110	learn to write well. learn to shoot photos and video. learn about other sports. round out your knowledge. do an internship. become an expert on baseball. learn about baseball history. learn about the players. read classic sports journalism. practice your writing. consider freelance opportunities. start small when hunting for jobs. have realistic expectations. apply for positions. join the bbwaa. know your passions. be prepared to relocate. expect to work an unusual schedule. understand the travel requirements. follow your dream.
question	111	select trouser cut maroon pants for a business look. try maroon skinny jeans for a casual look. choose straight cut maroon pants for a polished look. don maroon leggings as athleisure wear. choose a suit jacket in the same color. layer with classy neutrals. add metallic and jewel tone accessories. try an oxford dress shirt or a top in a formal fabric. select a slightly cropped length. choose maroon pants in a fine material. play up the collegiate vibe of maroon. choose a 5 pocket style or casual pant fabric. pair with casual fabrics on top. don casual shoes. roll the cuff. embrace patterns.
